{"run":156,"commit":"e44bc8e","metric":136.626,"metrics":{"bundle_raw_kb":453.853,"js_files":9,"css_kb":0},"status":"keep","description":"Omit timestamp from synthetic run-error chunks","timestamp":1777648600624,"segment":0,"confidence":109.4676503972758,"asi":{"hypothesis":"The synthetic RUN_ERROR chunk created in the catch path is consumed for message/code/error metadata, not timestamp. Omitting timestamp should preserve error behavior and shrink route code.","outcome":"Primary metric improved; build and typecheck pass.","risk_note":"Synthetic catch-path run errors no longer include a timestamp. Native provider chunks are unchanged."}}
{"run":157,"commit":"04e818a","metric":136.611,"metrics":{"bundle_raw_kb":453.714,"js_files":9,"css_kb":0},"status":"keep","description":"Remove duplicate nested error object from enriched run-error chunks","timestamp":1777648643865,"segment":0,"confidence":108.37752808988932,"asi":{"hypothesis":"RUN_ERROR chunks already expose formatted message/code at top level. The nested `error` object duplicates the same data in both enriched provider chunks and synthetic chunks, so removing it should preserve displayed errors while shrinking route code/payloads.","outcome":"Primary metric improved; build and typecheck pass.","risk_note":"If a downstream consumer reads chunk.error.message instead of top-level message/code, it would lose data. Current UI displays String(error) from useChat, which should use top-level fields."}}
{"run":158,"commit":"9fae7ab","metric":136.606,"metrics":{"bundle_raw_kb":453.667,"js_files":9,"css_kb":0},"status":"keep","description":"Remove top-level error code from run-error chunks","timestamp":1777648666186,"segment":0,"confidence":107.29810901001103,"asi":{"hypothesis":"formatOpenRouterError already prefixes HTTP status into the human-readable message. The separate chunk `code` duplicates that status for this UI, so removing it should preserve user-visible errors while shrinking error chunks.","outcome":"Tiny primary improvement; build and typecheck pass.","risk_note":"Programmatic consumers no longer receive a separate RUN_ERROR code field from our enrichment/synthetic errors. User-facing message still contains status when available."}}
{"run":159,"commit":"60ae41b","metric":136.596,"metrics":{"bundle_raw_kb":453.623,"js_files":9,"css_kb":0},"status":"keep","description":"Stop returning unused code from OpenRouter error formatter","timestamp":1777648692742,"segment":0,"confidence":106.83388704318868,"asi":{"hypothesis":"After removing code fields from RUN_ERROR chunks, formatOpenRouterError no longer needs to return a separate `code`; the status remains embedded in message. Removing it shrinks error formatting code.","outcome":"Primary metric improved; build and typecheck pass.","risk_note":"Error formatter now exposes message only. Reintroduce code if programmatic error handling is added."}}
{"run":160,"commit":"2ac05ab","metric":136.586,"metrics":{"bundle_raw_kb":453.553,"js_files":9,"css_kb":0},"status":"keep","description":"Return formatted OpenRouter errors as strings","timestamp":1777648725596,"segment":0,"confidence":106.2566079295136,"asi":{"hypothesis":"OpenRouter error formatting now only produces a message. Returning a string directly instead of `{message}` removes object wrapping and simplifies enriched/synthetic RUN_ERROR creation.","outcome":"Primary metric improved; build and typecheck pass.","risk_note":"Formatter API is narrower; re-expand only if structured error fields are needed."}}
{"run":161,"commit":"460cac8","metric":136.577,"metrics":{"bundle_raw_kb":453.486,"js_files":9,"css_kb":0},"status":"keep","description":"Inline simplified run-error chunk creation","timestamp":1777648748312,"segment":0,"confidence":104.93746601413821,"asi":{"hypothesis":"After error formatting returns a string and code/error/timestamp were removed, createRunErrorChunk is a tiny single-use wrapper. Inlining it should now be beneficial unlike the earlier larger-object attempt.","outcome":"Primary metric improved; build and typecheck pass.","risk_note":"Catch-path RUN_ERROR construction is inline; re-extract if more call sites appear."}}
{"run":162,"commit":"48e20f0","metric":136.549,"metrics":{"bundle_raw_kb":453.39,"js_files":9,"css_kb":0},"status":"keep","description":"Inline provider run-error enrichment branch","timestamp":1777648776475,"segment":0,"confidence":103.67132116004167,"asi":{"hypothesis":"enrichRunErrorChunk is now a single-use helper that only sets message from captured provider error. Inlining the branch should remove a function boundary while preserving RUN_ERROR enrichment.","outcome":"Primary metric improved; build and typecheck pass.","risk_note":"RUN_ERROR branch is more verbose inline; re-extract if enrichment grows again."}}
{"run":163,"commit":"f3e9eeb","metric":136.528,"metrics":{"bundle_raw_kb":453.309,"js_files":9,"css_kb":0},"status":"keep","description":"Remove pre-stream synthetic status events","timestamp":1777648817470,"segment":0,"confidence":103.19508284340033,"asi":{"hypothesis":"The UI only needs meaningful status once the agent run or tools start. Pre-stream 'Model ready' and 'Request sent' events add noise and code before any stream evidence, so removing them keeps observability focused on actual run/tool progress.","outcome":"Primary metric improved; build and typecheck pass.","risk_note":"Status text appears later (on RUN_STARTED/tool events) instead of immediately after request setup."}}
{"run":164,"commit":"592db94","metric":136.49,"metrics":{"bundle_raw_kb":453.169,"js_files":9,"css_kb":0},"status":"keep","description":"Remove first-token synthetic status event","timestamp":1777648859706,"segment":0,"confidence":102.74148936170238,"asi":{"hypothesis":"First-token status duplicates visible streamed text/typing behavior and requires sawFirstToken state. Removing it keeps status observability focused on run start, tool events, completion, and errors.","outcome":"Primary metric improved; build and typecheck pass.","risk_note":"Status no longer changes at first token arrival. Users still see assistant text streaming in the message area."}}
{"run":165,"commit":"ad07d3f","metric":136.467,"metrics":{"bundle_raw_kb":453.094,"js_files":9,"css_kb":0},"status":"keep","description":"Remove run-start synthetic status event","timestamp":1777648890699,"segment":0,"confidence":102.16816499206816,"asi":{"hypothesis":"RUN_STARTED status is redundant with the typing indicator and pending stream. Removing it further focuses status updates on tool events, completion, and errors.","outcome":"Primary metric improved; build and typecheck pass.","risk_note":"Status text may not appear for pure text runs until completion/error. Typing indicator still shows loading."}}
{"run":166,"commit":"eb93ea5","metric":136.457,"metrics":{"bundle_raw_kb":453.039,"js_files":9,"css_kb":0},"status":"keep","description":"Remove run-complete synthetic status event","timestamp":1777648925508,"segment":0,"confidence":101.80189673340533,"asi":{"hypothesis":"Completion is already evident when loading stops and follow-ups appear. Removing the synthetic Complete status reduces status-event noise and server code while preserving tool/error status updates.","outcome":"Primary metric improved; build and typecheck pass.","risk_note":"Status text no longer explicitly says Complete; loading state and UI updates indicate completion."}}
{"run":167,"commit":"5434d3b","metric":136.415,"metrics":{"bundle_raw_kb":452.867,"js_files":9,"css_kb":0},"status":"keep","description":"Remove chat-route synthetic status events entirely","timestamp":1777648967617,"segment":0,"confidence":101.6854287217279,"asi":{"hypothesis":"After reducing status UI to latest text and keeping tool status events, chat-route synthetic lifecycle/error status events are redundant with typing state, follow-ups, and the error paragraph. Removing createStatusEvent eliminates dead status middleware.","outcome":"Primary metric improved; build and typecheck pass. Status custom events now come from server tools only.","risk_note":"Pure text runs no longer show status text, only typing/loading and final content. Tool runs still emit status labels."}}
{"run":168,"commit":"5d45da2","metric":136.395,"metrics":{"bundle_raw_kb":452.84,"js_files":9,"css_kb":0},"status":"keep","description":"Listen only for remaining tool status event name","timestamp":1777649001780,"segment":0,"confidence":101.22722513089174,"asi":{"hypothesis":"After removing chat-route `s` status events, the client only needs to handle tool status event `t`. Replacing the array includes check with direct equality shrinks event middleware.","outcome":"Primary metric improved; build and typecheck pass.","risk_note":"If chat-route lifecycle status events are reintroduced, update the client event filter."}}
{"run":169,"commit":"fdaee54","metric":136.345,"metrics":{"bundle_raw_kb":452.56,"js_files":9,"css_kb":0},"status":"keep","description":"Remove tool-ready status events after results are available","timestamp":1777649031319,"segment":0,"confidence":100.90975482524921,"asi":{"hypothesis":"Once a tool result is available, the tool widget/result itself communicates readiness. Keeping only start/in-flight tool status events preserves useful status feedback and removes redundant ready events.","outcome":"Primary metric improved; build and typecheck pass.","risk_note":"Latest status text may remain on the start/searching label after a tool result appears, but the rendered tool output shows completion."}}
{"run":170,"commit":"57d6756","metric":136.194,"metrics":{"bundle_raw_kb":451.901,"js_files":9,"css_kb":0},"status":"keep","description":"Remove remaining AG-UI status event state and tool emissions","timestamp":1777649064173,"segment":0,"confidence":100.90937499999919,"asi":{"hypothesis":"After reducing status UI to a single text label and retaining visible tool cards/states, the separate AG-UI status event channel is redundant for this tutorial harness. Removing status emissions and client state keeps tool observability in the message stream while shrinking both client and server code.","outcome":"Primary metric improved substantially; build and typecheck pass. Follow-up custom events remain; tool calls/results still render in chat cards.","risk_note":"The dedicated AG-UI live status demo is removed. If showcasing custom status events is a tutorial requirement, restore a minimal status channel."}}
{"run":171,"commit":"cf7e509","metric":136.185,"metrics":{"bundle_raw_kb":451.868,"js_files":9,"css_kb":0},"status":"keep","description":"Simplify custom event handler to only process follow-up events","timestamp":1777649092208,"segment":0,"confidence":100.34386328327379,"asi":{"hypothesis":"After removing status custom events, onCustomEvent only handles follow-up event `f`. Simplifying the handler removes empty control flow while preserving AG-UI follow-up mode.","outcome":"Tiny primary improvement; build and typecheck pass.","risk_note":"Additional custom event types will be ignored unless explicitly added back."}}
{"run":172,"commit":"f7b0283","metric":136.18,"metrics":{"bundle_raw_kb":451.812,"js_files":9,"css_kb":0},"status":"keep","description":"Inline single-use ToolWidget module into Chat","timestamp":1777649122058,"segment":0,"confidence":99.47330595482653,"asi":{"hypothesis":"ToolWidget is now used only by Chat and its defensive boundaries have been simplified. Inlining it should remove one module boundary while preserving weather/stock/search widget rendering.","outcome":"Small primary improvement; build and typecheck pass. Deleted the single-use ToolWidget module.","risk_note":"Chat.tsx becomes more monolithic and tool widget component observability is reduced. Re-extract if tool widget complexity grows or reuse appears."}}
{"run":173,"commit":"9b9e792","metric":136.171,"metrics":{"bundle_raw_kb":451.746,"js_files":9,"css_kb":0},"status":"keep","description":"Inline single-use MarkdownContent module into Chat","timestamp":1777649149890,"segment":0,"confidence":97.8253407370032,"asi":{"hypothesis":"The lightweight markdown renderer is only used by Chat. Inlining it removes another module boundary while preserving focused markdown rendering.","outcome":"Tiny primary improvement; build and typecheck pass. Deleted the single-use MarkdownContent module.","risk_note":"Chat.tsx is now much more monolithic, reducing component observability. Re-extract markdown rendering if reused or expanded."}}
{"run":174,"commit":"7b0344b","metric":136.168,"metrics":{"bundle_raw_kb":451.693,"js_files":9,"css_kb":0},"status":"keep","description":"Inline single-use storage helpers into Chat","timestamp":1777649174426,"segment":0,"confidence":96.22542204567976,"asi":{"hypothesis":"LocalStorage helpers are now only used by Chat. Inlining them removes a small module boundary while preserving settings persistence behavior.","outcome":"Tiny primary improvement; build and typecheck pass. Deleted the single-use storage module.","risk_note":"Chat.tsx grows further and storage helper observability is reduced. Re-extract if storage is reused or migration logic grows."}}
{"run":175,"commit":"96d0e89","metric":136.157,"metrics":{"bundle_raw_kb":451.643,"js_files":9,"css_kb":0},"status":"keep","description":"Inline single-use follow-up heuristics into Chat","timestamp":1777649253572,"segment":0,"confidence":95.33694048204684,"asi":{"hypothesis":"Follow-up text extraction and heuristic generation are now used only by Chat. Inlining them removes another small module boundary while preserving heuristic/model/AG-UI follow-up behavior.","outcome":"Primary metric improved; build and typecheck pass. Deleted the single-use followUps module and unused ChatMessage type.","risk_note":"Chat.tsx becomes more monolithic. Re-extract if follow-up logic grows or is reused. User concurrently reported a dev-server default.fetch runtime error unrelated to this inlining; address next by restoring the server entry shape."}}
{"run":176,"commit":"0bb95a1","metric":136.165,"metrics":{"bundle_raw_kb":451.653,"js_files":9,"css_kb":0},"status":"keep","description":"Restore TanStack Start server entry object shape for dev runtime","timestamp":1777649321918,"segment":0,"confidence":94.45419103314005,"asi":{"hypothesis":"The previous direct server handler export passed build/typecheck but broke Vite dev because TanStack Start dev server expects default.fetch. Exporting `{ fetch: createStartHandler(...) }` should restore runtime correctness with minimal bundle cost.","outcome":"Build and typecheck pass; metric regressed only 0.008kb versus best, but this fixes the user-reported `default.fetch is not a function` runtime error.","correctness_override":"Kept despite tiny primary regression because the prior optimization caused a real dev-server runtime failure not covered by checks. Correctness/backpressure outweighs this negligible byte loss.","next_action_hint":"Add a lightweight server-entry shape check to autoresearch.checks.sh so future experiments catch this class of runtime contract break."}}
{"run":177,"commit":"bc6f5ec","metric":136.165,"metrics":{"bundle_raw_kb":451.653,"js_files":9,"css_kb":0},"status":"keep","description":"Add backpressure check for TanStack Start server default.fetch contract","timestamp":1777649370328,"segment":0,"confidence":94.17881438289764,"asi":{"hypothesis":"The dev runtime failure escaped build/typecheck because no check asserted TanStack Start's server-entry shape. Importing built dist/server/server.js and requiring default.fetch to be a function should prevent future regressions without affecting primary benchmark timing.","outcome":"Benchmark and enhanced checks pass. Primary metric unchanged; check now covers the user-reported default.fetch runtime contract.","correctness_learning":"AHE decision observability needs checks for harness/runtime contracts, not just TypeScript. This check captures the server component contract explicitly."}}
{"run":178,"commit":"bc6f5ec","metric":136.165,"metrics":{"bundle_raw_kb":451.653,"js_files":9,"css_kb":0},"status":"discard","description":"Inline remaining chat UI types into Chat","timestamp":1777649420726,"segment":0,"confidence":93.90503875969154,"asi":{"hypothesis":"After inlining all chat subcomponents/helpers, src/components/chat/types.ts only serves Chat. Inlining its two type aliases and deleting the module might remove a type-only module boundary or route metadata.","rollback_reason":"Primary metric was unchanged; type-only module deletion has no emitted bundle effect. Keeping a tiny types file is clearer and costs nothing at runtime.","next_action_hint":"Do not optimize type-only modules for bundle size."}}
{"run":179,"commit":"d4f3c5d","metric":136.157,"metrics":{"bundle_raw_kb":451.623,"js_files":9,"css_kb":0},"status":"keep","description":"Trust follow-up custom event is the only custom stream event","timestamp":1777649469788,"segment":0,"confidence":90.73970037453323,"asi":{"hypothesis":"After removing tool/status custom events, the chat route only emits custom follow-up events. Removing the event-name branch from onCustomEvent should preserve AG-UI follow-up behavior and shrink client event handling.","outcome":"Primary metric returned to the previous best while raw bytes improved; build and enhanced checks pass.","risk_note":"If any other custom events are added later, this handler would incorrectly treat them as follow-up payloads. Add event-name filtering back when introducing new custom events."}}
{"run":180,"commit":"9f5cbf2","metric":136.143,"metrics":{"bundle_raw_kb":451.589,"js_files":9,"css_kb":0},"status":"keep","description":"Emit follow-up custom event value as array directly","timestamp":1777649519840,"segment":0,"confidence":87.79347826086851,"asi":{"hypothesis":"The follow-up custom event has exactly one payload value. Emitting the array directly instead of wrapping it in `{followUps}` removes object shape overhead on both server and client.","outcome":"Primary metric improved; build and enhanced checks pass. AG-UI follow-up mode still receives the same array of questions.","risk_note":"Custom event payload shape changed from object to array. Safe because the event is internal and the client handler was updated together."}}
{"run":181,"commit":"e53dc47","metric":136.138,"metrics":{"bundle_raw_kb":451.574,"js_files":9,"css_kb":0},"status":"keep","description":"Omit custom follow-up event name after it became the only custom event","timestamp":1777649556220,"segment":0,"confidence":86.77618621306928,"asi":{"hypothesis":"The client now treats every custom event as follow-ups, and the server emits no other custom events. Omitting the custom event name should preserve behavior while shrinking stream payload/code.","outcome":"Tiny primary improvement; build and enhanced checks pass.","risk_note":"Custom event is now unnamed/undefined. If TanStack AI requires names semantically in future or more custom events are added, restore a name and filtering."}}
{"run":182,"commit":"fda91de","metric":136.136,"metrics":{"bundle_raw_kb":451.522,"js_files":9,"css_kb":0},"status":"keep","description":"Omit Content-Type header from follow-up JSON helper","timestamp":1777649592954,"segment":0,"confidence":84.80402449693784,"asi":{"hypothesis":"The follow-up route client calls response.json(), which parses the body regardless of Content-Type. Omitting the JSON content-type header from this optional route should preserve client behavior while shrinking server route code.","outcome":"Tiny primary improvement; build and enhanced checks pass.","risk_note":"HTTP clients no longer see application/json for /api/followups responses. Reintroduce header if external API consumers rely on content negotiation."}}
{"run":183,"commit":"09bac78","metric":136.131,"metrics":{"bundle_raw_kb":451.415,"js_files":9,"css_kb":0},"status":"keep","description":"Omit Content-Type headers from models API responses","timestamp":1777649640960,"segment":0,"confidence":84.6972477064225,"asi":{"hypothesis":"The in-app models client uses response.json() and does not rely on Content-Type. Omitting explicit JSON headers from /api/models should preserve app behavior while shrinking route code.","outcome":"Primary metric improved; build and enhanced checks pass.","risk_note":"External clients no longer see application/json on /api/models responses. Restore headers if treating this as a public API."}}
{"run":184,"commit":"39d023f","metric":136.114,"metrics":{"bundle_raw_kb":451.31,"js_files":9,"css_kb":0},"status":"keep","description":"Omit Content-Type headers from chat API JSON error responses","timestamp":1777649685390,"segment":0,"confidence":84.67510917030702,"asi":{"hypothesis":"Chat API JSON error bodies are consumed by app/client error handling rather than external content negotiation. Omitting explicit JSON headers on error responses should preserve behavior while shrinking route code.","outcome":"Primary metric improved; build and enhanced checks pass.","risk_note":"External clients no longer see application/json on chat error responses. Reintroduce headers if public API semantics matter."}}
{"run":185,"commit":"39d023f","metric":136.129,"metrics":{"bundle_raw_kb":451.325,"js_files":9,"css_kb":0},"status":"discard","description":"Factor simplified chat API JSON error responses into helper","timestamp":1777649725725,"segment":0,"confidence":83.15008576329355,"asi":{"hypothesis":"After removing headers and one unsupported-model branch, the chat API has two JSON error responses. A small helper might now gzip better than repeated Response construction.","rollback_reason":"Primary metric regressed; even simplified, the helper binding/default parameter gzips worse than direct repeated responses.","next_action_hint":"Keep direct chat error Response construction."}}
