{"run":279,"commit":"0e594be","metric":134.594,"metrics":{"bundle_raw_kb":446.625,"js_files":8,"css_kb":0},"status":"keep","description":"Trust models API catch receives Error-like objects","timestamp":1777665735869,"segment":0,"confidence":51.97835840591203,"asi":{"hypothesis":"The models API catch is expected to receive Error instances from fetch/model parsing failures. Returning error.message directly removes rare non-Error fallback logic while preserving normal diagnostics.","outcome":"Primary metric improved; build and enhanced checks pass.","risk_note":"If a non-Error value is thrown, the response error field may be undefined instead of 'Models failed'."}}
{"run":280,"commit":"a2a5ad5","metric":134.572,"metrics":{"bundle_raw_kb":446.543,"js_files":8,"css_kb":0},"status":"keep","description":"Trust model catalog load errors are Error-like in client","timestamp":1777665758324,"segment":0,"confidence":51.70341207349079,"asi":{"hypothesis":"The model catalog load path throws Error objects for non-OK responses and fetch failures. Using err.message directly removes rare non-Error fallback logic while preserving normal UI diagnostics.","outcome":"Primary metric improved; build and enhanced checks pass.","risk_note":"If a non-Error value is thrown during model loading, the displayed modelsError may be undefined."}}
{"run":281,"commit":"c173933","metric":134.564,"metrics":{"bundle_raw_kb":446.531,"js_files":8,"css_kb":0},"status":"keep","description":"Shorten client model-load failure construction","timestamp":1777665783912,"segment":0,"confidence":51.81641241451879,"asi":{"hypothesis":"The client model-load error only needs a concise message. `Error('Models failed')` is shorter than `new Error('Model load failed')` while preserving Error-like catch behavior.","outcome":"Primary metric improved; build and enhanced checks pass.","risk_note":"Displayed model-load error text is terser."}}
{"run":282,"commit":"c742df9","metric":134.562,"metrics":{"bundle_raw_kb":446.521,"js_files":8,"css_kb":0},"status":"keep","description":"Shorten missing chat model error response","timestamp":1777665810791,"segment":0,"confidence":51.51935146443574,"asi":{"hypothesis":"The chat API missing-model error remains clear without naming OpenRouter. Shortening the message trims route literals while preserving user-facing guidance.","outcome":"Tiny primary improvement; build and enhanced checks pass.","risk_note":"Error message is less provider-specific."}}
{"run":283,"commit":"3098a24","metric":134.526,"metrics":{"bundle_raw_kb":446.406,"js_files":8,"css_kb":0},"status":"keep","description":"Drop provider-name prefix from formatted OpenRouter raw errors","timestamp":1777665840287,"segment":0,"confidence":51.470880125358235,"asi":{"hypothesis":"OpenRouter raw error metadata should be actionable without prefixing provider_name. Removing the optional provider-name lookup/prefix keeps error formatting useful while trimming route code.","outcome":"Primary metric improved; build and enhanced checks pass.","risk_note":"Formatted provider errors no longer include the provider name before the raw message. Restore if users need to distinguish upstream providers in errors."}}
{"run":284,"commit":"7a967fe","metric":134.52,"metrics":{"bundle_raw_kb":446.398,"js_files":8,"css_kb":0},"status":"keep","description":"Shorten fallback OpenRouter error message","timestamp":1777665863497,"segment":0,"confidence":51.007763975154845,"asi":{"hypothesis":"The final fallback error text only needs to identify an OpenRouter error. Dropping 'Unknown' keeps the message clear and shorter.","outcome":"Primary metric improved; build and enhanced checks pass.","risk_note":"Fallback error is less explicit that no structured provider details were available."}}
{"run":285,"commit":"6f24dfb","metric":134.51,"metrics":{"bundle_raw_kb":446.379,"js_files":8,"css_kb":0},"status":"keep","description":"Allow empty strings through OpenRouter error string helper","timestamp":1777665892442,"segment":0,"confidence":52.40999734113354,"asi":{"hypothesis":"Structured OpenRouter error fields are expected to be useful non-empty strings. Removing the empty-string length guard simplifies the helper while preserving normal error formatting.","outcome":"Primary metric improved; build and enhanced checks pass.","risk_note":"If a structured error field is an empty string, it may suppress later fallback messages."}}
{"run":286,"commit":"a83615b","metric":134.499,"metrics":{"bundle_raw_kb":446.358,"js_files":8,"css_kb":0},"status":"keep","description":"Inline direct OpenRouter error payload lookup","timestamp":1777665916712,"segment":0,"confidence":53.68627450980355,"asi":{"hypothesis":"The direct `error.error` payload path is simple and returns immediately. Inlining the lookup may remove a local binding in OpenRouter error parsing.","outcome":"Primary metric improved despite duplicating the lookup; build and enhanced checks pass.","risk_note":"getErrorRecord(error,'error') is called twice when present. Error formatting is rare, so smaller bundle wins over micro-runtime cost."}}
{"run":287,"commit":"a83615b","metric":134.499,"metrics":{"bundle_raw_kb":446.358,"js_files":8,"css_kb":0},"status":"discard","description":"Inline parsed OpenRouter error body into error record lookup","timestamp":1777665940073,"segment":0,"confidence":53.715531335150054,"asi":{"hypothesis":"The parsed JSON body is only used once when extracting nested OpenRouter error payloads. Inlining JSON.parse(body) into getErrorRecord may remove a local binding.","rollback_reason":"Primary and raw metrics were unchanged; bundler already optimized the single-use parsed local. Keeping the local is clearer.","next_action_hint":"Avoid further single-use local inlining in error parsing without metric movement."}}
{"run":288,"commit":"7a3c8f1","metric":134.498,"metrics":{"bundle_raw_kb":446.358,"js_files":8,"css_kb":0},"status":"keep","description":"Use falsy fallback for OpenRouter error body lookup","timestamp":1777665966606,"segment":0,"confidence":53.80403930131024,"asi":{"hypothesis":"Empty OpenRouter body strings are not useful for JSON error parsing. Using `||` instead of `??` can be slightly smaller and falls back to the top-level body when the response body is empty.","outcome":"Tiny primary improvement; build and enhanced checks pass.","risk_note":"Empty string response.body$ now falls back to error.body$ instead of being treated as present."}}
{"run":289,"commit":"7a3c8f1","metric":134.499,"metrics":{"bundle_raw_kb":446.358,"js_files":8,"css_kb":0},"status":"discard","description":"Use falsy fallback chain for formatted OpenRouter message","timestamp":1777665985975,"segment":0,"confidence":53.8481289265228,"asi":{"hypothesis":"Empty raw/fallback OpenRouter messages are not useful, so `||` fallback might be smaller and semantically acceptable compared with nullish fallback.","rollback_reason":"Primary metric regressed slightly; no need to widen fallback semantics for worse gzip.","next_action_hint":"Keep nullish fallback for raw/fallback OpenRouter message selection."}}
{"run":290,"commit":"7a3c8f1","metric":134.498,"metrics":{"bundle_raw_kb":446.296,"js_files":8,"css_kb":0},"status":"discard","description":"Use optional chaining in OpenRouter error record helper","timestamp":1777666017960,"segment":0,"confidence":53.89229086932728,"asi":{"hypothesis":"Optional chaining on `(value as any)?.[key]` could replace explicit object guards in getErrorRecord and shrink error parsing code.","rollback_reason":"Primary metric was unchanged versus best and the helper would return null for null object fields due typeof null === object. The raw byte reduction is not worth the semantic risk.","next_action_hint":"Keep explicit truthy/object guard in getErrorRecord."}}
{"run":291,"commit":"7a3c8f1","metric":134.503,"metrics":{"bundle_raw_kb":446.356,"js_files":8,"css_kb":0},"status":"discard","description":"Initialize captured OpenRouter error with null","timestamp":1777666041081,"segment":0,"confidence":54.09934138309585,"asi":{"hypothesis":"A null initial lastError should preserve falsy checks and nullish fallback semantics while possibly emitting smaller than undefined.","rollback_reason":"Primary metric regressed; undefined initialization gzips better in this context.","next_action_hint":"Keep lastError initialized to undefined."}}
{"run":292,"commit":"e2ca8c6","metric":134.489,"metrics":{"bundle_raw_kb":446.335,"js_files":8,"css_kb":0},"status":"keep","description":"Make request-search prompt field optional in client tool schema","timestamp":1777666093060,"segment":0,"confidence":54.13399231191659,"asi":{"hypothesis":"The request_search_query client executor already defaults missing prompt text to 'What should I search for?'. Making prompt optional in the tool schema preserves runtime behavior while shrinking schema literals.","outcome":"Primary metric improved; build and enhanced checks pass.","risk_note":"The model may call request_search_query without prompt more often because the schema no longer requires it; the client fallback prompt handles that case."}}
{"run":293,"commit":"f8541a1","metric":134.428,"metrics":{"bundle_raw_kb":446.004,"js_files":8,"css_kb":0},"status":"keep","description":"Remove empty-chat placeholder branch from conversation panel","timestamp":1777666178581,"segment":0,"confidence":54.46659304251817,"asi":{"hypothesis":"The input placeholder already invites the user to ask a question. The empty conversation panel text duplicates that guidance and adds a render branch/fragment around all message-related UI.","outcome":"Primary metric improved substantially; build and enhanced checks pass.","risk_note":"The conversation panel is blank before the first message instead of showing 'Ask something to start.' The input placeholder remains."}}
{"run":294,"commit":"9938e80","metric":134.377,"metrics":{"bundle_raw_kb":445.771,"js_files":8,"css_kb":0},"status":"keep","description":"Remove follow-ups section heading","timestamp":1777666198527,"segment":0,"confidence":55.44382022471906,"asi":{"hypothesis":"Follow-up suggestions are visually presented as clickable question buttons after responses, so the 'Follow-ups' heading is redundant UI copy/style. Removing it preserves the suggestions while shrinking markup.","outcome":"Primary metric improved; build and enhanced checks pass.","risk_note":"The suggestion buttons no longer have an explicit textual section label."}}
{"run":295,"commit":"28005d3","metric":134.316,"metrics":{"bundle_raw_kb":445.457,"js_files":8,"css_kb":0},"status":"keep","description":"Remove optional model follow-up loading indicator","timestamp":1777666220184,"segment":0,"confidence":55.46251053074968,"asi":{"hypothesis":"Model-generated follow-ups are optional suggestions. The dedicated 'Generating…' text is secondary observability and duplicates the eventual appearance of suggestion buttons, so removing it preserves core chat behavior while shrinking UI code.","outcome":"Primary metric improved; build and enhanced checks pass.","risk_note":"When Model follow-up mode is selected, users no longer see a loading indicator while suggestions are being fetched."}}
{"run":296,"commit":"90ef963","metric":134.255,"metrics":{"bundle_raw_kb":445.255,"js_files":8,"css_kb":0},"status":"keep","description":"Remove unused model follow-up loading state","timestamp":1777666258789,"segment":0,"confidence":55.5435637998877,"asi":{"hypothesis":"After removing the optional follow-up loading indicator, isLoadingFollowUps state is no longer rendered. Removing the state and set/finally calls simplifies the model follow-up effect.","outcome":"Primary metric improved; build and enhanced checks pass.","risk_note":"No UI loading state remains for model follow-up generation; suggestions simply appear when ready."}}
{"run":297,"commit":"e4dde98","metric":134.252,"metrics":{"bundle_raw_kb":445.223,"js_files":8,"css_kb":0},"status":"keep","description":"Keep previous model follow-ups while refreshing suggestions","timestamp":1777666283182,"segment":0,"confidence":55.374054356962915,"asi":{"hypothesis":"After removing the loading indicator, clearing model follow-ups before fetching new ones creates a blank intermediate state. Keeping previous optional suggestions until new ones arrive removes code and can reduce flicker.","outcome":"Tiny primary improvement; build and enhanced checks pass.","risk_note":"While a new model follow-up request is in flight, stale suggestions from the previous assistant response may remain visible."}}
{"run":298,"commit":"035b8ce","metric":134.25,"metrics":{"bundle_raw_kb":445.201,"js_files":8,"css_kb":0},"status":"keep","description":"Leave previous model follow-ups on refresh errors","timestamp":1777666314526,"segment":0,"confidence":55.02060133630314,"asi":{"hypothesis":"Since previous model follow-ups now remain visible during refresh, a failed optional refresh can also leave them in place instead of clearing to empty. This removes the catch setter while preserving usable suggestions.","outcome":"Tiny primary improvement; build and enhanced checks pass.","risk_note":"If model follow-up generation fails, stale suggestions may persist until another successful response or mode change."}}
{"run":299,"commit":"68c73b7","metric":134.233,"metrics":{"bundle_raw_kb":445.167,"js_files":8,"css_kb":0},"status":"keep","description":"Always parse optional follow-up fetch responses as JSON","timestamp":1777666337030,"segment":0,"confidence":54.999443516972825,"asi":{"hypothesis":"The internal /api/followups route returns JSON for both normal and fallback cases. The client can always call response.json() and rely on catch for malformed/network failures, removing response.ok branching.","outcome":"Primary metric improved; build and enhanced checks pass.","risk_note":"If an infrastructure error returns non-JSON, the catch path leaves previous suggestions visible."}}
{"run":300,"commit":"1f4cf49","metric":134.232,"metrics":{"bundle_raw_kb":445.155,"js_files":8,"css_kb":0},"status":"keep","description":"Trust internal follow-up fetch payload has followUps array","timestamp":1777666367180,"segment":0,"confidence":54.96941045606224,"asi":{"hypothesis":"The /api/followups route always returns an object with followUps for successful JSON responses. Removing optional/nullish fallback in the client preserves normal behavior and shrinks the effect.","outcome":"Tiny primary improvement; build and enhanced checks pass.","risk_note":"A malformed JSON object without followUps would set undefined into modelFollowUps. Current internal route controls the response shape."}}
{"run":301,"commit":"89f0d31","metric":134.213,"metrics":{"bundle_raw_kb":445.099,"js_files":8,"css_kb":0},"status":"keep","description":"Stop filtering empty messages before model follow-up request","timestamp":1777666392694,"segment":0,"confidence":54.888395335924436,"asi":{"hypothesis":"The model follow-up effect already requires an assistant message, and getMessageText normally yields content for user/assistant messages. Removing the empty-content filter simplifies optional follow-up serialization.","outcome":"Primary metric improved; build and enhanced checks pass.","risk_note":"Messages with empty extracted text may be sent to /api/followups. The server/model prompt can tolerate occasional empty lines."}}
{"run":302,"commit":"89f0d31","metric":134.236,"metrics":{"bundle_raw_kb":445.125,"js_files":8,"css_kb":0},"status":"discard","description":"Share reversed message list for heuristic follow-up lookups","timestamp":1777666416974,"segment":0,"confidence":54.857935627081254,"asi":{"hypothesis":"Heuristic follow-ups reverse messages twice to find the latest assistant and user messages. Sharing a reversedMessages local might reduce work and code.","rollback_reason":"Primary metric regressed; the extra local binding gzips worse than repeating the reverse expression. Runtime benefit is not the target.","next_action_hint":"Keep duplicated reverse/find expressions in heuristic follow-up generation."}}
{"run":303,"commit":"89f0d31","metric":134.215,"metrics":{"bundle_raw_kb":445.085,"js_files":8,"css_kb":0},"status":"discard","description":"Avoid redundant trim check on extracted assistant text","timestamp":1777666449631,"segment":0,"confidence":54.87316125451001,"asi":{"hypothesis":"getMessageText already trims joined text, so heuristic follow-up readiness can check lastAssistantText directly instead of lastAssistantText.trim().","rollback_reason":"Primary metric regressed slightly versus best despite raw byte reduction; gzip favors the previous shape.","next_action_hint":"Keep the explicit trim check in heuristic follow-up readiness."}}
{"run":304,"commit":"b5dcf56","metric":134.192,"metrics":{"bundle_raw_kb":444.983,"js_files":8,"css_kb":0},"status":"keep","description":"Remove dynamic cursor style from interactive search submit button","timestamp":1777666476936,"segment":0,"confidence":54.930555555556076,"asi":{"hypothesis":"The interactive search submit button already has a disabled attribute when input is empty. The dynamic cursor style is decorative and duplicates native disabled affordance.","outcome":"Primary metric improved; build and enhanced checks pass.","risk_note":"Cursor no longer changes explicitly between pointer and not-allowed for the search submit button."}}
{"run":305,"commit":"48ca3c1","metric":134.137,"metrics":{"bundle_raw_kb":444.699,"js_files":8,"css_kb":0},"status":"keep","description":"Remove remaining decorative cursor styles from buttons","timestamp":1777666520039,"segment":0,"confidence":54.94584837545172,"asi":{"hypothesis":"Native buttons and disabled attributes already communicate interactivity. Removing explicit cursor styles from control/follow-up/send buttons preserves functionality and trims inline style code.","outcome":"Primary metric improved; build and enhanced checks pass. Kept the details summary cursor style because it is inline in a different shape and specifically marks expandable thinking text.","risk_note":"Mouse cursor affordances are less customized; browser defaults apply."}}
{"run":306,"commit":"5c20365","metric":134.11,"metrics":{"bundle_raw_kb":444.608,"js_files":8,"css_kb":0},"status":"keep","description":"Remove cursor style from thinking details summary","timestamp":1777666540659,"segment":0,"confidence":54.94558578567499,"asi":{"hypothesis":"The native details/summary element already indicates expandability. Removing the explicit pointer cursor preserves thinking disclosure behavior while trimming inline style code.","outcome":"Primary metric improved; build and enhanced checks pass.","risk_note":"The thinking summary uses browser-default cursor styling."}}
{"run":307,"commit":"94671b5","metric":134.103,"metrics":{"bundle_raw_kb":444.497,"js_files":8,"css_kb":0},"status":"keep","description":"Remove explicit button types outside forms","timestamp":1777666587765,"segment":0,"confidence":55.08711383245172,"asi":{"hypothesis":"The Free/Thinking toggle buttons and follow-up buttons are not inside a form, so explicit type=\"button\" is unnecessary. Removing it preserves behavior and trims JSX output.","outcome":"Tiny primary improvement; build and enhanced checks pass.","risk_note":"If these buttons are later moved inside a form, type=\"button\" should be restored to avoid accidental submission."}}
{"run":308,"commit":"70a1059","metric":134.102,"metrics":{"bundle_raw_kb":444.458,"js_files":8,"css_kb":0},"status":"keep","description":"Use default submit type for interactive search submit button","timestamp":1777666608882,"segment":0,"confidence":55.226004464285666,"asi":{"hypothesis":"The interactive search button is inside its search form and is meant to submit it. Native button default type is submit, so the explicit type attribute is redundant.","outcome":"Tiny primary improvement; build and enhanced checks pass.","risk_note":"If this button is moved out of the form or repurposed, add an explicit type again."}}
{"run":309,"commit":"6fe5656","metric":134.093,"metrics":{"bundle_raw_kb":444.415,"js_files":8,"css_kb":0},"status":"keep","description":"Simplify interactive search submit resolver guard","timestamp":1777666641978,"segment":0,"confidence":55.016120066703536,"asi":{"hypothesis":"The interactive search form is only shown after the client tool installs a resolver. The submit handler mainly needs to reject empty trimmed queries; optional-calling the resolver removes a compound guard while staying safe if the resolver is unexpectedly absent.","outcome":"Primary metric improved; build and enhanced checks pass.","risk_note":"If resolver is absent, the form now clears after optional no-op instead of returning early. That state should not happen in normal tool flow."}}
{"run":310,"commit":"f6105b8","metric":134.092,"metrics":{"bundle_raw_kb":444.411,"js_files":8,"css_kb":0},"status":"keep","description":"Trust interactive search resolver exists on submit","timestamp":1777666667266,"segment":0,"confidence":54.803433001107926,"asi":{"hypothesis":"The interactive search form is only rendered while a request_search_query tool call is pending, which always installs searchQueryResolverRef. A non-null call removes optional-call code while preserving normal flow.","outcome":"Tiny primary improvement; build and enhanced checks pass.","risk_note":"If the form is submitted after the resolver is somehow cleared, the handler will throw instead of no-op."}}
