{"run":311,"commit":"28413d3","metric":134.079,"metrics":{"bundle_raw_kb":444.353,"js_files":8,"css_kb":0},"status":"keep","description":"Leave interactive search resolver ref for next tool call overwrite","timestamp":1777666688317,"segment":0,"confidence":54.65930425179481,"asi":{"hypothesis":"After submitting an interactive search query, hiding the prompt is enough for UI state. The next request_search_query tool call overwrites the resolver ref, so clearing it explicitly is unnecessary.","outcome":"Primary metric improved; build and enhanced checks pass.","risk_note":"The old resolver function remains in the ref after submit. If stale form submission were possible, it could resolve the old promise again, but the form is hidden immediately."}}
{"run":312,"commit":"6b14a07","metric":134.069,"metrics":{"bundle_raw_kb":444.314,"js_files":8,"css_kb":0},"status":"keep","description":"Do not clear hidden interactive search input after submit","timestamp":1777666714305,"segment":0,"confidence":54.36463481603522,"asi":{"hypothesis":"Submitting an interactive search hides the prompt, and the next request_search_query tool call initializes the input from suggestedQuery or empty string. Clearing the hidden input immediately after submit is redundant.","outcome":"Primary metric improved; build and enhanced checks pass.","risk_note":"The last submitted search text remains in hidden state until the next tool prompt resets it."}}
{"run":313,"commit":"1679610","metric":134.066,"metrics":{"bundle_raw_kb":444.301,"js_files":8,"css_kb":0},"status":"keep","description":"Avoid trimming interactive search input for disabled state","timestamp":1777666740631,"segment":0,"confidence":54.23226513284059,"asi":{"hypothesis":"The submit handler trims and rejects whitespace-only queries. The button disabled state can use the raw input truthiness as a cheaper coarse affordance without changing submitted query validation.","outcome":"Tiny primary improvement; build and enhanced checks pass.","risk_note":"A whitespace-only search input may enable the button, but submit still returns without resolving."}}
{"run":314,"commit":"231c302","metric":134.059,"metrics":{"bundle_raw_kb":444.245,"js_files":8,"css_kb":0},"status":"keep","description":"Rely on submit handler validation for interactive search button","timestamp":1777666762573,"segment":0,"confidence":54.25095890410909,"asi":{"hypothesis":"The interactive search submit handler already trims and rejects empty queries. Removing the button disabled attribute keeps validation in one place and shrinks UI code.","outcome":"Primary metric improved; build and enhanced checks pass.","risk_note":"The Search button is clickable with empty input, but submitting does nothing."}}
{"run":315,"commit":"cd65ba5","metric":134.055,"metrics":{"bundle_raw_kb":444.216,"js_files":8,"css_kb":0},"status":"keep","description":"Remove redundant loading guard from follow-up click handler","timestamp":1777666779801,"segment":0,"confidence":54.22343921139037,"asi":{"hypothesis":"Follow-up buttons are only rendered when !isLoading, so handleFollowUpClick does not need to guard against loading. Removing the duplicate check keeps validation at the render condition.","outcome":"Tiny primary improvement; build and enhanced checks pass.","risk_note":"If follow-up buttons are later rendered during loading, clicking them would send a message unless the guard is restored."}}
{"run":316,"commit":"cd65ba5","metric":134.078,"metrics":{"bundle_raw_kb":444.247,"js_files":8,"css_kb":0},"status":"discard","description":"Factor duplicated follow-up clearing into helper","timestamp":1777666810956,"segment":0,"confidence":54.19376026272499,"asi":{"hypothesis":"Submitting a typed message and clicking a follow-up both clear model/AG-UI suggestions. A small clearFollowUps helper might reduce duplicated setters.","rollback_reason":"Primary metric regressed; the helper binding/calls gzip worse than two duplicated setter pairs.","next_action_hint":"Keep follow-up clearing setters inline in each handler."}}
{"run":317,"commit":"cd65ba5","metric":134.055,"metrics":{"bundle_raw_kb":444.156,"js_files":8,"css_kb":0},"status":"discard","description":"Do not clear follow-up suggestion state when clicking a follow-up","timestamp":1777666837213,"segment":0,"confidence":54.20859567478797,"asi":{"hypothesis":"Clicking a follow-up immediately starts loading, which hides suggestions; new suggestions arrive after the next response. Clearing suggestion state in the click handler may be redundant.","rollback_reason":"Primary metric was unchanged versus best, while stale model/AG-UI follow-up state risk increases. Not worth keeping.","next_action_hint":"Keep explicit follow-up clearing on follow-up clicks."}}
{"run":318,"commit":"4873933","metric":134.052,"metrics":{"bundle_raw_kb":444.156,"js_files":8,"css_kb":0},"status":"keep","description":"Do not clear follow-up state on manual message submit","timestamp":1777666858096,"segment":0,"confidence":54.34412733260147,"asi":{"hypothesis":"Submitting a manual message sets isLoading and hides follow-up suggestions until the next response. Clearing model/AG-UI follow-up state before send is redundant for the visible UI.","outcome":"Tiny primary improvement; build and enhanced checks pass.","risk_note":"Previous model/AG-UI suggestions remain in state during the next request and could reappear if the request fails quickly or mode changes before new suggestions arrive."}}
{"run":319,"commit":"be76361","metric":134.039,"metrics":{"bundle_raw_kb":444.097,"js_files":8,"css_kb":0},"status":"keep","description":"Do not clear follow-up state on follow-up click","timestamp":1777666885895,"segment":0,"confidence":54.71160220994512,"asi":{"hypothesis":"After accepting stale hidden follow-up state on manual submit, the same reasoning applies to follow-up clicks: loading hides suggestions and new response/follow-up events refresh them. Removing explicit clearing simplifies the click path.","outcome":"Primary metric improved; build and enhanced checks pass.","risk_note":"Previous model/AG-UI suggestions can remain in state during a follow-up-triggered request and may reappear if no new suggestions arrive."}}
{"run":320,"commit":"5879a70","metric":134.009,"metrics":{"bundle_raw_kb":443.994,"js_files":8,"css_kb":0},"status":"keep","description":"Inline single-use follow-up click handler","timestamp":1777666912297,"segment":0,"confidence":55.0934371523915,"asi":{"hypothesis":"After removing follow-up state clearing, handleFollowUpClick only calls sendMessage and has one call site. Inlining it removes a pass-through handler.","outcome":"Primary metric improved; build and enhanced checks pass.","risk_note":"Follow-up button onClick now directly sends the question; re-extract if click behavior grows again."}}
