{"run":61,"commit":"98af6ba","metric":139.471,"metrics":{"bundle_raw_kb":464.462,"js_files":9,"css_kb":0},"status":"keep","description":"Render typing indicator dots statically instead of mapping array","timestamp":1777645491151,"segment":0,"confidence":406.93913043480075,"asi":{"hypothesis":"The typing indicator always renders exactly three dots. Static spans remove array allocation/map logic and dynamic delay math, likely improving gzip even if raw JSX grows.","outcome":"Primary metric improved despite raw bundle growth; build and typecheck pass. Runtime also avoids tiny per-render array/map work.","tradeoff":"Source is more repetitive. Since the dot count is fixed UI, repetition is acceptable."}}
{"run":62,"commit":"98af6ba","metric":139.49,"metrics":{"bundle_raw_kb":464.505,"js_files":9,"css_kb":0},"status":"discard","description":"Hoist repeated markdown list regexes","timestamp":1777645514374,"segment":0,"confidence":394.0884210526599,"asi":{"hypothesis":"The markdown parser repeats ordered/unordered list regex literals; hoisting them might reduce duplication and parser construction.","rollback_reason":"Primary metric regressed. The added constant names/conditional expression gzip worse than duplicated compact regex literals.","next_action_hint":"Leave markdown list regexes inline; prior pattern simplifications were beneficial, hoisting is not."}}
{"run":63,"commit":"24af893","metric":139.438,"metrics":{"bundle_raw_kb":464.287,"js_files":9,"css_kb":0},"status":"keep","description":"Remove unused model/thinking fields from status custom events","timestamp":1777645566110,"segment":0,"confidence":382.15918367350673,"asi":{"hypothesis":"Experience observability should expose information the UI actually consumes. Status custom events only render label/progress, so dropping model/thinking fields reduces event payload and route code without changing visible behavior.","outcome":"Primary metric improved; build and typecheck pass. Status panel behavior is unchanged.","risk_note":"External consumers of internal `s` custom events would no longer receive model/thinking metadata. This app treats those events as internal, not public API."}}
{"run":64,"commit":"552b508","metric":139.414,"metrics":{"bundle_raw_kb":464.146,"js_files":9,"css_kb":0},"status":"keep","description":"Remove unused tool identifier from status event payloads","timestamp":1777645596040,"segment":0,"confidence":379.93103448274064,"asi":{"hypothesis":"Tool progress custom events are consumed by a generic status panel that only validates label/progress. Removing the unused `tool` field keeps experience observability focused and shrinks server tool event code.","outcome":"Primary metric improved; build and typecheck pass. Status labels still identify weather/quote/search to users.","risk_note":"Internal `t` events no longer carry a machine-readable tool id. Reintroduce if downstream consumers need per-tool filtering."}}
{"run":65,"commit":"349fd03","metric":139.372,"metrics":{"bundle_raw_kb":464.002,"js_files":9,"css_kb":0},"status":"keep","description":"Drop unused age/source fields from Brave search tool results","timestamp":1777645621682,"segment":0,"confidence":377.80241935480996,"asi":{"hypothesis":"The chat UI and citation policy only need Brave result title, URL, and description. Dropping age/source fields from the tool schema and mapped output should shrink server code and reduce tool-result tokens without compromising citations.","outcome":"Primary metric improved; build and typecheck pass.","risk_note":"Assistant answers lose optional source/age metadata. If source branding or recency labels become required, reintroduce those fields."}}
{"run":66,"commit":"94f12d8","metric":139.339,"metrics":{"bundle_raw_kb":463.836,"js_files":9,"css_kb":0},"status":"keep","description":"Remove unused observedAt fields from demo weather and stock tools","timestamp":1777645647333,"segment":0,"confidence":374.91200000000003,"asi":{"hypothesis":"Demo weather/stock tools return `observedAt`, but neither UI widgets nor prompt policy use it. Removing timestamp schema/output avoids extra code and per-call token payload while preserving displayed tool results.","outcome":"Primary metric improved; build and typecheck pass.","risk_note":"Tool consumers no longer receive a timestamp. Since these are explicitly demo values, recency metadata was not meaningful."}}
{"run":67,"commit":"94f12d8","metric":139.339,"metrics":{"bundle_raw_kb":463.836,"js_files":9,"css_kb":0},"status":"discard","description":"Make server-only tool definition constants non-exported","timestamp":1777645683388,"segment":0,"confidence":363.28682170545267,"asi":{"hypothesis":"Non-exported server tool definition constants might let bundling/minification shrink module interface code without changing runtime behavior.","rollback_reason":"Primary metric was unchanged, so the edit adds no measured value and slightly reduces testability/reuse of definitions.","next_action_hint":"Leave exports as-is unless a real module-boundary need arises."}}
{"run":68,"commit":"f54622b","metric":139.309,"metrics":{"bundle_raw_kb":463.598,"js_files":9,"css_kb":0},"status":"keep","description":"Remove unused output schema from interactive search request tool","timestamp":1777645713411,"segment":0,"confidence":345.97047970479605,"asi":{"hypothesis":"The `request_search_query` client tool needs an input contract for the model, but its output is a simple client-returned `{query}` consumed by the agent loop rather than UI validation. Omitting outputSchema should preserve behavior while shrinking the shared client/server tool definition.","outcome":"Primary metric improved; build and typecheck pass.","risk_note":"If TanStack AI or a future provider uses outputSchema for validation/tool result typing, this may need restoration. Current code already narrows the client callback return type explicitly."}}
{"run":69,"commit":"9cc229e","metric":139.23,"metrics":{"bundle_raw_kb":463.127,"js_files":9,"css_kb":0},"status":"keep","description":"Remove unused output schemas from server tools","timestamp":1777645775773,"segment":0,"confidence":336.33333333330353,"asi":{"hypothesis":"Provider tool calling requires input schemas; these server tools' output schemas are not consumed by UI or validation in this app. Omitting them should preserve execution while shrinking server tool definitions and reducing schema maintenance surface.","outcome":"Primary metric improved noticeably; build and typecheck pass.","risk_note":"If future TanStack AI versions validate tool outputs or expose output schemas to clients/docs, restore them. Current server execute functions still return the same output objects."}}
{"run":70,"commit":"9cc229e","metric":139.278,"metrics":{"bundle_raw_kb":463.439,"js_files":9,"css_kb":0},"status":"discard","description":"Replace remaining server tool Zod input schemas with JSON Schema","timestamp":1777645802478,"segment":0,"confidence":315.4184873949586,"asi":{"hypothesis":"After removing output schemas, plain JSON input schemas might beat Zod for server-only tool definitions and possibly remove Zod from the server bundle.","rollback_reason":"Primary metric regressed; verbose JSON Schema literals still outweigh any benefit. Zod input schemas are more concise and maintainable here.","next_action_hint":"Keep Zod for server input contracts. Only use plain JSON Schema on client-visible request_search_query, where it previously removed browser Zod cost."}}
{"run":71,"commit":"b707806","metric":139.217,"metrics":{"bundle_raw_kb":463.091,"js_files":9,"css_kb":0},"status":"keep","description":"Shorten remaining server tool input schema descriptions","timestamp":1777645822235,"segment":0,"confidence":308.7171052631558,"asi":{"hypothesis":"Tool input schema field descriptions can be concise because tool-level descriptions already provide routing context. Short field hints should preserve model usability while shrinking server tool contracts and prompt tokens.","outcome":"Primary metric improved; build and typecheck pass.","risk_note":"Less descriptive input hints may slightly reduce model argument quality for ambiguous locations/counts, but fields remain obvious: City, Ticker, Count."}}
{"run":72,"commit":"aaae026","metric":139.215,"metrics":{"bundle_raw_kb":463.073,"js_files":9,"css_kb":0},"status":"keep","description":"Remove optional search count schema description","timestamp":1777645843214,"segment":0,"confidence":303.72815533979434,"asi":{"hypothesis":"The optional Brave `count` field is self-explanatory from its name and numeric bounds. Removing its description should preserve tool usability while reducing schema text.","outcome":"Very small primary improvement; build and typecheck pass.","risk_note":"Model gets less natural-language guidance for count default, but the field is optional and server defaults to 5."}}
{"run":73,"commit":"1a5973b","metric":139.194,"metrics":{"bundle_raw_kb":463.02,"js_files":9,"css_kb":0},"status":"keep","description":"Remove obvious server tool input field descriptions","timestamp":1777645875106,"segment":0,"confidence":298.9585987261214,"asi":{"hypothesis":"Field names `city`, `symbol`, and `query` are obvious enough given the concise tool descriptions. Removing redundant field descriptions should reduce schema text without hurting tool argument generation.","outcome":"Primary metric improved; build and typecheck pass.","risk_note":"Tool argument guidance is now concentrated in tool descriptions and field names. If models produce poorer tool inputs, restore minimal field descriptions."}}
{"run":74,"commit":"af8cb43","metric":139.114,"metrics":{"bundle_raw_kb":462.805,"js_files":9,"css_kb":0},"status":"keep","description":"Remove redundant property descriptions from interactive search schema","timestamp":1777645930986,"segment":0,"confidence":288.64208909370996,"asi":{"hypothesis":"The `request_search_query` tool description and property names (`prompt`, `suggestedQuery`) are enough for both model and client. Removing per-property descriptions should shrink the client-visible schema without changing behavior.","outcome":"Primary metric improved; build and typecheck pass.","risk_note":"If the model stops supplying useful prompt/suggestedQuery values for ambiguous searches, restore concise property descriptions."}}
{"run":75,"commit":"4bc920e","metric":139.079,"metrics":{"bundle_raw_kb":462.746,"js_files":9,"css_kb":0},"status":"keep","description":"Shorten interactive search tool description","timestamp":1777645948755,"segment":0,"confidence":278.89614243321995,"asi":{"hypothesis":"The system prompt already tells the model to call request_search_query before brave_web_search when needed. The tool's own description can be shorter while preserving its purpose and reducing client-visible schema text.","outcome":"Primary metric improved; build and typecheck pass.","risk_note":"Description no longer mentions ambiguity or brave_web_search directly; the system prompt retains that policy."}}
{"run":76,"commit":"a5f70ce","metric":139.056,"metrics":{"bundle_raw_kb":462.686,"js_files":9,"css_kb":0},"status":"keep","description":"Further compress chat system prompt policy","timestamp":1777645968761,"segment":0,"confidence":274.4846715328344,"asi":{"hypothesis":"With concise tool descriptions in place, the system prompt can be tightened again while retaining all behavior-critical policies: tool routing, ambiguous search flow, demo-data disclosure, and Brave URL citation.","outcome":"Primary metric improved; build and typecheck pass.","risk_note":"Prompt wording is terse. Monitor real tool-routing quality; restore fuller wording if models miss ambiguous search handling or demo-data disclosure."}}
{"run":77,"commit":"e194319","metric":139.014,"metrics":{"bundle_raw_kb":462.579,"js_files":9,"css_kb":0},"status":"keep","description":"Shorten server tool descriptions to essential intent","timestamp":1777645988221,"segment":0,"confidence":270.2672413793222,"asi":{"hypothesis":"The system prompt now carries routing policy, so individual tool descriptions can state only essential intent. This should reduce schema/prompt bytes while preserving tool selection via names and prompt instructions.","outcome":"Primary metric improved; build and typecheck pass.","risk_note":"Descriptions are minimal. If model tool selection worsens, restore some context (weather fields, current/recent/docs search hints) despite bundle cost."}}
{"run":78,"commit":"594838e","metric":139.008,"metrics":{"bundle_raw_kb":462.568,"js_files":9,"css_kb":0},"status":"keep","description":"Remove redundant citation reminder from Brave tool description","timestamp":1777646019178,"segment":0,"confidence":255.24830393488276,"asi":{"hypothesis":"The system prompt already says to cite Brave URLs, so the Brave tool description does not need to repeat citation policy. Removing it reduces duplicate prompt/schema text.","outcome":"Very small primary improvement; build and typecheck pass.","risk_note":"Citation instruction now exists only in the system prompt, not the tool description. Keep prompt citation wording."}}
{"run":79,"commit":"757f2a4","metric":138.993,"metrics":{"bundle_raw_kb":462.54,"js_files":9,"css_kb":0},"status":"keep","description":"Compress tool descriptions to short labels","timestamp":1777646046399,"segment":0,"confidence":241.83547557841766,"asi":{"hypothesis":"Tool names plus the system prompt already encode routing semantics. Tool descriptions can be short labels, shrinking schema text while preserving model affordances through names like get_weather, get_stock_quote, and brave_web_search.","outcome":"Primary metric improved below 139kb; build and typecheck pass.","risk_note":"This is near the lower bound of safe prompt/schema compression. Monitor tool selection quality closely; restore richer descriptions if needed."}}
{"run":80,"commit":"722bc77","metric":138.977,"metrics":{"bundle_raw_kb":462.509,"js_files":9,"css_kb":0},"status":"keep","description":"Remove unused force-refresh option from model catalog cache","timestamp":1777646091252,"segment":0,"confidence":240.94750320103128,"asi":{"hypothesis":"Component observability shows `getOpenRouterModels` has no callers using its force-refresh option. Removing this unused branch simplifies cache behavior and shrinks server code without changing current routes.","outcome":"Primary metric improved; build and typecheck pass.","risk_note":"Programmatic forced model refresh is no longer available. Reintroduce only when a caller needs it."}}
{"run":81,"commit":"d4a675e","metric":138.968,"metrics":{"bundle_raw_kb":462.459,"js_files":9,"css_kb":0},"status":"keep","description":"Inline single-use OpenRouter models URL","timestamp":1777646120240,"segment":0,"confidence":240.04846938775765,"asi":{"hypothesis":"The OpenRouter models URL constant has a single use. Inlining it removes a module-level binding while preserving behavior.","outcome":"Tiny primary improvement; build and typecheck pass.","risk_note":"If the URL gains multiple call sites, restoring a named constant may improve maintainability."}}
{"run":82,"commit":"ec32b27","metric":138.945,"metrics":{"bundle_raw_kb":462.413,"js_files":9,"css_kb":0},"status":"keep","description":"Inline single-use OpenRouter chat URL in follow-up route","timestamp":1777646150353,"segment":0,"confidence":239.191867852603,"asi":{"hypothesis":"The follow-up route's OpenRouter chat URL constant has one use. Inlining it removes a binding without changing request behavior.","outcome":"Small primary improvement; build and typecheck pass.","risk_note":"If more OpenRouter chat calls are added, a shared constant may become preferable."}}
{"run":83,"commit":"bb44dd4","metric":138.93,"metrics":{"bundle_raw_kb":462.363,"js_files":9,"css_kb":0},"status":"keep","description":"Make follow-up JSON helper assume default 200 status","timestamp":1777646173645,"segment":0,"confidence":238.3215189873356,"asi":{"hypothesis":"Every follow-up route JSON response uses status 200. Removing the status argument and relying on Response's default status simplifies the route without changing behavior.","outcome":"Primary metric improved; build and typecheck pass.","risk_note":"If this helper is later used for non-200 responses, add an optional status back or use Response directly."}}
{"run":84,"commit":"bb44dd4","metric":138.939,"metrics":{"bundle_raw_kb":462.228,"js_files":9,"css_kb":0},"status":"discard","description":"Factor chat API JSON error responses into helper","timestamp":1777646203044,"segment":0,"confidence":235.93233082706712,"asi":{"hypothesis":"The chat API repeats JSON error Response boilerplate three times; a helper might reduce raw code and make error handling more observable.","rollback_reason":"Primary metric regressed after gzip despite raw bytes decreasing. Repetition compresses better than the helper binding/default parameter here.","next_action_hint":"Keep repeated chat error responses unless adding more error cases. Raw-byte reductions do not guarantee gzip wins."}}
{"run":85,"commit":"8128335","metric":138.924,"metrics":{"bundle_raw_kb":462.346,"js_files":9,"css_kb":0},"status":"keep","description":"Shorten default OpenRouter application title header","timestamp":1777646237005,"segment":0,"confidence":233.60545905707684,"asi":{"hypothesis":"The default OpenRouter app title is metadata, not user-facing UI. Shortening 'TanStack Tutorial' to 'TanStack' preserves attribution while reducing duplicated server literals.","outcome":"Tiny primary improvement; build and typecheck pass.","risk_note":"OpenRouter dashboards/logs show a shorter default title unless OPENROUTER_APP_NAME is configured."}}
{"run":86,"commit":"5ef211f","metric":138.922,"metrics":{"bundle_raw_kb":462.346,"js_files":9,"css_kb":0},"status":"keep","description":"Inline OpenRouter API key lookup in chat model factory","timestamp":1777646261576,"segment":0,"confidence":225.2272727272693,"asi":{"hypothesis":"The OpenRouter API key binding in getChatModel is a pass-through local. Inlining the environment lookup after the guard may let minification/gzip slightly reduce the function while preserving the missing-key check.","outcome":"Very small primary improvement; build and typecheck pass.","risk_note":"The environment lookup is repeated once. This is acceptable for a per-request factory and keeps behavior unchanged."}}
{"run":87,"commit":"0c5a3e7","metric":138.91,"metrics":{"bundle_raw_kb":462.34,"js_files":9,"css_kb":0},"status":"keep","description":"Inline Brave API key lookup in web search tool","timestamp":1777646283515,"segment":0,"confidence":217.4526558891349,"asi":{"hypothesis":"The Brave API key local is another pass-through binding. Inlining the environment lookup after the guard should slightly reduce server tool code without changing behavior.","outcome":"Small primary improvement; build and typecheck pass.","risk_note":"Environment lookup is repeated once in a cold request path. The missing-key guard still prevents undefined header use."}}
{"run":88,"commit":"9be4dac","metric":138.87,"metrics":{"bundle_raw_kb":462.228,"js_files":9,"css_kb":0},"status":"keep","description":"Trust Brave search input schema instead of duplicating clamps","timestamp":1777646307479,"segment":0,"confidence":211.678651685383,"asi":{"hypothesis":"The Brave tool input schema already constrains query length and result count. Removing duplicate runtime clamp/slice logic should shrink tool middleware while keeping validation centralized in the schema.","outcome":"Primary metric improved; build and typecheck pass.","risk_note":"Assumes TanStack AI validates tool args against the Zod input schema before execute. If direct unvalidated calls are introduced, restore defensive clamps."}}
{"run":89,"commit":"501ca7e","metric":138.865,"metrics":{"bundle_raw_kb":462.189,"js_files":9,"css_kb":0},"status":"keep","description":"Remove redundant Accept header from Brave search fetch","timestamp":1777646341067,"segment":0,"confidence":206.13129102843644,"asi":{"hypothesis":"Brave Search returns JSON for its API endpoint without needing an explicit Accept header. Removing the redundant header shrinks server tool code while preserving the required subscription token.","outcome":"Tiny primary improvement; build and typecheck pass.","risk_note":"If Brave changes content negotiation requirements, restore the Accept: application/json header."}}
{"run":90,"commit":"501ca7e","metric":138.882,"metrics":{"bundle_raw_kb":462.184,"js_files":9,"css_kb":0},"status":"discard","description":"Combine getMessageText filtering and mapping","timestamp":1777646363401,"segment":0,"confidence":201.7173447537417,"asi":{"hypothesis":"Combining text-part filtering/mapping into one map plus Boolean filter might reduce message text extraction code.","rollback_reason":"Primary metric regressed; the original filter-then-map gzips better and has clearer typing/semantics.","next_action_hint":"Leave getMessageText extraction pipeline as-is unless changing behavior."}}
{"run":91,"commit":"ca6b53e","metric":138.821,"metrics":{"bundle_raw_kb":461.991,"js_files":9,"css_kb":0},"status":"keep","description":"Use render-time numeric keys in lightweight markdown blocks","timestamp":1777646395570,"segment":0,"confidence":197.58071278827015,"asi":{"hypothesis":"Markdown block parser currently stores string key prefixes inside every parsed block. Since blocks are rendered immediately, render-time numeric keys should preserve React reconciliation while shrinking parser data and code.","outcome":"Primary metric improved; build and typecheck pass. Markdown rendering behavior is unchanged except generated React keys are numeric/index-based.","risk_note":"Index keys are acceptable because parsed blocks are regenerated from immutable message content, not reordered interactive lists."}}
