{"run":125,"commit":"dc09909","metric":137.702,"metrics":{"bundle_raw_kb":458.378,"js_files":9,"css_kb":0},"status":"keep","description":"Use static typing dots instead of animated keyframes","timestamp":1777647506981,"segment":0,"confidence":168.04405286343749,"asi":{"hypothesis":"The typing indicator's semantic value is showing that the assistant is responding; bounce animation is decorative. Removing keyframes and animation styles should preserve the indicator while significantly reducing client code.","outcome":"Primary metric improved substantially; build and typecheck pass. Typing indicator still renders three visible dots with aria-label.","risk_note":"UI loses motion feedback. If animated affordance is a product requirement, restore the keyframes despite bundle cost."}}
{"run":126,"commit":"90dda2e","metric":137.624,"metrics":{"bundle_raw_kb":457.679,"js_files":9,"css_kb":0},"status":"keep","description":"Render typing indicator as text ellipsis","timestamp":1777647536787,"segment":0,"confidence":162.8720136518736,"asi":{"hypothesis":"A text ellipsis communicates assistant activity nearly as well as three styled dot spans, with much less client markup/style code. This preserves the typing indicator affordance and aria-label.","outcome":"Primary metric improved substantially; build and typecheck pass.","risk_note":"Typing indicator is visually simpler and no longer uses individually styled dots. Acceptable for lean tutorial harness."}}
{"run":127,"commit":"4019842","metric":137.608,"metrics":{"bundle_raw_kb":457.58,"js_files":9,"css_kb":0},"status":"keep","description":"Inline single-use typing indicator into Chat","timestamp":1777647563340,"segment":0,"confidence":161.93214588634407,"asi":{"hypothesis":"After simplifying TypingIndicator to a tiny ellipsis component, the file-level component boundary costs more than it helps. Inlining the single-use markup should shrink the client route while preserving behavior.","outcome":"Primary metric improved; build and typecheck pass. Deleted the now-trivial TypingIndicator module.","risk_note":"Component observability is slightly reduced for typing UI. If typing indicator grows again, extract it back into a component."}}
{"run":128,"commit":"971ea7d","metric":137.548,"metrics":{"bundle_raw_kb":457.505,"js_files":9,"css_kb":0},"status":"keep","description":"Inline single-use AG-UI status panel into Chat","timestamp":1777647600710,"segment":0,"confidence":157.88264462809443,"asi":{"hypothesis":"After simplifications, AgUiStatusPanel is used only by Chat and mostly passes through local state. Inlining it removes a component/module boundary while preserving the status UI.","outcome":"Primary metric improved; build and typecheck pass. Deleted the single-use AgUiStatusPanel module.","risk_note":"Chat.tsx is larger and component observability for status UI is reduced. Re-extract if status display grows more complex."}}
{"run":129,"commit":"1b7377b","metric":137.426,"metrics":{"bundle_raw_kb":457.408,"js_files":9,"css_kb":0},"status":"keep","description":"Inline single-use interactive search prompt into Chat","timestamp":1777647656540,"segment":0,"confidence":158.47721623860525,"asi":{"hypothesis":"InteractiveSearchPrompt is used only once and mostly passes through Chat state/setters. Inlining removes a component/module boundary and prop object plumbing while preserving the interactive search query UX.","outcome":"Primary metric improved; build and typecheck pass. Deleted the single-use InteractiveSearchPrompt module.","risk_note":"Chat.tsx grows and prompt UI observability is reduced. Re-extract if the interactive search flow gains complexity."}}
{"run":130,"commit":"d4256df","metric":137.318,"metrics":{"bundle_raw_kb":457.235,"js_files":9,"css_kb":0},"status":"keep","description":"Inline single-use follow-up list into Chat","timestamp":1777647685573,"segment":0,"confidence":157.74135090609573,"asi":{"hypothesis":"After simplification, FollowUps is a single-use passthrough component. Inlining it removes prop plumbing and a module boundary while preserving follow-up question rendering/click behavior.","outcome":"Primary metric improved; build and typecheck pass. Deleted the single-use FollowUps module.","risk_note":"Chat.tsx is more monolithic and follow-up UI component observability is reduced. Re-extract if follow-up UI grows."}}
{"run":131,"commit":"4f76485","metric":137.306,"metrics":{"bundle_raw_kb":457.151,"js_files":9,"css_kb":0},"status":"keep","description":"Remove unused suggestedQuery from pending search prompt state","timestamp":1777647741514,"segment":0,"confidence":157.3722267871836,"asi":{"hypothesis":"The suggested search query is stored separately in interactiveSearchInput; duplicating it inside pendingSearchQuery state is unnecessary. Removing the duplicate field clarifies state ownership and shrinks client code.","outcome":"Primary metric improved; build and typecheck pass. Updated autoresearch.md with recent kept/discarded lessons.","risk_note":"PendingSearchQueryRequest now only tracks prompt. The input field still receives the suggested query via interactiveSearchInput."}}
{"run":132,"commit":"4b159bd","metric":137.289,"metrics":{"bundle_raw_kb":457.123,"js_files":9,"css_kb":0},"status":"keep","description":"Store pending interactive search prompt as a string","timestamp":1777647780167,"segment":0,"confidence":157.0131147541022,"asi":{"hypothesis":"After removing suggestedQuery from pending search state, the remaining object only wraps a prompt string. Storing the string directly reduces state shape and object allocation while preserving UI behavior.","outcome":"Primary metric improved; build and typecheck pass.","risk_note":"If more pending search metadata is needed later, reintroduce an object state type."}}
{"run":133,"commit":"3c5a867","metric":137.222,"metrics":{"bundle_raw_kb":456.865,"js_files":9,"css_kb":0},"status":"keep","description":"Trust stored follow-up mode code from localStorage","timestamp":1777647818342,"segment":0,"confidence":156.353996737361,"asi":{"hypothesis":"Follow-up mode localStorage is written only by this app using compact internal codes. Removing runtime validation of the stored code shrinks initialization code while preserving normal settings behavior.","outcome":"Primary metric improved; build and typecheck pass.","risk_note":"If localStorage is manually corrupted, followUpMode may hold an unsupported code and fall back to heuristic behavior through the ternary chain. Restore validation if robust storage migration is needed."}}
{"run":134,"commit":"3c5a867","metric":137.235,"metrics":{"bundle_raw_kb":456.871,"js_files":9,"css_kb":0},"status":"discard","description":"Avoid duplicate free-model lookup in selection fallback","timestamp":1777647853590,"segment":0,"confidence":152.3767885532614,"asi":{"hypothesis":"The model selection fallback calls nextModels.find(model.free) twice; hoisting the free model might reduce duplicate code and runtime work.","rollback_reason":"Primary metric regressed; the additional local binding gzips worse than repeated compact find expressions in this context.","next_action_hint":"Keep the existing repeated expression unless optimizing runtime with a dedicated benchmark."}}
{"run":135,"commit":"89c5c42","metric":137.22,"metrics":{"bundle_raw_kb":456.83,"js_files":9,"css_kb":0},"status":"keep","description":"Let OpenRouter validate follow-up model ids","timestamp":1777647889935,"segment":0,"confidence":148.83074534161693,"asi":{"hypothesis":"The follow-up route is optional and already handles non-OK OpenRouter responses by returning no follow-ups. Removing pre-validation through the model catalog avoids extra server coupling and lets OpenRouter validate model ids.","outcome":"Tiny primary improvement; build and typecheck pass. Follow-up route no longer fetches the model catalog before its own OpenRouter call.","risk_note":"Invalid model ids now produce an OpenRouter request instead of local short-circuit, but the route still returns [] on non-OK/error."}}
{"run":136,"commit":"6c66c0f","metric":137.199,"metrics":{"bundle_raw_kb":456.677,"js_files":9,"css_kb":0},"status":"keep","description":"Only validate chat model catalog when thinking mode is requested","timestamp":1777647941588,"segment":0,"confidence":147.03680981594746,"asi":{"hypothesis":"OpenRouter can validate model ids for normal chat requests, while local catalog lookup is only needed to decide whether thinking options are supported. Skipping catalog validation when thinking is off should reduce route coupling and server code while preserving the common path.","outcome":"Primary metric improved; build and typecheck pass. Chat route still checks that a model string is present and still validates catalog support before enabling thinking options.","risk_note":"Unsupported model ids now reach OpenRouter on non-thinking requests and surface as provider errors instead of local 400s. This is acceptable because OpenRouter is the source of truth and error enrichment remains in place."}}
{"run":137,"commit":"6c66c0f","metric":138.706,"metrics":{"bundle_raw_kb":457.618,"js_files":12,"css_kb":0},"status":"discard","description":"Lazy-load ToolWidget for tool-call rendering","timestamp":1777647999657,"segment":0,"confidence":145.9178082191757,"asi":{"hypothesis":"Tool widgets are only needed when tool calls appear, so lazy-loading the ToolWidget module might reduce initial route chunk enough to improve total gzip despite extra chunks.","rollback_reason":"Primary metric regressed and js_files increased from 9 to 12. Total-JS metric penalizes chunk overhead more than the route-chunk reduction helps.","next_action_hint":"Do not pursue component lazy-loading under this total bundle metric unless splitting a much larger dependency or changing metric to initial JS only."}}
{"run":138,"commit":"6c66c0f","metric":137.181,"metrics":{"bundle_raw_kb":456.613,"js_files":9,"css_kb":0},"status":"checks_failed","description":"Remove unused no-op logger methods from OpenRouter error capture","timestamp":1777648021591,"segment":0,"confidence":143.7301349325334,"asi":{"hypothesis":"Only the logger.error callback captures provider errors, so debug/info/warn no-op methods might be removable to shrink the chat route.","rollback_reason":"Typecheck failed: TanStack AI debug logger type requires debug, info, and warn methods even if they are no-ops.","next_action_hint":"Keep full logger shape or try a shared noop function to reduce code while satisfying the Logger type."}}
{"run":139,"commit":"6c66c0f","metric":137.208,"metrics":{"bundle_raw_kb":456.688,"js_files":9,"css_kb":0},"status":"discard","description":"Share one noop function across required debug logger methods","timestamp":1777648050410,"segment":0,"confidence":142.44873699851672,"asi":{"hypothesis":"A shared noop function could satisfy TanStack AI's required Logger shape while reducing repeated arrow-function literals for debug/info/warn.","rollback_reason":"Primary metric regressed slightly versus the current best; the named noop binding gzips worse than repeated empty arrows in this context.","next_action_hint":"Leave logger no-op methods as separate inline arrows."}}
{"run":140,"commit":"4b8c240","metric":137.084,"metrics":{"bundle_raw_kb":455.929,"js_files":9,"css_kb":0},"status":"keep","description":"Show only latest AG-UI status instead of status history chips","timestamp":1777648077842,"segment":0,"confidence":141.35935198822347,"asi":{"hypothesis":"Experience observability in the UI is sufficiently served by the latest status label and progress bar; the historical chip list duplicates information and adds render/style code. Removing chips keeps live observability while making the status panel leaner.","outcome":"Primary metric improved; build and typecheck pass.","risk_note":"Users no longer see the recent sequence of status labels in the panel. Latest status and progress remain visible."}}
{"run":141,"commit":"69e96b9","metric":137.028,"metrics":{"bundle_raw_kb":455.808,"js_files":9,"css_kb":0},"status":"keep","description":"Store only latest AG-UI status event in state","timestamp":1777648108319,"segment":0,"confidence":141.13005143277402,"asi":{"hypothesis":"After removing status history chips, keeping an array of recent statuses is unnecessary. A single latest-status state value matches the UI contract and removes slice/spread/timestamp bookkeeping.","outcome":"Primary metric improved; build and typecheck pass. Removed unused `at` field from AgUiStatusEvent.","risk_note":"Status history is no longer retained in client state. This aligns with the simplified UI that shows only latest status."}}
{"run":142,"commit":"9373988","metric":136.991,"metrics":{"bundle_raw_kb":455.739,"js_files":9,"css_kb":0},"status":"keep","description":"Remove progress bar width transition","timestamp":1777648142879,"segment":0,"confidence":140.8739002932576,"asi":{"hypothesis":"The AG-UI progress bar communicates status through width and color; the width transition is decorative. Removing it preserves observability while shrinking inline style code.","outcome":"Primary metric improved; build and typecheck pass. Also pruned stale lazy-loading idea from autoresearch.ideas.md after the ToolWidget lazy experiment regressed.","risk_note":"Progress changes are no longer animated, but latest status/progress remain visible."}}
{"run":143,"commit":"6966bc9","metric":136.968,"metrics":{"bundle_raw_kb":455.66,"js_files":9,"css_kb":0},"status":"keep","description":"Remove error-specific progress bar color","timestamp":1777648177470,"segment":0,"confidence":138.87138728323842,"asi":{"hypothesis":"Chat errors are already shown in the dedicated error paragraph. The progress bar does not need a separate crimson error color, so a constant bar color should preserve clarity while shrinking status panel code.","outcome":"Primary metric improved; build and typecheck pass.","risk_note":"Status bar no longer visually turns red on provider errors, but the error message remains visible below the conversation."}}
{"run":144,"commit":"eda6e4b","metric":136.938,"metrics":{"bundle_raw_kb":455.319,"js_files":9,"css_kb":0},"status":"keep","description":"Show status label without separate AG-UI heading","timestamp":1777648211490,"segment":0,"confidence":136.74110953058266,"asi":{"hypothesis":"The latest status label and progress bar are enough to identify the status panel; a separate 'AG-UI' heading is redundant in this tutorial UI. Removing it simplifies panel markup.","outcome":"Primary metric improved; build and typecheck pass.","risk_note":"Panel context is less explicit, but status labels remain visible and the feature is still near the controls."}}
{"run":145,"commit":"da42959","metric":136.814,"metrics":{"bundle_raw_kb":454.769,"js_files":9,"css_kb":0},"status":"keep","description":"Reduce status panel to latest textual status","timestamp":1777648281771,"segment":0,"confidence":130.33581584292452,"asi":{"hypothesis":"After prior simplification, status progress is coarse and duplicates the textual lifecycle labels. Showing only the latest status label retains experience observability while removing progress bar markup/styles.","outcome":"Primary metric improved substantially; build and typecheck pass.","risk_note":"Users no longer see numeric/proportional progress, only textual status updates. Tool/status events still drive the latest label."}}
{"run":146,"commit":"d52446e","metric":136.771,"metrics":{"bundle_raw_kb":454.558,"js_files":9,"css_kb":0},"status":"keep","description":"Remove unused progress values from status event payloads","timestamp":1777648304643,"segment":0,"confidence":124.25290322580557,"asi":{"hypothesis":"Once the UI shows only textual status, numeric progress is unused. Removing progress arguments/payload fields from chat route and tools aligns event observability with displayed evidence and shrinks server/client contracts.","outcome":"Primary metric improved; build and typecheck pass. AgUiStatusEvent now contains only label.","risk_note":"Internal status events no longer carry progress for potential future consumers. Reintroduce progress if a progress bar or telemetry needs it again."}}
{"run":147,"commit":"5fa926e","metric":136.756,"metrics":{"bundle_raw_kb":454.504,"js_files":9,"css_kb":0},"status":"keep","description":"Shorten chat route status labels after simplifying status UI","timestamp":1777648337867,"segment":0,"confidence":122.68917197452284,"asi":{"hypothesis":"With status UI reduced to a single latest label, lifecycle labels can be concise while preserving observability. Shorter labels reduce server route literals and client event payload text.","outcome":"Primary metric improved; build and typecheck pass. A previous status-label attempt crashed before other route simplifications; this targeted retry now succeeds.","risk_note":"Labels are terser but still understandable: Model ready, Request sent, Run started, First token, Error, Complete."}}
{"run":148,"commit":"d47d8b0","metric":136.74,"metrics":{"bundle_raw_kb":454.457,"js_files":9,"css_kb":0},"status":"keep","description":"Shorten server tool status labels again","timestamp":1777648359226,"segment":0,"confidence":120.40875000000257,"asi":{"hypothesis":"Tool status labels now appear as the only status text, but can still be concise because the tool card/widget provides context. Removing extra punctuation and repeated arguments reduces status payload literals.","outcome":"Primary metric improved; build and typecheck pass.","risk_note":"Ready labels no longer include the city/symbol, but the surrounding tool call/widget still shows the target."}}
{"run":149,"commit":"dfeca9d","metric":136.669,"metrics":{"bundle_raw_kb":454.075,"js_files":9,"css_kb":0},"status":"keep","description":"Render latest status as simple text instead of panel","timestamp":1777648400182,"segment":0,"confidence":118.42506142506245,"asi":{"hypothesis":"With status UI reduced to a single label, boxed panel styling is mostly decorative. Rendering the latest status as a simple paragraph preserves status visibility and removes substantial markup/style code.","outcome":"Primary metric improved; build and typecheck pass.","risk_note":"Status is visually less prominent and no longer boxed. The text remains in the header near controls."}}
{"run":150,"commit":"b235dc7","metric":136.656,"metrics":{"bundle_raw_kb":454.034,"js_files":9,"css_kb":0},"status":"keep","description":"Remove latestStatus alias after status state simplification","timestamp":1777648423864,"segment":0,"confidence":116.43840579710503,"asi":{"hypothesis":"After reducing status state to a single value and rendering it once, the latestStatus alias is pass-through code. Removing it simplifies Chat state usage and shrinks client code.","outcome":"Primary metric improved; build and typecheck pass.","risk_note":"No behavior change expected."}}
{"run":151,"commit":"f5e091d","metric":136.648,"metrics":{"bundle_raw_kb":453.989,"js_files":9,"css_kb":0},"status":"keep","description":"Inline selected model lookup for thinking availability","timestamp":1777648462119,"segment":0,"confidence":114.64803804994332,"asi":{"hypothesis":"selectedModelInfo is only used to derive thinkingAvailable. Inlining the lookup removes a pass-through local while preserving the Thinking toggle logic.","outcome":"Tiny primary improvement; build and typecheck pass.","risk_note":"No behavior change expected."}}
{"run":152,"commit":"7902143","metric":136.646,"metrics":{"bundle_raw_kb":453.987,"js_files":9,"css_kb":0},"status":"keep","description":"Trust chat messages have parts arrays during rendering","timestamp":1777648482771,"segment":0,"confidence":112.50991831972007,"asi":{"hypothesis":"TanStack AI UI messages render with a parts array. Removing optional chaining on message.parts in the render loop shrinks client code while preserving normal message rendering.","outcome":"Very small primary improvement; build and typecheck pass.","risk_note":"If a future message lacks parts, rendering would throw. Current useChat message model provides parts."}}
{"run":153,"commit":"f9c6129","metric":136.642,"metrics":{"bundle_raw_kb":453.929,"js_files":9,"css_kb":0},"status":"keep","description":"Inline single-use follow-up custom event creator","timestamp":1777648506062,"segment":0,"confidence":111.92687173534817,"asi":{"hypothesis":"createFollowUpsEvent has one call site after event-name simplification. Inlining the small CUSTOM chunk removes a helper boundary while preserving the follow-up event payload.","outcome":"Tiny primary improvement; build and typecheck pass.","risk_note":"Slightly more inline code in the RUN_FINISHED branch; re-extract if more follow-up event call sites appear."}}
{"run":154,"commit":"f9c6129","metric":136.65,"metrics":{"bundle_raw_kb":453.886,"js_files":9,"css_kb":0},"status":"discard","description":"Inline single-use run-error chunk creator","timestamp":1777648533293,"segment":0,"confidence":111.34526558891643,"asi":{"hypothesis":"createRunErrorChunk has one call site, so inlining it might remove a helper boundary in the chat error middleware.","rollback_reason":"Primary metric regressed despite raw bytes decreasing; gzip favors the helper structure here.","next_action_hint":"Keep createRunErrorChunk extracted."}}
{"run":155,"commit":"b7c89df","metric":136.637,"metrics":{"bundle_raw_kb":453.877,"js_files":9,"css_kb":0},"status":"keep","description":"Omit timestamps from internal custom stream events","timestamp":1777648560107,"segment":0,"confidence":110.58486238531933,"asi":{"hypothesis":"The client does not read custom event timestamps, and TanStack stream chunks typecheck without them. Omitting timestamps from internal follow-up/status events should shrink server route code and payloads.","outcome":"Tiny primary improvement; build and typecheck pass.","risk_note":"Internal custom events no longer carry timestamps. Reintroduce if event timing diagnostics are needed."}}
