{"run":247,"commit":"16743bb","metric":134.939,"metrics":{"bundle_raw_kb":447.872,"js_files":8,"css_kb":0},"status":"keep","description":"Allow extra fields in request-search tool input schema","timestamp":1777664849239,"segment":0,"confidence":57.89262536873181,"asi":{"hypothesis":"The request_search_query client tool only reads prompt and suggestedQuery. For this internal clarification tool, forbidding additional input fields is unnecessary schema strictness; allowing extras should preserve behavior and shrink the JSON schema.","outcome":"Primary metric improved; build and enhanced checks pass.","risk_note":"The model/provider may now include extra fields in request_search_query tool calls. They are ignored by the client executor."}}
{"run":248,"commit":"ed00d86","metric":134.927,"metrics":{"bundle_raw_kb":447.826,"js_files":8,"css_kb":0},"status":"keep","description":"Trust Brave search results include title and URL","timestamp":1777664872280,"segment":0,"confidence":57.32476635514056,"asi":{"hypothesis":"Brave web search API results normally include title and URL. Removing the server-side filter/non-null assertions simplifies the tool result shaping while preserving normal search card behavior.","outcome":"Primary metric improved; build and enhanced checks pass.","risk_note":"If Brave returns a result without title or URL, the client may render an undefined value or broken link. Restore filtering if malformed results are observed."}}
{"run":249,"commit":"8f37842","metric":134.925,"metrics":{"bundle_raw_kb":447.82,"js_files":8,"css_kb":0},"status":"keep","description":"Trust Brave search result descriptions as returned","timestamp":1777664891070,"segment":0,"confidence":57.30919708029178,"asi":{"hypothesis":"Brave result descriptions are optional and the UI already stringifies rendered fields. Returning the description as-is removes an empty-string fallback in server result shaping.","outcome":"Tiny primary improvement; build and enhanced checks pass.","risk_note":"Missing Brave descriptions may render as undefined text in the search card. Restore fallback if that appears in practice."}}
{"run":250,"commit":"5d02ba5","metric":134.919,"metrics":{"bundle_raw_kb":447.812,"js_files":8,"css_kb":0},"status":"keep","description":"Trust Brave response echoes original query","timestamp":1777664916756,"segment":0,"confidence":57.229154518950324,"asi":{"hypothesis":"Brave search responses normally include query.original. Removing the fallback to the submitted query shrinks tool result shaping while preserving normal search cards.","outcome":"Tiny primary improvement; build and enhanced checks pass.","risk_note":"If Brave omits query.original, the search widget heading may show undefined. Restore fallback if that occurs."}}
{"run":251,"commit":"8a9af5c","metric":134.905,"metrics":{"bundle_raw_kb":447.76,"js_files":8,"css_kb":0},"status":"keep","description":"Use Brave default text decoration behavior","timestamp":1777664940960,"segment":0,"confidence":57.00464576074399,"asi":{"hypothesis":"The Brave search tool can rely on the API default for text_decorations instead of explicitly disabling it. This removes one query parameter while preserving search functionality.","outcome":"Primary metric improved; build and enhanced checks pass.","risk_note":"Brave snippets may include text decoration markers depending on API defaults. Restore the parameter if decorated snippets degrade UI readability."}}
{"run":252,"commit":"d054664","metric":134.889,"metrics":{"bundle_raw_kb":447.695,"js_files":8,"css_kb":0},"status":"keep","description":"Build Brave search URL directly with encoded query string","timestamp":1777664960789,"segment":0,"confidence":57.280046674445785,"asi":{"hypothesis":"The Brave tool only sets two query parameters. A direct encoded URL string should be leaner than constructing URL and mutating searchParams, while still preserving safe query encoding.","outcome":"Primary metric improved; build and enhanced checks pass.","risk_note":"Manual URL construction must remember encodeURIComponent for query. Add URLSearchParams back if more parameters are introduced."}}
{"run":253,"commit":"d054664","metric":134.898,"metrics":{"bundle_raw_kb":447.711,"js_files":8,"css_kb":0},"status":"discard","description":"Share repeated demo stock market-state string","timestamp":1777664982654,"segment":0,"confidence":56.766695576756234,"asi":{"hypothesis":"The stock demo data repeats 'Demo delayed' many times. Hoisting it to a shared constant might reduce output size.","rollback_reason":"Primary metric regressed; gzip handles the repeated literal better than an extra binding.","next_action_hint":"Keep repeated demo data strings inline."}}
{"run":254,"commit":"f7bb8d3","metric":134.885,"metrics":{"bundle_raw_kb":447.712,"js_files":8,"css_kb":0},"status":"keep","description":"Trust present chat messages have parts in text extraction helper","timestamp":1777665024813,"segment":0,"confidence":55.75354911981843,"asi":{"hypothesis":"getMessageText is called with optional messages, but any present TanStack UI message should have a parts array. Replacing optional chaining with an explicit missing-message guard removes defensive code while preserving normal extraction.","outcome":"Primary metric improved; build and enhanced checks pass.","risk_note":"If a present message lacks parts, getMessageText will throw. Current useChat message model provides parts arrays."}}
{"run":255,"commit":"f7bb8d3","metric":134.927,"metrics":{"bundle_raw_kb":447.72,"js_files":8,"css_kb":0},"status":"discard","description":"Use reduce for chat message text extraction","timestamp":1777665048749,"segment":0,"confidence":56.900608519269895,"asi":{"hypothesis":"A single reduce pass might be smaller than filter/map/join for extracting text parts from chat messages.","rollback_reason":"Primary metric regressed substantially; gzip/minifier favors the existing filter/map/join chain.","next_action_hint":"Keep getMessageText implemented as filter/map/join/trim."}}
{"run":256,"commit":"2748fdc","metric":134.877,"metrics":{"bundle_raw_kb":447.604,"js_files":8,"css_kb":0},"status":"keep","description":"Avoid normalizing assistant text for heuristic step detection","timestamp":1777665066345,"segment":0,"confidence":58.516090584028696,"asi":{"hypothesis":"The heuristic follow-up step detector only searches for step-related words, so whitespace normalization of assistant text is unnecessary. Testing the raw assistant text preserves the heuristic while removing string cleanup work.","outcome":"Primary metric improved; build and enhanced checks pass.","risk_note":"No meaningful semantic change expected; regex word fragments match across raw text just as they did after whitespace cleanup."}}
{"run":257,"commit":"c0837ce","metric":134.852,"metrics":{"bundle_raw_kb":447.563,"js_files":8,"css_kb":0},"status":"keep","description":"Trim user text without whitespace collapsing for heuristic follow-ups","timestamp":1777665092378,"segment":0,"confidence":57.926865231495285,"asi":{"hypothesis":"Heuristic follow-ups only need a trimmed user topic for length/greeting checks and display. Collapsing internal whitespace adds code with little value for optional suggestions.","outcome":"Primary metric improved; build and enhanced checks pass.","risk_note":"Follow-up topic text may preserve repeated whitespace from the user's message. Restore whitespace normalization if suggestions look messy."}}
{"run":258,"commit":"2a21fde","metric":134.842,"metrics":{"bundle_raw_kb":447.554,"js_files":8,"css_kb":0},"status":"keep","description":"Shorten greeting regex for generic follow-up heuristic","timestamp":1777665111059,"segment":0,"confidence":55.77796706416822,"asi":{"hypothesis":"The short-greeting heuristic can treat trailing non-word characters as punctuation/space. `\\W*` is a shorter equivalent for the intended hi/thanks cases than enumerating punctuation and whitespace.","outcome":"Primary metric improved; build and enhanced checks pass.","risk_note":"The regex now allows any trailing non-word characters, not just punctuation/space. This only affects optional generic follow-up selection for very short greetings."}}
{"run":259,"commit":"2a21fde","metric":134.844,"metrics":{"bundle_raw_kb":447.55,"js_files":8,"css_kb":0},"status":"discard","description":"Compact thanks/thank-you greeting regex alternatives","timestamp":1777665133549,"segment":0,"confidence":55.043429532081994,"asi":{"hypothesis":"Combining `thanks` and `thank you` alternatives with optional groups could reduce the greeting regex while preserving intended generic-follow-up detection.","rollback_reason":"Primary metric regressed and the regex would also match 'thank'/'thanks you', a semantic widening not worth keeping.","next_action_hint":"Keep the explicit `thanks|thank you` alternatives."}}
{"run":260,"commit":"2a21fde","metric":134.843,"metrics":{"bundle_raw_kb":447.554,"js_files":8,"css_kb":0},"status":"discard","description":"Use single ellipsis character in truncated follow-up topic","timestamp":1777665150193,"segment":0,"confidence":54.32798672566393,"asi":{"hypothesis":"Replacing three periods with a single ellipsis in truncated follow-up topics may reduce string bytes while preserving the visual truncation cue.","rollback_reason":"Primary metric regressed slightly; UTF-8 ellipsis/gzip did not help.","next_action_hint":"Keep ASCII `...` truncation marker."}}
{"run":261,"commit":"31b11d2","metric":134.834,"metrics":{"bundle_raw_kb":447.532,"js_files":8,"css_kb":0},"status":"keep","description":"Persist selected model setting even when empty","timestamp":1777665186858,"segment":0,"confidence":53.329533116178105,"asi":{"hypothesis":"The selected model is resolved after models load, and persisting an empty value before that is harmless because it is later overwritten. Removing the conditional write simplifies settings persistence.","outcome":"Primary metric improved; build and enhanced checks pass.","risk_note":"If model loading never succeeds, an empty selected-model string may be persisted over a previous value. The UI already cannot chat without a loaded/selected model in that state."}}
{"run":262,"commit":"31b11d2","metric":134.834,"metrics":{"bundle_raw_kb":447.532,"js_files":8,"css_kb":0},"status":"discard","description":"Use logical-or fallback for stored follow-up mode","timestamp":1777665207831,"segment":0,"confidence":52.84185045723563,"asi":{"hypothesis":"The stored follow-up mode should fall back to heuristic mode for null or empty string. `|| 'h'` might emit smaller than nullish coalescing with the same practical behavior.","rollback_reason":"Primary and raw metrics were unchanged, so the semantic widening from nullish-only to falsy fallback is not worth keeping.","next_action_hint":"Keep the existing nullish fallback for follow-up mode."}}
{"run":263,"commit":"31b11d2","metric":134.836,"metrics":{"bundle_raw_kb":447.521,"js_files":8,"css_kb":0},"status":"checks_failed","description":"Use unary plus in number formatter","timestamp":1777665260288,"segment":0,"confidence":52.57318704843465,"asi":{"hypothesis":"Unary plus may emit smaller than Number(value) for numeric formatting in tool widgets.","rollback_reason":"Typecheck failed because formatNumber accepts unknown and unary plus cannot be applied to unknown under strict TypeScript.","next_action_hint":"Either keep Number(value), or first narrow/cast value if revisiting; the projected metric also regressed versus best."}}
{"run":264,"commit":"89801e7","metric":134.805,"metrics":{"bundle_raw_kb":447.459,"js_files":8,"css_kb":0},"status":"keep","description":"Trust tool payloads are object-shaped when present","timestamp":1777665278906,"segment":0,"confidence":52.857450242065376,"asi":{"hypothesis":"Tool inputs/outputs are produced by TanStack tool calls and our server tools. The widget only needs to distinguish absent values; removing the object/type guard from parseToolPayload trims client rendering code.","outcome":"Primary metric improved; build and enhanced checks pass.","risk_note":"If a tool payload is a truthy primitive, the widget will treat it like an object and property lookups may render undefined/defaults. Current tools use object inputs/outputs."}}
{"run":265,"commit":"7bf2cad","metric":134.776,"metrics":{"bundle_raw_kb":447.345,"js_files":8,"css_kb":0},"status":"keep","description":"Inline erased tool payload casts into ToolWidget","timestamp":1777665304363,"segment":0,"confidence":53.015641855447704,"asi":{"hypothesis":"After trusting tool payload object shapes, parseToolPayload is just a TypeScript cast that erases to a pass-through function. Inlining the casts into ToolWidget removes the runtime helper entirely.","outcome":"Primary metric improved; build and enhanced checks pass.","risk_note":"ToolWidget now directly treats input/output as record-like values; restore a helper if payload validation is needed again."}}
{"run":266,"commit":"a292541","metric":134.771,"metrics":{"bundle_raw_kb":447.322,"js_files":8,"css_kb":0},"status":"keep","description":"Avoid eager input cast in ToolWidget pending state","timestamp":1777665332442,"segment":0,"confidence":52.93268712977925,"asi":{"hypothesis":"ToolWidget only displays the input payload when output is absent. Removing the eager args cast and stringifying input directly in that branch should shrink render code without changing pending tool display.","outcome":"Tiny primary improvement; build and enhanced checks pass.","risk_note":"Pending input display still stringifies whatever TanStack provides as input."}}
{"run":267,"commit":"2a38b7a","metric":134.759,"metrics":{"bundle_raw_kb":447.197,"js_files":8,"css_kb":0},"status":"keep","description":"Trust tool widget result field types for rendering","timestamp":1777665395220,"segment":0,"confidence":52.416955478539,"asi":{"hypothesis":"Tool outputs are produced by our server tools with known primitive field types. Casting the result to any and removing String wrappers in the widget should shrink render code while preserving normal weather/stock/search cards.","outcome":"Primary metric improved; build and enhanced checks pass.","risk_note":"If malformed tool results contain non-renderable values, React may warn or fail. Current internal tools return strings/numbers for rendered fields."}}
{"run":268,"commit":"e3f9d3d","metric":134.755,"metrics":{"bundle_raw_kb":447.182,"js_files":8,"css_kb":0},"status":"keep","description":"Trust Brave search result URL is already a string in widget","timestamp":1777665415284,"segment":0,"confidence":51.9070749736007,"asi":{"hypothesis":"The Brave server tool now trusts API result fields and returns URL directly. The widget can use searchResult.url without String coercion, preserving normal link rendering while trimming client code.","outcome":"Tiny primary improvement; build and enhanced checks pass.","risk_note":"If a malformed result has a non-string URL, the link key/href may be invalid. Current Brave results provide URL strings."}}
{"run":269,"commit":"9057784","metric":134.749,"metrics":{"bundle_raw_kb":447.166,"js_files":8,"css_kb":0},"status":"keep","description":"Trust stock changePercent is numeric in widget","timestamp":1777665435754,"segment":0,"confidence":51.78720042138535,"asi":{"hypothesis":"The stock demo tool returns numeric changePercent. Removing the extra Number coercion in the widget preserves normal formatting and shrinks render code.","outcome":"Primary metric improved; build and enhanced checks pass.","risk_note":"Malformed stock outputs with string changePercent rely on Math.abs coercion instead of explicit Number()."}}
{"run":270,"commit":"9057784","metric":134.751,"metrics":{"bundle_raw_kb":447.15,"js_files":8,"css_kb":0},"status":"discard","description":"Trust stock change is numeric in widget","timestamp":1777665463474,"segment":0,"confidence":51.9376650818806,"asi":{"hypothesis":"The stock demo tool returns numeric change, so the widget could remove Number(result.change).","rollback_reason":"Primary metric regressed despite raw bytes falling; gzip favors the explicit Number coercion shape here.","next_action_hint":"Keep Number(result.change) in the stock widget."}}
{"run":271,"commit":"9057784","metric":134.755,"metrics":{"bundle_raw_kb":447.155,"js_files":8,"css_kb":0},"status":"discard","description":"Use any plus unary coercion in number formatter","timestamp":1777665488009,"segment":0,"confidence":52.061424410907534,"asi":{"hypothesis":"Changing formatNumber to accept any and use unary plus avoids strict-unknown type errors and may emit smaller than Number(value).","rollback_reason":"Primary metric regressed; Number(value).toFixed(...) gzips better in this bundle.","next_action_hint":"Keep formatNumber(value: unknown) with Number(value)."}}
{"run":272,"commit":"db8b92f","metric":134.749,"metrics":{"bundle_raw_kb":447.166,"js_files":8,"css_kb":0},"status":"keep","description":"Update autoresearch notes with recent client-tool/provider trust lessons","timestamp":1777665512052,"segment":0,"confidence":52.18577494692105,"asi":{"hypothesis":"Persisting recent optimization lessons in autoresearch.md improves decision observability for future resumed agents without changing runtime output.","outcome":"Benchmark and enhanced checks pass; metric unchanged as expected for documentation-only update.","memory_update":"Documented minimal client tool object, localStorage inlining, provider response trust tradeoffs, optional attribution removal, method shorthand wins, and recent discarded dead ends."}}
{"run":273,"commit":"f6eb415","metric":134.74,"metrics":{"bundle_raw_kb":447.147,"js_files":8,"css_kb":0},"status":"keep","description":"Omit explicit false reasoning exclude option","timestamp":1777665551697,"segment":0,"confidence":52.218268720127185,"asi":{"hypothesis":"The thinking-mode model options only need to request reasoning effort and token budget. `exclude: false` is an explicit default-like flag, so omitting it should preserve visible reasoning behavior while trimming route code.","outcome":"Primary metric improved; build and enhanced checks pass.","risk_note":"If OpenRouter or the adapter defaults exclude to true for some models, thinking visibility could change. Restore exclude:false if reasoning output disappears."}}
{"run":274,"commit":"bf506a5","metric":134.735,"metrics":{"bundle_raw_kb":447.127,"js_files":8,"css_kb":0},"status":"keep","description":"Use default temperature for optional follow-up generation","timestamp":1777665579130,"segment":0,"confidence":51.8082191780823,"asi":{"hypothesis":"Model-generated follow-ups are optional suggestions and do not need a custom 0.5 temperature. Using provider/model default temperature removes one request option while preserving the feature.","outcome":"Tiny primary improvement; build and enhanced checks pass.","risk_note":"Follow-up creativity/variance may change with provider defaults. Restore temperature if suggestion quality becomes inconsistent."}}
{"run":275,"commit":"b40555b","metric":134.733,"metrics":{"bundle_raw_kb":447.109,"js_files":8,"css_kb":0},"status":"keep","description":"Send selected model string directly in chat body","timestamp":1777665611782,"segment":0,"confidence":52.34708544051058,"asi":{"hypothesis":"The send UI is disabled until a selected model exists, and the server already rejects empty/non-string models. Sending selectedModel directly avoids converting an empty string to undefined in the chat body.","outcome":"Primary metric improved; build and enhanced checks pass.","risk_note":"If a request is somehow submitted before model selection, the server now receives an empty string instead of undefined and still returns the existing 400 error."}}
{"run":276,"commit":"1ee39ba","metric":134.618,"metrics":{"bundle_raw_kb":446.754,"js_files":8,"css_kb":0},"status":"keep","description":"Trust tool-call parts expose standard fields in render loop","timestamp":1777665648999,"segment":0,"confidence":52.25530785562672,"asi":{"hypothesis":"Within the `part.type === 'tool-call'` branch, TanStack tool-call parts should expose id/name/state/input/output. Removing defensive `in` checks and String coercions simplifies tool rendering while preserving normal tool cards.","outcome":"Primary metric improved substantially; build and enhanced checks pass.","risk_note":"Malformed tool-call parts could render undefined key/name/state instead of fallbacks. Current useChat stream processor emits standard tool-call fields."}}
{"run":277,"commit":"def7bd2","metric":134.604,"metrics":{"bundle_raw_kb":446.672,"js_files":8,"css_kb":0},"status":"keep","description":"Let tool-result parts fall through to default null renderer","timestamp":1777665671355,"segment":0,"confidence":52.20731707317046,"asi":{"hypothesis":"The message part render loop already returns null for unhandled part types. The explicit tool-result null branch duplicates the default fallback and can be removed without changing rendering.","outcome":"Primary metric improved; build and enhanced checks pass.","risk_note":"No behavior change expected; tool-result parts still render nothing directly while tool-call parts show output."}}
{"run":278,"commit":"6bec628","metric":134.601,"metrics":{"bundle_raw_kb":446.667,"js_files":8,"css_kb":0},"status":"keep","description":"Use part index as tool-call render key","timestamp":1777665715439,"segment":0,"confidence":51.98838437169996,"asi":{"hypothesis":"Message parts are rendered in stream order and text parts already use index keys. Using index for tool-call parts removes dependency on tool.id while preserving stable rendering for this append-only message part list.","outcome":"Tiny primary improvement; build and enhanced checks pass.","risk_note":"If parts are reordered or inserted before existing tool calls, index keys are less stable than tool ids. Current stream appends/updates parts in place."}}
