{"run":217,"commit":"7374e64","metric":135.203,"metrics":{"bundle_raw_kb":448.766,"js_files":8,"css_kb":0},"status":"keep","description":"Inline localStorage setItem calls for settings persistence","timestamp":1777664189771,"segment":0,"confidence":65.52661533310963,"asi":{"hypothesis":"writeLocalStorage has four settings-only call sites. Direct localStorage.setItem calls with explicit String conversion for booleans should remove helper overhead while preserving persisted values.","outcome":"Primary metric improved; build and enhanced checks pass. Removed the writeLocalStorage helper.","risk_note":"Settings persistence is now duplicated inline. Reintroduce a helper if storage behavior becomes more complex."}}
{"run":218,"commit":"7374e64","metric":135.207,"metrics":{"bundle_raw_kb":448.75,"js_files":8,"css_kb":0},"status":"discard","description":"Use string concatenation for persisted boolean settings","timestamp":1777664204543,"segment":0,"confidence":64.51153592616905,"asi":{"hypothesis":"Converting booleans with `'' + value` may minify smaller than `String(value)` at the two localStorage write sites.","rollback_reason":"Primary metric regressed even though raw bytes decreased; gzip favors the repeated String conversion form.","next_action_hint":"Keep String(...) for boolean localStorage serialization."}}
{"run":219,"commit":"ffde9b2","metric":135.188,"metrics":{"bundle_raw_kb":448.724,"js_files":8,"css_kb":0},"status":"keep","description":"Stop trimming model-generated follow-up strings server-side","timestamp":1777664231807,"segment":0,"confidence":62.92446158791349,"asi":{"hypothesis":"The follow-up model is explicitly instructed to return short JSON strings. Keeping type filtering but dropping trim/non-empty cleanup reduces optional follow-up parsing code while preserving safe array-of-string output.","outcome":"Primary metric improved; build and enhanced checks pass.","risk_note":"Model-generated follow-ups may include surrounding whitespace or empty strings. The prompt strongly discourages that; restore cleanup if UI quality suffers."}}
{"run":220,"commit":"54c3956","metric":135.177,"metrics":{"bundle_raw_kb":448.682,"js_files":8,"css_kb":0},"status":"keep","description":"Trust model follow-up JSON array item types","timestamp":1777664252755,"segment":0,"confidence":62.58951406649532,"asi":{"hypothesis":"The optional follow-up route already asks OpenRouter for JSON with `followUps` strings and checks the top-level field is an array. Trusting item types removes extra validation while preserving normal model-follow-up behavior.","outcome":"Primary metric improved; build and enhanced checks pass.","risk_note":"If the model returns non-string array items, the client may receive/render unexpected values. Restore item filtering if malformed follow-up responses are observed."}}
{"run":221,"commit":"54c3956","metric":135.15,"metrics":{"bundle_raw_kb":448.607,"js_files":8,"css_kb":0},"status":"checks_failed","description":"Trust follow-up JSON shape completely and remove array guard","timestamp":1777664272015,"segment":0,"confidence":62.25119236884036,"asi":{"hypothesis":"Because the optional follow-up route requests JSON object output with a followUps array, removing the Array.isArray guard and using the parsed shape directly should shrink route code while falling back through catch on malformed missing fields.","rollback_reason":"Backpressure checks failed due a node segmentation fault while importing the built server entry. Treating as checks_failed per loop rules, so the change was not kept despite metric improvement.","next_action_hint":"The code change itself may be worth retrying if the segfault appears transient, but reassess runtime risk: strings or array-like non-arrays could leak through without the guard.","check_failure":"node -e import('./dist/server/server.js') segfaulted in autoresearch.checks.sh"}}
{"run":222,"commit":"00ac701","metric":135.15,"metrics":{"bundle_raw_kb":448.607,"js_files":8,"css_kb":0},"status":"keep","description":"Trust follow-up JSON response shape from OpenRouter","timestamp":1777664287624,"segment":0,"confidence":61.85533796588762,"asi":{"hypothesis":"The optional model-follow-up route asks OpenRouter for strict JSON object output with a followUps array. Trusting that shape and letting malformed/missing fields fall into the existing catch removes the array guard while preserving normal behavior.","outcome":"Retry passed build and enhanced checks; prior node segfault was transient. Primary metric improved.","risk_note":"If OpenRouter returns a non-array truthy followUps value with a slice method, malformed data could pass through. Missing fields throw and are caught as empty follow-ups."}}
{"run":223,"commit":"00ac701","metric":135.163,"metrics":{"bundle_raw_kb":448.614,"js_files":8,"css_kb":0},"status":"discard","description":"Reuse a shared empty follow-ups response object","timestamp":1777664320893,"segment":0,"confidence":61.7772870662463,"asi":{"hypothesis":"The follow-up route returns `{followUps: []}` from several fallback branches. A shared noFollowUps object might remove repeated object literals.","rollback_reason":"Primary metric regressed; gzip handles the repeated literal better than a named shared object binding.","next_action_hint":"Keep inline `{ followUps: [] }` fallback literals in the follow-up route."}}
{"run":224,"commit":"4ac7371","metric":135.142,"metrics":{"bundle_raw_kb":448.575,"js_files":8,"css_kb":0},"status":"keep","description":"Use validated follow-up request model field directly","timestamp":1777664338816,"segment":0,"confidence":61.70447385003194,"asi":{"hypothesis":"The follow-up route only needs to reject non-string model ids. After that guard, using body.model directly removes a temporary model variable while preserving request validation.","outcome":"Primary metric improved; build and enhanced checks pass.","risk_note":"No intended behavior change; body.model remains narrowed by the typeof guard."}}
{"run":225,"commit":"d5414d5","metric":135.13,"metrics":{"bundle_raw_kb":448.523,"js_files":8,"css_kb":0},"status":"keep","description":"Trust internal follow-up request message shapes","timestamp":1777664353889,"segment":0,"confidence":60.58583359109073,"asi":{"hypothesis":"The only in-app caller sends serializable follow-up messages with role and content already filtered. Removing the server-side role/content filter from the optional follow-up route shrinks route code while preserving normal internal behavior.","outcome":"Primary metric improved; build and enhanced checks pass.","risk_note":"Malformed external /api/followups requests may include messages with missing role/content in the prompt. This route is an internal optional helper, not a public API."}}
{"run":226,"commit":"b82268b","metric":135.121,"metrics":{"bundle_raw_kb":448.467,"js_files":8,"css_kb":0},"status":"keep","description":"Remove redundant follow-up message-count guard","timestamp":1777664373100,"segment":0,"confidence":60.05272838749233,"asi":{"hypothesis":"The client only calls /api/followups after it has serializable chat history and an assistant response. The server-side messages.length < 2 guard duplicates that internal contract for an optional helper route.","outcome":"Primary metric improved; build and enhanced checks pass.","risk_note":"Malformed or unusual internal calls with fewer than two messages may now ask OpenRouter for follow-ups instead of returning empty immediately. Restore guard if API cost control for external callers matters."}}
{"run":227,"commit":"7dcb0a5","metric":135.086,"metrics":{"bundle_raw_kb":448.404,"js_files":8,"css_kb":0},"status":"keep","description":"Shorten model follow-up generation system prompt","timestamp":1777664393995,"segment":0,"confidence":60.0557768924307,"asi":{"hypothesis":"The follow-up route prompt can be concise while preserving the core contract: return JSON containing three short follow-up questions. Removing filler/repetition wording should shrink server code without materially changing optional suggestions.","outcome":"Primary metric improved; build and enhanced checks pass.","risk_note":"The model has less explicit instruction to avoid filler/repetition and to base questions on the conversation. Restore wording if follow-up quality declines."}}
{"run":228,"commit":"26ed3df","metric":135.08,"metrics":{"bundle_raw_kb":448.344,"js_files":8,"css_kb":0},"status":"keep","description":"Omit optional X-Title header from follow-up OpenRouter request","timestamp":1777664410774,"segment":0,"confidence":59.930886850153236,"asi":{"hypothesis":"The optional model-follow-up request only needs Authorization and JSON content type to function. OpenRouter's X-Title attribution header is nice-to-have metadata and duplicates app naming elsewhere.","outcome":"Primary metric improved; build and enhanced checks pass.","risk_note":"OpenRouter analytics/rankings may no longer show the app title for follow-up requests. Restore X-Title if attribution is important."}}
{"run":229,"commit":"45560bf","metric":135.056,"metrics":{"bundle_raw_kb":448.283,"js_files":8,"css_kb":0},"status":"keep","description":"Omit optional OpenRouter app title metadata from chat adapter","timestamp":1777664433780,"segment":0,"confidence":59.90892420537913,"asi":{"hypothesis":"The chat adapter needs the OpenRouter API key and referer to function. The appTitle option only supplies attribution metadata, so omitting it should preserve chat behavior while trimming server/provider configuration.","outcome":"Primary metric improved; build and enhanced checks pass.","risk_note":"OpenRouter may show less app attribution metadata for main chat completions. Restore appTitle if analytics/ranking attribution is desired."}}
{"run":230,"commit":"42d27a6","metric":135.041,"metrics":{"bundle_raw_kb":448.208,"js_files":8,"css_kb":0},"status":"keep","description":"Use default OpenRouter adapter metadata for main chat","timestamp":1777664460147,"segment":0,"confidence":59.55407047387656,"asi":{"hypothesis":"OpenRouter requests can function with just model id and API key. Omitting the optional adapter metadata object removes provider-configuration code while preserving core chat completion behavior.","outcome":"Primary metric improved; build and enhanced checks pass.","risk_note":"Main chat requests no longer send a configured HTTP-Referer through the adapter. Restore metadata if OpenRouter attribution/ranking or deployment policy requires it."}}
{"run":231,"commit":"a93df1b","metric":135.003,"metrics":{"bundle_raw_kb":448.13,"js_files":8,"css_kb":0},"status":"keep","description":"Omit optional HTTP-Referer from follow-up OpenRouter request","timestamp":1777664477965,"segment":0,"confidence":59.43272727272759,"asi":{"hypothesis":"Like the main OpenRouter chat adapter, the optional follow-up fetch can function with Authorization and JSON content type only. Removing referer metadata trims route code while preserving API behavior.","outcome":"Primary metric improved; build and enhanced checks pass.","risk_note":"Follow-up requests no longer send HTTP-Referer attribution. Restore if OpenRouter deployment policy or rankings require it."}}
{"run":232,"commit":"36582fb","metric":135.002,"metrics":{"bundle_raw_kb":448.124,"js_files":8,"css_kb":0},"status":"keep","description":"Trust text message content chunks include string deltas","timestamp":1777664505384,"segment":0,"confidence":59.253776435045275,"asi":{"hypothesis":"TanStack AI TEXT_MESSAGE_CONTENT chunks should carry a string delta. Removing the nullish fallback from accumulated assistant text keeps server follow-up generation leaner.","outcome":"Tiny primary improvement; build and enhanced checks pass.","risk_note":"If a future TEXT_MESSAGE_CONTENT chunk has undefined delta, accumulatedContent would receive the string 'undefined'. Restore fallback if that stream shape appears."}}
{"run":233,"commit":"a1a7d8a","metric":135,"metrics":{"bundle_raw_kb":448.129,"js_files":8,"css_kb":0},"status":"keep","description":"Capture OpenRouter logger errors with nullish assignment expression","timestamp":1777664528815,"segment":0,"confidence":59.05871725383925,"asi":{"hypothesis":"The error-capture logger can preserve the last captured provider error with a single nullish assignment expression instead of an if block, keeping the same behavior when metadata lacks an error.","outcome":"Primary metric improved to 135.000kb; build and enhanced checks pass.","risk_note":"No intended semantic change: falsy meta.error values still do not replace the previous captured error."}}
{"run":234,"commit":"09481df","metric":134.997,"metrics":{"bundle_raw_kb":448.109,"js_files":8,"css_kb":0},"status":"keep","description":"Use method shorthand for OpenRouter error-capture logger","timestamp":1777664544980,"segment":0,"confidence":58.8655462184875,"asi":{"hypothesis":"The logger object must expose debug/info/warn/error methods for TanStack's Logger type, but method shorthand may emit/gzip smaller than arrow-function properties.","outcome":"Primary metric crossed below 135kb; build and enhanced checks pass.","risk_note":"No behavior change expected for the logger methods."}}
{"run":235,"commit":"12b4d7d","metric":134.994,"metrics":{"bundle_raw_kb":448.103,"js_files":8,"css_kb":0},"status":"keep","description":"Use method shorthand for client tool and custom event handlers","timestamp":1777664565564,"segment":0,"confidence":58.39416493003905,"asi":{"hypothesis":"The manual client tool and custom-event callbacks are object properties. Method shorthand should preserve runtime behavior and emit slightly leaner code than arrow properties.","outcome":"Tiny primary improvement; build and enhanced checks pass.","risk_note":"No semantic reliance on lexical this in these callbacks, so method syntax is safe."}}
{"run":236,"commit":"42b4e3f","metric":134.989,"metrics":{"bundle_raw_kb":448.088,"js_files":8,"css_kb":0},"status":"keep","description":"Use method shorthand for API route handlers","timestamp":1777664588056,"segment":0,"confidence":58.24109263657966,"asi":{"hypothesis":"TanStack route handler objects can use method shorthand for GET/POST handlers. This should preserve handler semantics and shrink emitted route code slightly compared with async arrow properties.","outcome":"Tiny primary improvement; build and enhanced checks pass.","risk_note":"No semantic reliance on lexical this in route handlers."}}
{"run":237,"commit":"37414a4","metric":134.986,"metrics":{"bundle_raw_kb":448.011,"js_files":8,"css_kb":0},"status":"keep","description":"Let follow-up OpenRouter non-OK responses fall through JSON parse path","timestamp":1777664608723,"segment":0,"confidence":58.001774098167175,"asi":{"hypothesis":"For optional follow-ups, non-OK OpenRouter responses can be handled by the existing parse/catch fallback: an error JSON lacks choices or invalid JSON throws, both resulting in empty follow-ups. Removing the explicit response.ok branch shrinks route code.","outcome":"Tiny primary improvement; build and enhanced checks pass.","risk_note":"A non-OK response with a choices-shaped body could now be used, though that is unlikely. The route still falls back to empty on parse/shape failures."}}
{"run":238,"commit":"37414a4","metric":134.991,"metrics":{"bundle_raw_kb":448.031,"js_files":8,"css_kb":0},"status":"checks_failed","description":"Pass optional follow-up content directly into parser","timestamp":1777664630174,"segment":0,"confidence":58.20830860534118,"asi":{"hypothesis":"parseFollowUps already catches JSON.parse failures, so passing undefined for missing model content could remove the empty-string fallback.","rollback_reason":"Typecheck failed because parseFollowUps still required string at the checked source location; the attempted signature change did not match the actual function text after recent edits.","next_action_hint":"If retrying, inspect the exact parseFollowUps signature first and change it together with the call, but note the metric also regressed versus best."}}
{"run":239,"commit":"37414a4","metric":134.986,"metrics":{"bundle_raw_kb":448.011,"js_files":8,"css_kb":0},"status":"discard","description":"Inline follow-up parse result into JSON response","timestamp":1777664649483,"segment":0,"confidence":57.45811364967802,"asi":{"hypothesis":"The follow-up route's content/followUps locals are single-use after simplification. Inlining parseFollowUps into the response object may remove temporary bindings.","rollback_reason":"Primary metric was unchanged and raw bytes unchanged; bundler already optimizes these single-use locals. Keep the clearer local variables.","next_action_hint":"Do not pursue trivial local inlining in the follow-up parse path without a metric signal."}}
{"run":240,"commit":"37414a4","metric":134.993,"metrics":{"bundle_raw_kb":448.048,"js_files":8,"css_kb":0},"status":"discard","description":"Import fetchServerSentEvents directly from ai-client","timestamp":1777664672136,"segment":0,"confidence":56.85855072463788,"asi":{"hypothesis":"@tanstack/ai-react re-exports fetchServerSentEvents from @tanstack/ai-client. Importing it directly might avoid part of the ai-react barrel re-export surface.","rollback_reason":"Primary metric regressed; the extra import path/module edge is worse than using the existing ai-react import.","next_action_hint":"Keep fetchServerSentEvents imported from @tanstack/ai-react unless replacing useChat entirely."}}
{"run":241,"commit":"37414a4","metric":134.987,"metrics":{"bundle_raw_kb":448.007,"js_files":8,"css_kb":0},"status":"discard","description":"Replace model label localeCompare sort with simple comparator","timestamp":1777664701164,"segment":0,"confidence":55.350451467268456,"asi":{"hypothesis":"OpenRouter model labels do not need locale-aware sorting for this tutorial. A simple `<` comparator might be smaller while preserving stable alphabetical-ish ordering.","rollback_reason":"Primary metric regressed slightly versus best and the semantic downgrade in sorting is not justified.","next_action_hint":"Keep localeCompare for model catalog sorting."}}
{"run":242,"commit":"2ae17d0","metric":134.979,"metrics":{"bundle_raw_kb":447.984,"js_files":8,"css_kb":0},"status":"keep","description":"Remove unused server tool execution context parameters","timestamp":1777664733860,"segment":0,"confidence":54.402662229617384,"asi":{"hypothesis":"The demo server tools do not use the TanStack tool execution context. Removing unused context parameters simplifies tool implementations without changing behavior.","outcome":"Primary metric improved; build and enhanced checks pass.","risk_note":"If tool implementations later need run/context metadata, re-add the second parameter."}}
{"run":243,"commit":"0b1e44c","metric":134.972,"metrics":{"bundle_raw_kb":447.955,"js_files":8,"css_kb":0},"status":"keep","description":"Shorten Brave Search tool HTTP error text","timestamp":1777664750572,"segment":0,"confidence":54.436736958934745,"asi":{"hypothesis":"Brave Search tool failures only need the service name and status code for actionable diagnostics in this tutorial. Dropping statusText and verbose wording trims server tool code.","outcome":"Primary metric improved; build and enhanced checks pass.","risk_note":"Brave tool errors are less descriptive; restore statusText if detailed provider diagnostics are needed."}}
{"run":244,"commit":"776e02e","metric":134.966,"metrics":{"bundle_raw_kb":447.935,"js_files":8,"css_kb":0},"status":"keep","description":"Shorten missing API key error messages","timestamp":1777664784876,"segment":0,"confidence":54.47029428095539,"asi":{"hypothesis":"Missing environment variable errors remain actionable with 'missing' instead of 'not configured'. Shortening repeated OpenRouter/Brave API key messages trims server code while preserving diagnostics.","outcome":"Primary metric improved; build and enhanced checks pass.","risk_note":"Error wording is terser but still names the exact missing environment variable."}}
{"run":245,"commit":"af9c9b2","metric":134.961,"metrics":{"bundle_raw_kb":447.919,"js_files":8,"css_kb":0},"status":"keep","description":"Shorten server tool descriptions","timestamp":1777664804656,"segment":0,"confidence":54.62472160356371,"asi":{"hypothesis":"Tool names and the chat system prompt already identify demo weather, stock quotes, and Brave search. Shorter tool descriptions should preserve model routing while trimming server tool definition literals.","outcome":"Primary metric improved; build and enhanced checks pass.","risk_note":"The model sees less explicit tool description text. Restore longer descriptions if tool selection quality declines."}}
{"run":246,"commit":"6617f2b","metric":134.953,"metrics":{"bundle_raw_kb":447.902,"js_files":8,"css_kb":0},"status":"keep","description":"Shorten request-search tool description","timestamp":1777664829690,"segment":0,"confidence":54.78168620882199,"asi":{"hypothesis":"The request_search_query name and chat system prompt already explain when to ask the user. A shorter description preserves tool semantics while trimming the server/client-shared tool definition.","outcome":"Primary metric improved; build and enhanced checks pass.","risk_note":"The model gets a terser description for the clarification tool. Restore if it stops using the tool for ambiguous searches."}}
