{"run":29,"commit":"38b0a6e","metric":140,"metrics":{"bundle_raw_kb":465.506,"js_files":9,"css_kb":0},"status":"keep","description":"Use compact internal codes for follow-up mode values","timestamp":1777644717648,"segment":0,"confidence":236.2106598984739,"asi":{"hypothesis":"Follow-up mode values are internal UI/storage codes while option labels remain user-facing. Compact codes should shrink repeated comparison/storage literals without changing visible behavior.","outcome":"Small primary improvement; build and typecheck pass.","tradeoff":"Stored follow-up mode values become less self-describing in localStorage. This is acceptable after shortening storage keys; labels and TypeScript union preserve source clarity enough."}}
{"run":30,"commit":"4bb8afc","metric":139.957,"metrics":{"bundle_raw_kb":465.44,"js_files":9,"css_kb":0},"status":"keep","description":"Shorten server tool status labels","timestamp":1777644741932,"segment":0,"confidence":234.82976040352904,"asi":{"hypothesis":"Tool status labels are user-visible but can be concise. Shorter labels should preserve experience observability while reducing repeated server/client text.","outcome":"Primary metric improved below 140kb; build and typecheck pass. Status panel still communicates progress for weather, stock, and Brave search.","risk_note":"Concise labels carry less explanatory prose but remain understandable in context."}}
{"run":31,"commit":"4bb8afc","metric":139.96,"metrics":{"bundle_raw_kb":465.429,"js_files":9,"css_kb":0},"status":"discard","description":"Shorten AG-UI status panel title","timestamp":1777644758329,"segment":0,"confidence":232.77499999999674,"asi":{"hypothesis":"Changing the panel label from 'AG-UI live' to 'Live' might slightly reduce client text while keeping the status UI understandable.","rollback_reason":"Primary metric was slightly worse within tiny/noisy range; gzip effects did not favor this label change.","next_action_hint":"Avoid user-facing copy micro-edits for byte savings unless they clearly improve the primary metric or UX."}}
{"run":32,"commit":"878d686","metric":139.946,"metrics":{"bundle_raw_kb":465.397,"js_files":9,"css_kb":0},"status":"keep","description":"Drop CRLF normalization from lightweight markdown parser","timestamp":1777644778054,"segment":0,"confidence":229.92839506172777,"asi":{"hypothesis":"Chat content streamed from APIs is normalized enough that explicit CRLF-to-LF replacement is unnecessary. Removing it should shrink the focused renderer with minimal behavior impact.","outcome":"Tiny primary improvement; build and typecheck pass.","risk_note":"If a message contains Windows CRLF line endings, rendered lines may retain trailing carriage returns in rare cases. Acceptable for this tutorial chat renderer."}}
{"run":33,"commit":"68cb27b","metric":139.938,"metrics":{"bundle_raw_kb":465.39,"js_files":9,"css_kb":0},"status":"keep","description":"Support standard dotted ordered lists only in markdown parser","timestamp":1777644794279,"segment":0,"confidence":227.1439024390106,"asi":{"hypothesis":"Markdown ordered lists overwhelmingly use '1.' syntax. Dropping '1)' support keeps common assistant step formatting while shrinking parser regexes.","outcome":"Tiny primary improvement; build and typecheck pass.","tradeoff":"Ordered lists written as '1)' now render as paragraphs. This is acceptable for a focused chat renderer."}}
{"run":34,"commit":"6011042","metric":139.936,"metrics":{"bundle_raw_kb":465.378,"js_files":9,"css_kb":0},"status":"keep","description":"Support dash unordered lists only in markdown parser","timestamp":1777644810410,"segment":0,"confidence":233.11889862327718,"asi":{"hypothesis":"Assistant markdown typically uses dash bullets. Dropping asterisk bullet support should slightly shrink regexes while retaining common list rendering.","outcome":"Very small primary improvement; build and typecheck pass.","tradeoff":"Asterisk-prefixed bullets now render as paragraphs. If broader markdown fidelity is needed, restore this or use a full markdown renderer despite bundle cost."}}
{"run":35,"commit":"b2b0278","metric":139.925,"metrics":{"bundle_raw_kb":465.305,"js_files":9,"css_kb":0},"status":"keep","description":"Shorten model-loading fallback error messages","timestamp":1777644844248,"segment":0,"confidence":239.43958868893984,"asi":{"hypothesis":"Fallback error strings can be concise without hiding actionable provider errors, because actual Error messages are still passed through when available.","outcome":"Tiny primary improvement; build and typecheck pass. Added a deferred high-risk custom useChat idea to autoresearch.ideas.md.","risk_note":"Generic fallback copy is shorter but less specific; actual OpenRouter/API errors remain detailed."}}
{"run":36,"commit":"b2b0278","metric":139.93,"metrics":{"bundle_raw_kb":465.274,"js_files":9,"css_kb":0},"status":"discard","description":"Shorten chat API fallback error strings","timestamp":1777644867868,"segment":0,"confidence":259.81032078104795,"asi":{"hypothesis":"Concise chat API fallback errors should preserve actionable meaning while shrinking server literals.","rollback_reason":"Primary metric regressed slightly after gzip despite raw bytes decreasing; existing wording compressed better with other OpenRouter-related strings.","next_action_hint":"Do not pursue more OpenRouter/error-copy micro-edits unless changing larger duplicated blocks."}}
{"run":37,"commit":"03dcebc","metric":139.896,"metrics":{"bundle_raw_kb":465.094,"js_files":9,"css_kb":0},"status":"keep","description":"Simplify OpenRouter thinking-support heuristic","timestamp":1777644906139,"segment":0,"confidence":268.50432276656414,"asi":{"hypothesis":"Thinking support detection can be expressed as compact parameter/name substring checks instead of several explicit includes plus a regex. This should preserve broad detection while shrinking server model-catalog code.","outcome":"Primary metric improved; build and typecheck pass.","tradeoff":"Heuristic no longer specially detects standalone o1/o3/o4/r1 tokens unless supported_parameters or model text includes one of the retained terms. Most current reasoning models advertise reasoning params or recognizable family names."}}
{"run":38,"commit":"070ba9f","metric":139.889,"metrics":{"bundle_raw_kb":465.039,"js_files":9,"css_kb":0},"status":"keep","description":"Collapse text-chat model modality checks into one return","timestamp":1777644920174,"segment":0,"confidence":274.0529411764793,"asi":{"hypothesis":"The OpenRouter text-chat predicate can be a single negated expression instead of three early returns, preserving filtering semantics with less emitted control flow.","outcome":"Tiny primary improvement; build and typecheck pass.","risk_note":"Readability is slightly denser, but the predicate remains localized and covered by typecheck/build."}}
{"run":39,"commit":"69415a0","metric":139.884,"metrics":{"bundle_raw_kb":465.039,"js_files":9,"css_kb":0},"status":"keep","description":"Use Boolean wrapper for free-model suffix check","timestamp":1777644933746,"segment":0,"confidence":311.64882943146097,"asi":{"hypothesis":"Boolean(model.id?.endsWith(':free')) may minify/gzip slightly better than optional chaining with nullish coalescing while preserving the same false fallback.","outcome":"Very small primary improvement; build and typecheck pass.","risk_note":"No semantic risk expected: undefined ids still become false."}}
{"run":40,"commit":"69415a0","metric":139.874,"metrics":{"bundle_raw_kb":465.009,"js_files":9,"css_kb":0},"status":"discard","description":"Simplify follow-up JSON parsing pipeline","timestamp":1777644955859,"segment":0,"confidence":318.0307167235581,"asi":{"hypothesis":"Collapsing parseFollowUps filter/map/filter/slice into a compact conditional expression might shrink server code.","rollback_reason":"Although primary improved, the simplified pipeline no longer returned trimmed follow-up strings, causing a subtle user-facing quality regression. Correctness/UX degradation is not worth this micro win.","next_action_hint":"If retrying, preserve trimming semantics; expect the metric benefit to shrink or disappear."}}
{"run":41,"commit":"69415a0","metric":139.897,"metrics":{"bundle_raw_kb":465.057,"js_files":9,"css_kb":0},"status":"discard","description":"Simplify follow-up parsing while preserving trimming with flatMap","timestamp":1777644977562,"segment":0,"confidence":330.4361702127868,"asi":{"hypothesis":"A flatMap-based parser could preserve string trimming while reducing the filter/map/filter pipeline.","rollback_reason":"Primary metric regressed versus the prior best; preserving trimming removes the apparent benefit of the previous unsafe simplification.","next_action_hint":"Leave parseFollowUps as-is. It is clearer and gzips better than the flatMap variant."}}
{"run":42,"commit":"502aec8","metric":139.879,"metrics":{"bundle_raw_kb":465.033,"js_files":9,"css_kb":0},"status":"keep","description":"Use numeric literal for OpenRouter model cache TTL","timestamp":1777644995081,"segment":0,"confidence":340.10218978102085,"asi":{"hypothesis":"The model cache TTL is a fixed constant; using `6e5` preserves the 10-minute value with a smaller emitted expression.","outcome":"Very small primary improvement; build and typecheck pass.","risk_note":"Readability of the duration is lower than `10 * 60 * 1000`, but the constant name still documents the purpose."}}
{"run":43,"commit":"d2f8768","metric":139.876,"metrics":{"bundle_raw_kb":465.027,"js_files":9,"css_kb":0},"status":"keep","description":"Use compact numeric timeout literals and shorter search schema hint","timestamp":1777645022050,"segment":0,"confidence":349.0299625468218,"asi":{"hypothesis":"Numeric separators in timeout literals and a slightly verbose search query schema hint add bytes without changing behavior. Compact literals preserve values; shorter hint preserves meaning.","outcome":"Very small primary improvement; build and typecheck pass.","risk_note":"Mostly byte-level cleanup; readability is slightly lower for timeout values but call sites remain obvious."}}
{"run":44,"commit":"d2f8768","metric":139.876,"metrics":{"bundle_raw_kb":465.027,"js_files":9,"css_kb":0},"status":"discard","description":"Use exponential literal for 400-character search limit","timestamp":1777645042567,"segment":0,"confidence":362.6108949416272,"asi":{"hypothesis":"Changing repeated 400 literals to 4e2 might minify to fewer bytes while preserving the search query limit.","rollback_reason":"Primary metric was unchanged, and readability is worse. No reason to keep a neutral byte-level change.","next_action_hint":"Stop trying numeric literal micro-edits unless they show a measurable improvement."}}
{"run":45,"commit":"72c511a","metric":139.871,"metrics":{"bundle_raw_kb":465.016,"js_files":9,"css_kb":0},"status":"keep","description":"Stop refetching model catalog when only free-only filter changes","timestamp":1777645103039,"segment":0,"confidence":377.31174089071015,"asi":{"hypothesis":"The free-only toggle is a local presentation filter over the already-loaded model catalog. Removing it from the catalog-loading effect dependencies should avoid unnecessary network work and slightly reduce client dependency code while preserving selection logic via handleFreeOnlyChange.","outcome":"Small primary improvement; build and typecheck pass. This is an AHE structural cleanup: model catalog fetching and local filtering are now more clearly separated.","risk_note":"Initial settings load still applies the stored free-only value before the models effect runs because settingsLoaded flips after reading storage. If React batching behavior changes, verify initial free-only selection manually."}}
{"run":46,"commit":"697993a","metric":139.849,"metrics":{"bundle_raw_kb":464.773,"js_files":9,"css_kb":0},"status":"keep","description":"Consolidate chat settings persistence effects","timestamp":1777645126547,"segment":0,"confidence":379.7067209776081,"asi":{"hypothesis":"AHE memory observability suggests settings persistence is one cohesive local-memory component, not four separate effects. Combining them should reduce hook/middleware surface while preserving the stored settings contract.","outcome":"Primary metric improved; build and typecheck pass. Selected model still avoids writing empty values, while boolean/mode settings persist together after settings load.","risk_note":"A change to any setting now rewrites all persisted settings. This is harmless for localStorage-sized values and makes the persisted snapshot more consistent."}}
{"run":47,"commit":"697993a","metric":139.871,"metrics":{"bundle_raw_kb":464.788,"js_files":9,"css_kb":0},"status":"discard","description":"Factor repeated response-state clearing into helper","timestamp":1777645152195,"segment":0,"confidence":382.0409836065578,"asi":{"hypothesis":"The three state resets before new sends/follow-up clicks are repeated harness cleanup logic; factoring them could reduce duplication and improve component observability.","rollback_reason":"Primary metric regressed; a local helper function cost more than the duplicated minified setter calls for two call sites.","next_action_hint":"Do not factor this reset block unless adding a third/fourth call site or changing reset semantics."}}
{"run":48,"commit":"cf57e82","metric":139.821,"metrics":{"bundle_raw_kb":464.686,"js_files":9,"css_kb":0},"status":"keep","description":"Shorten non-critical chat UI helper copy","timestamp":1777645178937,"segment":0,"confidence":390.9685534591397,"asi":{"hypothesis":"Several helper strings are user-facing but non-critical. Shorter loading/empty/placeholder copy should preserve usability while shrinking client literals.","outcome":"Primary metric improved; build and typecheck pass. The main controls and labels remain clear.","risk_note":"Copy is terser. If onboarding clarity is prioritized over bundle size, restore the longer empty-state and placeholder text."}}
{"run":49,"commit":"eb46580","metric":139.809,"metrics":{"bundle_raw_kb":464.664,"js_files":9,"css_kb":0},"status":"keep","description":"Shorten follow-up mode option labels","timestamp":1777645193956,"segment":0,"confidence":400.2489270386196,"asi":{"hypothesis":"Follow-up mode option labels can be concise because they are shown under a 'Follow-ups' control. Shorter labels preserve meaning while reducing client text.","outcome":"Small primary improvement; build and typecheck pass.","risk_note":"The 'Model' label is less explicit than 'Model call' but still understandable in context next to Heuristic/AG-UI/Off."}}
{"run":50,"commit":"a7c2e60","metric":139.793,"metrics":{"bundle_raw_kb":464.613,"js_files":9,"css_kb":0},"status":"keep","description":"Shorten fallback copy in tool widgets","timestamp":1777645209163,"segment":0,"confidence":423.01133786845105,"asi":{"hypothesis":"Tool widgets have fallback strings that are rarely shown and can be concise without reducing normal tool output quality. Shorter fallbacks and search header should shrink client text.","outcome":"Small primary improvement; build and typecheck pass.","risk_note":"Fallback labels are terser but still understandable when optional fields are absent."}}
{"run":51,"commit":"95c6a3e","metric":139.716,"metrics":{"bundle_raw_kb":464.443,"js_files":9,"css_kb":0},"status":"keep","description":"Shorten button title tooltips","timestamp":1777645225830,"segment":0,"confidence":448.80288461538805,"asi":{"hypothesis":"Native title text on the Thinking and Send/Stop buttons can be concise because visible button labels already carry the core affordance. Shorter titles reduce client literals without changing behavior.","outcome":"Primary metric improved; build and typecheck pass.","risk_note":"Titles are less explanatory for unavailable thinking support, but disabled state plus concise title remain accessible enough for this tutorial."}}
{"run":52,"commit":"ebfd32d","metric":139.693,"metrics":{"bundle_raw_kb":464.393,"js_files":9,"css_kb":0},"status":"keep","description":"Shorten accessible labels for chat controls","timestamp":1777645241091,"segment":0,"confidence":495.352785145876,"asi":{"hypothesis":"ARIA labels can be concise when adjacent visible text already clarifies the control. Shorter labels should preserve accessibility names while shrinking client text.","outcome":"Primary metric improved; build and typecheck pass.","risk_note":"Accessible names are shorter but still meaningful: Free models, Thinking, and Message."}}
{"run":53,"commit":"04ee67e","metric":139.688,"metrics":{"bundle_raw_kb":464.367,"js_files":9,"css_kb":0},"status":"keep","description":"Shorten AG-UI status region accessible label","timestamp":1777645287217,"segment":0,"confidence":552.5384615385182,"asi":{"hypothesis":"The status panel's accessible region label can be 'Status' because the visible heading still says AG-UI live. This preserves accessibility while reducing a long literal.","outcome":"Tiny primary improvement; build and typecheck pass.","risk_note":"If multiple status regions are added later, a more specific aria-label may be needed again."}}
{"run":54,"commit":"a7f8795","metric":139.646,"metrics":{"bundle_raw_kb":464.282,"js_files":9,"css_kb":0},"status":"keep","description":"Shorten server-generated heuristic follow-up suggestions","timestamp":1777645308368,"segment":0,"confidence":551.1563421828932,"asi":{"hypothesis":"Server-generated follow-up suggestions can use concise question wording while preserving intent, reducing server literals and emitted route code.","outcome":"Primary metric improved; build and typecheck pass. Suggestions remain actionable for weather, stocks, search, and generic answers.","risk_note":"Tone is terser. If conversational warmth is a product goal, longer suggestions may be preferable despite bundle cost."}}
{"run":55,"commit":"59b6dce","metric":139.593,"metrics":{"bundle_raw_kb":464.167,"js_files":9,"css_kb":0},"status":"keep","description":"Shorten client heuristic follow-up suggestions","timestamp":1777645336948,"segment":0,"confidence":522.2011173184299,"asi":{"hypothesis":"Client-side heuristic follow-ups can use concise question wording while preserving actionability, reducing client literals in the harness memory/experience layer.","outcome":"Primary metric improved; build and typecheck pass.","risk_note":"Follow-up tone is more terse. The suggestions remain clear, but product copy preferences could justify longer wording."}}
{"run":56,"commit":"3293522","metric":139.582,"metrics":{"bundle_raw_kb":464.153,"js_files":9,"css_kb":0},"status":"keep","description":"Trim uncommon greetings from heuristic follow-up regex","timestamp":1777645356258,"segment":0,"confidence":522.2625698323549,"asi":{"hypothesis":"The short-greeting heuristic only needs common greetings/thanks for this tutorial. Removing uncommon 'yo'/'sup' alternatives should slightly shrink the client regex while preserving mainstream behavior.","outcome":"Small primary improvement; build and typecheck pass.","tradeoff":"'yo' and 'sup' are no longer treated as too-short greetings; they will receive topic-specific follow-ups. This is acceptable for a focused tutorial."}}
{"run":57,"commit":"9d5c39e","metric":139.552,"metrics":{"bundle_raw_kb":464.06,"js_files":9,"css_kb":0},"status":"keep","description":"Shorten auxiliary prompt, follow-up, and typing labels","timestamp":1777645412185,"segment":0,"confidence":502.7688172043589,"asi":{"hypothesis":"Auxiliary UI labels around interactive search, follow-up sections, and typing status can be concise without hiding functionality. This should reduce client literals while preserving accessible names.","outcome":"Primary metric improved; build and typecheck pass.","risk_note":"Interactive search title is terser but still paired with the model-provided prompt and Search button."}}
{"run":58,"commit":"fda17b1","metric":139.536,"metrics":{"bundle_raw_kb":464.022,"js_files":9,"css_kb":0},"status":"keep","description":"Use compact prefixed localStorage keys","timestamp":1777645433425,"segment":0,"confidence":467.65500000005983,"asi":{"hypothesis":"After accepting compact local memory keys, shortening the per-setting suffixes further while keeping the `tc:` namespace should preserve collision resistance enough for this tutorial and reduce client literals.","outcome":"Primary metric improved; build and typecheck pass.","tradeoff":"Existing preferences under previous `tc:model`/`tc:free` keys will not migrate. Keys are less self-describing in browser devtools but source constants retain meaning."}}
{"run":59,"commit":"f6ddfdc","metric":139.484,"metrics":{"bundle_raw_kb":463.86,"js_files":9,"css_kb":0},"status":"keep","description":"Remove SSR guards from localStorage helpers used only in effects","timestamp":1777645454633,"segment":0,"confidence":437.3037383177598,"asi":{"hypothesis":"Chat settings storage helpers are only called from client-side effects. Removing `typeof window` guards clarifies the component boundary (client effect memory) and reduces client code without changing runtime behavior.","outcome":"Primary metric improved; build and typecheck pass.","risk_note":"Do not call these helpers during SSR/render. If storage access moves outside useEffect, reintroduce guards or split client-only helpers explicitly."}}
{"run":60,"commit":"1f819ea","metric":139.481,"metrics":{"bundle_raw_kb":463.824,"js_files":9,"css_kb":0},"status":"keep","description":"Collapse boolean localStorage parser","timestamp":1777645472653,"segment":0,"confidence":411.3670329670474,"asi":{"hypothesis":"The boolean storage parser can be a single expression preserving true/false/fallback semantics, reducing local-memory helper control flow.","outcome":"Tiny primary improvement; build and typecheck pass.","risk_note":"Expression is denser but still straightforward: true string wins, false string disables, otherwise fallback."}}
