{"run":92,"commit":"ca6b53e","metric":0,"metrics":{"bundle_raw_kb":0,"js_files":0,"css_kb":0},"status":"crash","description":"Remove markdown inline key prefixes","timestamp":1777646466276,"segment":0,"confidence":197.58071278827015,"asi":{"hypothesis":"Inline markdown nodes can use numeric match indexes as React keys, removing string key prefixes and renderInline keyPrefix parameters.","rollback_reason":"Edit introduced a JSX syntax error in list item renderInline call (missing closing parenthesis), causing an unterminated-regex parse failure at the following </li>.","next_action_hint":"Retry carefully: change renderInline(item, isUser, ...) to renderInline(item, isUser) with balanced braces, and key code/link nodes by match.index."}}
{"run":93,"commit":"37bd6ca","metric":138.767,"metrics":{"bundle_raw_kb":461.852,"js_files":9,"css_kb":0},"status":"keep","description":"Use numeric match indexes for markdown inline React keys","timestamp":1777646490671,"segment":0,"confidence":196.66319082378578,"asi":{"hypothesis":"Inline markdown nodes are generated from immutable text. Numeric regex match indexes are stable enough as React keys and let us remove keyPrefix strings/parameters from the renderer.","outcome":"Primary metric improved; build and typecheck pass after correcting the prior JSX syntax error.","risk_note":"If a single inline text segment contains both code and link tokens at the same start index (not possible with this regex), keys could collide. Current alternation emits one match per index."}}
{"run":94,"commit":"1ca5660","metric":138.753,"metrics":{"bundle_raw_kb":461.812,"js_files":9,"css_kb":0},"status":"keep","description":"Use compact internal markdown block type tags","timestamp":1777646514498,"segment":0,"confidence":195.6721991701248,"asi":{"hypothesis":"Markdown block type tags are internal parser data, not external API. Short tags (`c`, `l`, `p`) should preserve rendering while reducing parser literals.","outcome":"Primary metric improved; build and typecheck pass.","risk_note":"Source readability is slightly lower, but the discriminated union remains localized and clear enough."}}
{"run":95,"commit":"029deae","metric":138.737,"metrics":{"bundle_raw_kb":461.697,"js_files":9,"css_kb":0},"status":"keep","description":"Use compact internal markdown block property names","timestamp":1777646547932,"segment":0,"confidence":198.17226890756342,"asi":{"hypothesis":"Markdown parser block object properties (`type`, `content`, `ordered`, `items`) are internal and regenerated per render. Compact property names should reduce emitted property literals without affecting rendered output.","outcome":"Primary metric improved; build and typecheck pass.","risk_note":"Parser source is terser and less self-documenting. The type union localizes the compact naming to this file."}}
{"run":96,"commit":"029deae","metric":138.737,"metrics":{"bundle_raw_kb":461.697,"js_files":9,"css_kb":0},"status":"discard","description":"Remove intermediate markdown line variable","timestamp":1777646571975,"segment":0,"confidence":200.70212765957498,"asi":{"hypothesis":"The markdown parser's `line` local is single-use before trimming, so inlining it might reduce parser code.","rollback_reason":"Primary metric was unchanged; no value in keeping a neutral readability change.","next_action_hint":"Avoid neutral micro-edits in MarkdownContent unless they affect measured gzip or clarity."}}
{"run":97,"commit":"7687b32","metric":138.72,"metrics":{"bundle_raw_kb":461.613,"js_files":9,"css_kb":0},"status":"keep","description":"Trust regex matchAll indexes in markdown inline renderer","timestamp":1777646605410,"segment":0,"confidence":197.79245283019299,"asi":{"hypothesis":"String.matchAll with a global regex provides match indexes in this runtime. Replacing the defensive undefined guard with a non-null local should shrink inline markdown rendering while preserving behavior.","outcome":"Primary metric improved; build and typecheck pass.","risk_note":"Relies on standard matchAll index behavior. If supporting unusual polyfills, restore the guard."}}
{"run":98,"commit":"7687b32","metric":138.729,"metrics":{"bundle_raw_kb":461.654,"js_files":9,"css_kb":0},"status":"discard","description":"Use RegExp.exec loop for markdown inline tokens","timestamp":1777646636442,"segment":0,"confidence":194.93181818181463,"asi":{"hypothesis":"A manual RegExp.exec loop might be smaller than matchAll and avoid iterator machinery in the inline markdown renderer.","rollback_reason":"Primary metric regressed; reset/loop/type code gzips worse than the matchAll form.","next_action_hint":"Keep matchAll with trusted indexes. The current renderer is near local optimum."}}
{"run":99,"commit":"7687b32","metric":138.725,"metrics":{"bundle_raw_kb":461.602,"js_files":9,"css_kb":0},"status":"discard","description":"Use character indexing instead of startsWith for inline code detection","timestamp":1777646655960,"segment":0,"confidence":204.65726681127418,"asi":{"hypothesis":"Checking token[0] should minify smaller than token.startsWith for detecting backtick-delimited inline code.","rollback_reason":"Primary metric regressed slightly despite raw bytes decreasing; startsWith gzips better in the existing code context.","next_action_hint":"Keep startsWith for clarity and gzip. Do not assume raw-byte micro-edits improve compressed metric."}}
{"run":100,"commit":"2dde841","metric":138.639,"metrics":{"bundle_raw_kb":461.44,"js_files":9,"css_kb":0},"status":"keep","description":"Trust known tool result fields in widgets instead of fallback copy","timestamp":1777646688332,"segment":0,"confidence":200.05932203390677,"asi":{"hypothesis":"Tool widgets render outputs from known server tools whose return objects always include the displayed fields. Removing fallback strings for those known fields should shrink client code while preserving normal tool rendering.","outcome":"Primary metric improved; build and typecheck pass.","risk_note":"If malformed or third-party tool outputs are routed through these known tool widget branches, missing fields may display as 'undefined' instead of friendly fallback text. Current server tools return complete objects."}}
{"run":101,"commit":"2dde841","metric":138.65,"metrics":{"bundle_raw_kb":461.459,"js_files":9,"css_kb":0},"status":"discard","description":"Parse tool input lazily only when output is absent","timestamp":1777646718490,"segment":0,"confidence":197.13569937369553,"asi":{"hypothesis":"Tool input is only displayed while no output exists, so parsing it lazily after the result check might improve runtime and code size.","rollback_reason":"Primary metric regressed; introducing a nested const/block gzips worse despite possible runtime benefit.","next_action_hint":"Keep eager input parsing in ToolWidget unless optimizing runtime with a different metric."}}
{"run":102,"commit":"dbfa636","metric":138.631,"metrics":{"bundle_raw_kb":461.425,"js_files":9,"css_kb":0},"status":"keep","description":"Compact generic tool JSON fallback rendering","timestamp":1777646741737,"segment":0,"confidence":197.56485355649355,"asi":{"hypothesis":"The generic ToolWidget fallback is for unknown tools and does not need pretty-printed JSON. Compact JSON preserves information while reducing client code and output size.","outcome":"Tiny primary improvement; build and typecheck pass.","risk_note":"Unknown tool outputs are less readable. Known weather/stock/search widgets are unchanged."}}
{"run":103,"commit":"3c0b087","metric":138.612,"metrics":{"bundle_raw_kb":461.381,"js_files":9,"css_kb":0},"status":"keep","description":"Trust numeric tool fields in ToolWidget formatter","timestamp":1777646761866,"segment":0,"confidence":197.60460251046257,"asi":{"hypothesis":"Known weather/stock tool outputs always provide numeric fields. Converting with Number(...).toFixed removes fallback branch code while preserving normal display.","outcome":"Primary metric improved; build and typecheck pass.","risk_note":"Malformed numeric fields would display NaN instead of an em dash. Current server tools return complete numeric objects."}}
{"run":104,"commit":"f2458a9","metric":138.582,"metrics":{"bundle_raw_kb":461.322,"js_files":9,"css_kb":0},"status":"keep","description":"Trust stock change fields in ToolWidget","timestamp":1777646781390,"segment":0,"confidence":195.62111801242074,"asi":{"hypothesis":"Stock tool output always includes numeric change and changePercent. Removing defensive fallback branches should shrink the widget while preserving normal stock rendering.","outcome":"Primary metric improved; build and typecheck pass.","risk_note":"Malformed stock outputs would show NaN or incorrect arrow state. Current get_stock_quote always returns numeric fields."}}
{"run":105,"commit":"96fa836","metric":138.561,"metrics":{"bundle_raw_kb":461.249,"js_files":9,"css_kb":0},"status":"keep","description":"Trust Brave search result item shape in ToolWidget","timestamp":1777646803156,"segment":0,"confidence":192.2807731434321,"asi":{"hypothesis":"Brave search widget receives results produced by our server mapper, which always emits objects with URLs/titles/descriptions. Removing defensive per-item object fallback should shrink client code without changing normal rendering.","outcome":"Primary metric improved; build and typecheck pass.","risk_note":"Malformed search result arrays could now render 'undefined' URLs instead of empty fallbacks. Current brave_web_search mapper filters and maps complete objects."}}
{"run":106,"commit":"dd4f231","metric":138.542,"metrics":{"bundle_raw_kb":461.186,"js_files":9,"css_kb":0},"status":"keep","description":"Trust Brave search results array in ToolWidget","timestamp":1777646887385,"segment":0,"confidence":180.0476190476171,"asi":{"hypothesis":"For the known brave_web_search widget branch, result.results is produced as an array by the server tool. Removing the Array.isArray fallback shrinks client widget code.","outcome":"Primary metric improved; build and typecheck pass.","risk_note":"Malformed brave_web_search outputs would now throw when results is not an array. Current server mapper always returns an array."}}
{"run":107,"commit":"3bb5b1d","metric":138.533,"metrics":{"bundle_raw_kb":461.163,"js_files":9,"css_kb":0},"status":"keep","description":"Render all Brave results returned by server tool","timestamp":1777646909618,"segment":0,"confidence":177.19587628866336,"asi":{"hypothesis":"The server Brave tool already limits results via the `count` argument/default. Removing the widget's extra `.slice(0, 5)` simplifies UI code and can show all intentionally requested results.","outcome":"Tiny primary improvement; build and typecheck pass.","risk_note":"If model requests up to 10 results, the UI may render more links than before. This aligns with tool count semantics but could make responses longer."}}
{"run":108,"commit":"657706d","metric":138.446,"metrics":{"bundle_raw_kb":460.88,"js_files":9,"css_kb":0},"status":"keep","description":"Treat tool input/output payloads as parsed objects in ToolWidget","timestamp":1777646982807,"segment":0,"confidence":176.202979515836,"asi":{"hypothesis":"TanStack AI client message parts expose tool input/output as parsed values, and our server/client tools return objects. Removing JSON-string fallback parsing from ToolWidget should shrink client code while preserving normal widgets.","outcome":"Primary metric improved significantly; build and typecheck pass.","risk_note":"If a future adapter supplies tool input/output as JSON strings, widgets will no longer parse them and may fall back/null. Current TanStack client events carry output as unknown values and our tool executions return objects."}}
{"run":109,"commit":"0384a29","metric":138.427,"metrics":{"bundle_raw_kb":460.854,"js_files":9,"css_kb":0},"status":"keep","description":"Remove redundant State label prefix from tool-call cards","timestamp":1777647018096,"segment":0,"confidence":173.01645338208056,"asi":{"hypothesis":"Tool-call cards already sit under a tool heading, so showing the state value alone communicates progress. Removing the 'State:' prefix reduces client text without hiding the state.","outcome":"Primary metric improved; build and typecheck pass.","risk_note":"Tool status is terser; if users need explicit labeling, restore the prefix."}}
{"run":110,"commit":"5613465","metric":138.408,"metrics":{"bundle_raw_kb":460.797,"js_files":9,"css_kb":0},"status":"keep","description":"Shorten tool-call card labels","timestamp":1777647038966,"segment":0,"confidence":167.83510638298085,"asi":{"hypothesis":"Tool-call card labels can be concise because icons and widget content provide context. Shortening 'Weather tool', 'Stock tool', etc. preserves meaning while reducing client literals.","outcome":"Primary metric improved; build and typecheck pass.","risk_note":"Labels are terser but still recognizable with icons."}}
{"run":111,"commit":"aaad2ce","metric":138.335,"metrics":{"bundle_raw_kb":460.732,"js_files":9,"css_kb":0},"status":"keep","description":"Remove emojis from tool-call card labels","timestamp":1777647067404,"segment":0,"confidence":169.92286995515988,"asi":{"hypothesis":"Emojis in tool-call labels are decorative rather than functional. Removing them preserves labels and widgets while reducing multi-byte client literals.","outcome":"Primary metric improved; build and typecheck pass.","risk_note":"Tool cards are visually plainer. Functionality and text labels remain."}}
{"run":112,"commit":"e7e617b","metric":138.313,"metrics":{"bundle_raw_kb":460.723,"js_files":9,"css_kb":0},"status":"keep","description":"Remove decorative emoji from interactive search prompt","timestamp":1777647087841,"segment":0,"confidence":166.82042253520777,"asi":{"hypothesis":"The magnifying-glass emoji in the interactive search prompt is decorative. Removing it preserves the prompt text and button while reducing client bytes.","outcome":"Primary metric improved; build and typecheck pass.","risk_note":"Search query prompt is visually plainer but still clear."}}
{"run":113,"commit":"0dee121","metric":138.31,"metrics":{"bundle_raw_kb":460.713,"js_files":9,"css_kb":0},"status":"keep","description":"Shorten AG-UI status panel heading","timestamp":1777647111378,"segment":0,"confidence":165.8040244969419,"asi":{"hypothesis":"After other copy simplifications, shortening the status panel heading from 'AG-UI live' to 'AG-UI' should preserve context while reducing client text.","outcome":"Tiny primary improvement; build and typecheck pass. A prior 'Live' change regressed, but this wording gzips favorably and is more specific.","risk_note":"Heading no longer explicitly says live, but the progress/status content implies activity."}}
{"run":114,"commit":"61942a2","metric":138.212,"metrics":{"bundle_raw_kb":460.251,"js_files":9,"css_kb":0},"status":"keep","description":"Remove decorative follow-up arrow column","timestamp":1777647133940,"segment":0,"confidence":166.12084063047348,"asi":{"hypothesis":"The arrow glyph and two-column grid in follow-up buttons are decorative. Removing them preserves clickable question text while simplifying the follow-up UI component.","outcome":"Primary metric improved; build and typecheck pass.","risk_note":"Follow-up suggestions are visually plainer without the arrow indicator, but remain clearly grouped under the Follow-ups heading."}}
{"run":115,"commit":"61942a2","metric":138.217,"metrics":{"bundle_raw_kb":460.239,"js_files":9,"css_kb":0},"status":"discard","description":"Shorten visible follow-up section heading to Next","timestamp":1777647157297,"segment":0,"confidence":166.12084063046936,"asi":{"hypothesis":"The visible follow-up section heading could be shorter ('Next') while aria-label keeps 'Follow-ups'.","rollback_reason":"Primary metric regressed slightly despite raw bytes decreasing; gzip favored the repeated Follow-ups string.","next_action_hint":"Keep visible and aria labels aligned as Follow-ups."}}
{"run":116,"commit":"70ed938","metric":138.203,"metrics":{"bundle_raw_kb":460.196,"js_files":9,"css_kb":0},"status":"keep","description":"Remove redundant follow-up section aria-label","timestamp":1777647179734,"segment":0,"confidence":169.39999999999932,"asi":{"hypothesis":"The follow-up section already has a visible h2 heading, so the duplicate aria-label is unnecessary. Removing it preserves accessibility structure and reduces client text/props.","outcome":"Primary metric improved; build and typecheck pass.","risk_note":"Section no longer has an explicit accessible name; the visible heading remains adjacent. If formal landmark naming is required, restore aria-labelledby instead."}}
{"run":117,"commit":"9983b23","metric":138.194,"metrics":{"bundle_raw_kb":460.149,"js_files":9,"css_kb":0},"status":"keep","description":"Remove status panel aria-label prop","timestamp":1777647209869,"segment":0,"confidence":169.41607142856648,"asi":{"hypothesis":"The AG-UI status panel is visually labeled and not a landmark that requires a separate accessible name. Removing the short aria-label reduces client props without changing visible behavior.","outcome":"Tiny primary improvement; build and typecheck pass.","risk_note":"Screen readers will not get a named section for the status panel. Restore an accessible label if formal region navigation becomes important."}}
{"run":118,"commit":"8406cbd","metric":138.183,"metrics":{"bundle_raw_kb":460.111,"js_files":9,"css_kb":0},"status":"keep","description":"Remove model select title attribute","timestamp":1777647241000,"segment":0,"confidence":169.43571428571363,"asi":{"hypothesis":"The native model select already displays the selected option and exposes options in the dropdown. The extra title attribute duplicating the model id is non-essential client UI metadata.","outcome":"Primary metric improved; build and typecheck pass.","risk_note":"Users no longer see the raw model id on hover. The selected label remains visible."}}
{"run":119,"commit":"13d7fb3","metric":138.174,"metrics":{"bundle_raw_kb":460.05,"js_files":9,"css_kb":0},"status":"keep","description":"Remove redundant send button title attribute","timestamp":1777647280408,"segment":0,"confidence":169.60321715817267,"asi":{"hypothesis":"The send/stop button's visible text already states the action, so its title attribute duplicates UI text. Removing it shrinks client props without reducing functionality.","outcome":"Primary metric improved; build and typecheck pass.","risk_note":"Hover tooltip for send/stop is gone; visible button label remains."}}
{"run":120,"commit":"7e80931","metric":138.136,"metrics":{"bundle_raw_kb":459.929,"js_files":9,"css_kb":0},"status":"keep","description":"Remove thinking button title attribute","timestamp":1777647316104,"segment":0,"confidence":169.82289803220115,"asi":{"hypothesis":"The Thinking toggle has visible text and disabled styling; its title attribute is helpful but not essential. Removing it simplifies the control and reduces client text.","outcome":"Primary metric improved; build and typecheck pass.","risk_note":"Users no longer get a hover explanation for unavailable thinking support. Disabled styling still indicates unavailable state."}}
{"run":121,"commit":"0199f5e","metric":138.07,"metrics":{"bundle_raw_kb":459.591,"js_files":9,"css_kb":0},"status":"keep","description":"Trust internal follow-up custom event payload shape","timestamp":1777647345603,"segment":0,"confidence":168.13628318584142,"asi":{"hypothesis":"The `f` custom event is produced only by our chat route with `{followUps}` shape. Removing client-side runtime validation focuses observability on trusted internal contracts and shrinks event handling code.","outcome":"Primary metric improved; build and typecheck pass.","risk_note":"Malformed or third-party `f` events could now set undefined/non-string follow-ups. Current event namespace is internal and server-controlled."}}
{"run":122,"commit":"52a9866","metric":137.988,"metrics":{"bundle_raw_kb":459.292,"js_files":9,"css_kb":0},"status":"keep","description":"Trust internal status custom event payload shape","timestamp":1777647386871,"segment":0,"confidence":167.09841827768355,"asi":{"hypothesis":"Status custom events `s` and `t` are produced by our server route/tools with known label/progress payloads. Removing runtime shape validation should shrink client event middleware while preserving internal behavior.","outcome":"Primary metric improved below 138kb; build and typecheck pass.","risk_note":"Malformed internal status events could now enter state. The short event names remain internal; reintroduce validation if accepting third-party custom events."}}
{"run":123,"commit":"7dc5a67","metric":137.981,"metrics":{"bundle_raw_kb":459.238,"js_files":9,"css_kb":0},"status":"keep","description":"Inline typing keyframes into Chat and remove agui helper module","timestamp":1777647431531,"segment":0,"confidence":164.366464995681,"asi":{"hypothesis":"After removing status validation, chat/agui.ts only exports one keyframe string used by Chat. Inlining it removes a single-use module boundary while preserving the typing animation.","outcome":"Tiny primary improvement; build and typecheck pass. Deleted now-empty AG-UI helper module.","risk_note":"If AG-UI helpers grow again, consider reintroducing a dedicated module for component observability."}}
{"run":124,"commit":"1a34a09","metric":137.962,"metrics":{"bundle_raw_kb":459.186,"js_files":9,"css_kb":0},"status":"keep","description":"Minify inline typing keyframes string","timestamp":1777647468593,"segment":0,"confidence":167.438380281695,"asi":{"hypothesis":"The typing keyframes are embedded as a literal style string and are not processed by CSS minification. Manually minifying whitespace and numeric syntax preserves animation while reducing client bytes.","outcome":"Primary metric improved; build and typecheck pass.","risk_note":"CSS string is less readable. Keep it localized; if animation styling grows, move to processed CSS with total-size monitoring."}}
