{"type":"config","name":"Apply AHE to TanStack chat harness while keeping bundle lean","metricName":"bundle_gzip_kb","metricUnit":"kb","bestDirection":"lower"}
{"run":1,"commit":"66e70a6","metric":233.067,"metrics":{"bundle_raw_kb":776.881,"js_files":9,"css_kb":0},"status":"keep","description":"Baseline AHE session setup and current chat harness bundle measurement","timestamp":1777643871372,"segment":0,"confidence":null,"asi":{"hypothesis":"Establish an observability-driven loop inspired by AHE: explicit files in scope, reproducible bundle metric, and typecheck backpressure before changing harness structure.","paper_applied":"Mapped AHE component/experience/decision observability to autoresearch.md scope, METRIC output, checks, and ASI hypotheses.","user_changes_note":"Repository had pre-existing uncommitted chat changes; baseline keep records the current app state plus autoresearch harness on the autoresearch branch."}}
{"run":2,"commit":"0cd60e9","metric":190.158,"metrics":{"bundle_raw_kb":630.432,"js_files":9,"css_kb":0},"status":"keep","description":"Replace heavy markdown dependency path with lightweight safe inline renderer","timestamp":1777643919554,"segment":0,"confidence":null,"asi":{"hypothesis":"AHE structural simplification: markdown rendering is a component-level harness service; replacing general GFM dependencies with a focused renderer for chat needs should preserve common formatting while reducing client payload.","outcome":"Large primary improvement by removing react-markdown/remark-gfm from the client import graph; typecheck and build still pass.","tradeoff":"Renderer supports paragraphs, ordered/unordered lists, fenced code, inline code, and http/mailto links, but not full GFM tables/task lists. This is acceptable for tutorial chat unless full GFM is a hard requirement."}}
{"run":3,"commit":"9ba0b22","metric":159.296,"metrics":{"bundle_raw_kb":533.897,"js_files":9,"css_kb":0},"status":"keep","description":"Replace Radix controls with native form controls for lean harness UI","timestamp":1777643968925,"segment":0,"confidence":2.39035059296222,"asi":{"hypothesis":"Component observability exposed Radix Select/Toggle/Tooltip/ScrollArea as heavyweight UI harness components. Native select/button/title/scroll containers should preserve tutorial functionality and accessibility while reducing dependencies in the client graph.","outcome":"Primary bundle metric improved substantially; build and typecheck pass. Native controls keep model selection, toggles, scrolling, and send/stop affordances.","tradeoff":"Custom popper styling/check icons/tooltips were simplified to browser-native controls; acceptable because behavior remains clear and the app becomes more transferable/less framework-specific."}}
{"run":4,"commit":"958c5d3","metric":156.415,"metrics":{"bundle_raw_kb":524.741,"js_files":9,"css_kb":0},"status":"keep","description":"Split client request-search tool definition from server-only tool implementations","timestamp":1777643998237,"segment":0,"confidence":4.543283051299531,"asi":{"hypothesis":"AHE component observability suggests client and server tool components need explicit file boundaries. Moving request_search_query to a small shared module should keep the client from pulling demo weather/stock/Brave server tool definitions into the route chunk.","outcome":"Bundle improved modestly; build and typecheck pass. Client Chat now imports only the interactive tool definition it actually needs.","transferable_lesson":"File-level component boundaries matter for bundlers: mixed client/server tool modules can leak unnecessary harness structure into browser code."}}
{"run":5,"commit":"0217b2b","metric":140.721,"metrics":{"bundle_raw_kb":467.63,"js_files":9,"css_kb":0},"status":"keep","description":"Use plain JSON Schema for browser-side interactive tool definition","timestamp":1777644020740,"segment":0,"confidence":4.971520861372817,"asi":{"hypothesis":"Decision observability from the prior split showed the remaining shared client tool still carried Zod. TanStack AI accepts plain JSON Schema, so using JSON Schema for the client-visible request_search_query contract should preserve provider/tool metadata while dropping Zod from browser bundles.","outcome":"Large improvement; build and typecheck pass. The schema remains explicit and serializable, matching AHE's preference for file-level, inspectable component contracts.","tradeoff":"Lost Zod-inferred static arg typing for this one client tool definition, but Chat already narrows tool input at runtime and the schema contract remains precise."}}
{"run":6,"commit":"0217b2b","metric":140.981,"metrics":{"bundle_raw_kb":468.597,"js_files":9,"css_kb":0},"status":"discard","description":"Try plain client tool object instead of toolDefinition.client wrapper","timestamp":1777644064349,"segment":0,"confidence":5.430680114087445,"asi":{"hypothesis":"A plain AnyClientTool-shaped object might avoid importing toolDefinition code into the browser while preserving the client tool contract.","rollback_reason":"Primary metric regressed slightly; likely because the shared request-search-tool module still imports toolDefinition for the server definition, so the client chunk did not avoid the import and added wrapper code.","next_action_hint":"If revisiting, split schema constants into a third module that has no @tanstack/ai import, with separate server definition and client plain-object factory files."}}
{"run":7,"commit":"0217b2b","metric":140.845,"metrics":{"bundle_raw_kb":468.245,"js_files":9,"css_kb":0},"status":"discard","description":"Split request-search schema constants and use plain client tool object","timestamp":1777644096350,"segment":0,"confidence":5.931021194605012,"asi":{"hypothesis":"Separating schema constants from the server toolDefinition import should let the browser use a plain client tool object without pulling server definition code.","rollback_reason":"Primary metric still regressed slightly versus the prior best; @tanstack/ai-react/@tanstack/ai-client likely already bring the relevant runtime, and the extra factory/module boundary adds overhead.","next_action_hint":"Keep the simpler toolDefinition.client setup. Focus next on actual route/UI code or server bundle rather than this micro-split."}}
{"run":8,"commit":"3ce6fac","metric":140.689,"metrics":{"bundle_raw_kb":467.503,"js_files":9,"css_kb":0},"status":"keep","description":"Remove identity clientTools wrapper and unused AG-UI status local","timestamp":1777644114426,"segment":0,"confidence":11.557362692355841,"asi":{"hypothesis":"Experience from the previous failed micro-splits suggests avoiding extra identity helpers may yield small wins without changing harness behavior. useChat accepts the tool array directly, and latestAgUiStatus was unused.","outcome":"Small primary improvement; typecheck confirms the direct tools array is accepted.","transferable_lesson":"Prefer direct data contracts over convenience wrappers when the wrapper is only an identity function in hot client harness code."}}
{"run":9,"commit":"c5b91e0","metric":140.64,"metrics":{"bundle_raw_kb":467.351,"js_files":9,"css_kb":0},"status":"keep","description":"Export TanStack Start handler directly from server entry","timestamp":1777644129743,"segment":0,"confidence":271.0469208211079,"asi":{"hypothesis":"Component observability shows the server entry wrapped the TanStack Start fetch handler without adding behavior. Removing this adapter should slightly reduce harness surface area and bundle output while preserving semantics.","outcome":"Tiny primary improvement; build and typecheck pass.","transferable_lesson":"AHE-style component audits can safely delete pass-through middleware when it has no observability or policy function."}}
{"run":10,"commit":"689d9ca","metric":140.6,"metrics":{"bundle_raw_kb":467.219,"js_files":9,"css_kb":0},"status":"keep","description":"Trim redundant false debug flags from chat server route","timestamp":1777644149567,"segment":0,"confidence":315.5870307167014,"asi":{"hypothesis":"Decision observability in the chat middleware should keep only active diagnostics. Explicit false debug fields add serialized code surface without changing behavior if defaults are false.","outcome":"Tiny primary improvement; error logging remains enabled through the custom logger.","risk_note":"Assumes TanStack AI debug defaults are false for omitted fields, consistent with the previous explicit configuration."}}
{"run":11,"commit":"689d9ca","metric":140.626,"metrics":{"bundle_raw_kb":467.357,"js_files":9,"css_kb":0},"status":"discard","description":"Factor tool label ternary into helper","timestamp":1777644178812,"segment":0,"confidence":422.2237442922489,"asi":{"hypothesis":"Replacing a long inline ternary with a helper might reduce repeated render code and improve component readability without changing behavior.","rollback_reason":"Primary metric regressed; helper function overhead outweighed any minification benefit for a single call site.","next_action_hint":"Do not factor single-use render expressions purely for bundle size. Only extract when there are multiple call sites or readability is worth neutral/slight cost."}}
{"run":12,"commit":"689d9ca","metric":140.779,"metrics":{"bundle_raw_kb":468.294,"js_files":9,"css_kb":0},"status":"discard","description":"Replace server tool Zod schemas with plain JSON Schema","timestamp":1777644218000,"segment":0,"confidence":516.5754189943666,"asi":{"hypothesis":"Using plain JSON Schema for all server tool definitions might remove Zod from the server bundle, mirroring the successful browser-side request_search_query change.","rollback_reason":"Primary metric regressed; Zod was apparently not materially bundled in the measured server output or the verbose JSON Schema literals outweighed any removal.","next_action_hint":"Keep Zod for server-only tools where it improves maintainability and inferred contracts. Plain JSON Schema is only beneficial for client-visible schemas."}}
{"run":13,"commit":"55ea2f4","metric":140.591,"metrics":{"bundle_raw_kb":467.185,"js_files":9,"css_kb":0},"status":"keep","description":"Remove StrictMode wrapper from production hydration entry","timestamp":1777644256709,"segment":0,"confidence":516.6256983240164,"asi":{"hypothesis":"The client entry's StrictMode wrapper is a development diagnostic component, not core harness behavior. Removing it from this tutorial production entry should slightly reduce client code without affecting production semantics.","outcome":"Tiny primary improvement; build and typecheck pass.","risk_note":"React StrictMode's extra development checks are no longer applied at runtime. If this project relies on StrictMode during local dev, consider a dev-only wrapper instead."}}
{"run":14,"commit":"36805d5","metric":140.571,"metrics":{"bundle_raw_kb":467.15,"js_files":9,"css_kb":0},"status":"keep","description":"Hydrate StartClient directly without startTransition wrapper","timestamp":1777644271925,"segment":0,"confidence":598.6796116504903,"asi":{"hypothesis":"The hydration entry can be a direct component handoff; startTransition is another pass-through wrapper that adds code but does not change steady-state chat harness behavior.","outcome":"Tiny primary improvement; build and typecheck pass.","risk_note":"If future startup work becomes expensive, a transition wrapper could be reintroduced for scheduling. Current entry has no visible pending UI to benefit from it."}}
{"run":15,"commit":"90f1140","metric":140.556,"metrics":{"bundle_raw_kb":467.101,"js_files":9,"css_kb":0},"status":"keep","description":"Remove scrollRestoration option from single-page chat router","timestamp":1777644301233,"segment":0,"confidence":711.6230769231017,"asi":{"hypothesis":"For this single-page chat tutorial, router scroll restoration is not a meaningful harness capability. Removing the option should slightly reduce route/router configuration surface without affecting current navigation behavior.","outcome":"Tiny primary improvement; build and typecheck pass.","risk_note":"If the app grows multiple scrollable routes, revisit scroll restoration as a UX feature rather than a default."}}
{"run":16,"commit":"90f1140","metric":140.582,"metrics":{"bundle_raw_kb":467.173,"js_files":9,"css_kb":0},"status":"discard","description":"Simplify follow-up custom event guard","timestamp":1777644329490,"segment":0,"confidence":719.9299610895597,"asi":{"hypothesis":"A trust-but-filter helper for server-generated follow-up events might be smaller than a Boolean type guard with Array.every validation while preserving runtime safety.","rollback_reason":"Primary metric regressed slightly; the filter helper added more code than the compact Boolean guard after minification/gzip.","next_action_hint":"Keep existing custom event guard. Avoid micro-optimizing validation code unless it removes a dependency or repeated branch."}}
{"run":17,"commit":"3461b6b","metric":140.512,"metrics":{"bundle_raw_kb":466.981,"js_files":9,"css_kb":0},"status":"keep","description":"Remove artificial delays from demo weather and stock tools","timestamp":1777644386540,"segment":0,"confidence":784.3644067796944,"asi":{"hypothesis":"AHE experience observability should report real tool progress, not synthetic latency. Removing demo-only sleeps should make tool runs faster and slightly shrink server harness code while preserving status events and outputs.","outcome":"Primary metric improved and the demo tools become more responsive; build and typecheck pass.","risk_note":"The AG-UI status panel may advance too quickly to notice for local demo weather/stock tools, but live Brave search still shows real latency."}}
{"run":18,"commit":"614c8da","metric":140.432,"metrics":{"bundle_raw_kb":466.693,"js_files":9,"css_kb":0},"status":"keep","description":"Compress chat system prompt while preserving tool policy","timestamp":1777644405000,"segment":0,"confidence":830.8071748879493,"asi":{"hypothesis":"Although AHE ablations caution against prompt-only overemphasis, the existing system prompt had redundant prose. A concise policy should preserve tool routing/citation behavior, lower server bundle text, and reduce prompt tokens per request.","outcome":"Primary metric improved; build and typecheck pass. This also slightly reduces per-chat prompt tokens without removing any tool instructions.","risk_note":"Need monitor real conversations for routing quality; if ambiguous search handling or demo-data disclaimers degrade, revert despite bundle win."}}
{"run":19,"commit":"614c8da","metric":0,"metrics":{"bundle_raw_kb":0,"js_files":0,"css_kb":0},"status":"crash","description":"Shorten tool descriptions and request-search schema descriptions","timestamp":1777644436196,"segment":0,"confidence":830.8071748879493,"asi":{"hypothesis":"Concise tool descriptions should preserve tool semantics while shrinking server/client schema text and reducing model prompt/tool tokens.","rollback_reason":"Edit introduced a syntax error in request-search-tool.ts, likely due a missing comma while replacing nested schema description fields.","next_action_hint":"Retry carefully with full-file inspection or smaller edits; the idea remains promising because prompt compression just improved the metric."}}
{"run":20,"commit":"da02ed8","metric":140.188,"metrics":{"bundle_raw_kb":466.112,"js_files":9,"css_kb":0},"status":"keep","description":"Shorten tool and schema descriptions while preserving semantics","timestamp":1777644459479,"segment":0,"confidence":725.61718750008,"asi":{"hypothesis":"Concise tool descriptions should retain enough routing/schema signal for the model while shrinking serialized tool contracts in client/server output and reducing request tokens.","outcome":"Primary metric improved; build and typecheck pass. The prior syntax-error attempt was corrected with targeted replacements.","risk_note":"Monitor tool-call quality; if the model stops choosing tools correctly, restore more descriptive wording even if bundle grows."}}
{"run":21,"commit":"196cb9f","metric":140.146,"metrics":{"bundle_raw_kb":466.039,"js_files":9,"css_kb":0},"status":"keep","description":"Compress model follow-up generation prompt","timestamp":1777644488693,"segment":0,"confidence":696.0374531835314,"asi":{"hypothesis":"The follow-up route prompt can be shorter while preserving the JSON-only contract and quality constraints, reducing server bundle text and per-call prompt tokens.","outcome":"Tiny primary improvement; build and typecheck pass.","risk_note":"Monitor generated follow-up quality for generic/repeated questions; concise prompt keeps the key constraints but less explanatory prose."}}
{"run":22,"commit":"196cb9f","metric":0,"metrics":{"bundle_raw_kb":0,"js_files":0,"css_kb":0},"status":"crash","description":"Shorten AG-UI chat status labels","timestamp":1777644528440,"segment":0,"confidence":696.0374531835314,"asi":{"hypothesis":"Shorter status labels should preserve progress observability while reducing server/client text.","rollback_reason":"Build crashed in TanStack route component split for /api/chat with a generated JSX parse error. The edit only changed strings, so this appears to trigger a fragile route-splitting edge case rather than a semantic TypeScript error.","next_action_hint":"Avoid further edits to status labels in src/routes/api/chat.ts unless first investigating TanStack Start route splitting. Focus on safer files or inspect generated split output."}}
{"run":23,"commit":"196cb9f","metric":140.171,"metrics":{"bundle_raw_kb":466.071,"js_files":9,"css_kb":0},"status":"discard","description":"Hoist Metric component style object","timestamp":1777644552996,"segment":0,"confidence":607.3267973856545,"asi":{"hypothesis":"Hoisting a reused inline style object in ToolWidget could reduce per-render allocation and maybe shrink emitted code.","rollback_reason":"Primary metric regressed slightly; the style object is only used in one component and gzip/minification handle the inline literal well.","next_action_hint":"Do not hoist single-use or low-reuse styles for bundle size. Larger CSS/class refactors would need a metric that includes CSS gzip to avoid shifting bytes out of JS."}}
{"run":24,"commit":"90ea49b","metric":140.12,"metrics":{"bundle_raw_kb":466.01,"js_files":9,"css_kb":0},"status":"keep","description":"Limit lightweight markdown links to http(s) URLs","timestamp":1777644569607,"segment":0,"confidence":535.7175792507074,"asi":{"hypothesis":"The chat assistant primarily cites web URLs; mailto markdown links are not a core harness need. Dropping mailto support from the focused renderer should slightly shrink client code while preserving citation links.","outcome":"Tiny primary improvement; build and typecheck pass.","risk_note":"Markdown mailto links now render as plain text. Acceptable for this chat/search tutorial unless email-link rendering becomes a requirement."}}
{"run":25,"commit":"6ba7a5f","metric":140.107,"metrics":{"bundle_raw_kb":465.951,"js_files":9,"css_kb":0},"status":"keep","description":"Compute filtered model options directly instead of useMemo","timestamp":1777644589946,"segment":0,"confidence":519.3296089385416,"asi":{"hypothesis":"Filtering the small model list directly can be simpler than a memoization hook. AHE favors deleting control machinery when the underlying operation is cheap and observable outcomes remain correct.","outcome":"Tiny primary improvement; typecheck/build pass. useMemo remains where it creates stable tool definitions or avoids heavier follow-up recomputation.","risk_note":"If model lists become extremely large, direct filtering each render may be revisited, but OpenRouter model counts are modest for UI rendering."}}
{"run":26,"commit":"6ba7a5f","metric":140.123,"metrics":{"bundle_raw_kb":465.999,"js_files":9,"css_kb":0},"status":"discard","description":"Replace heuristic follow-up useMemo with helper function","timestamp":1777644632592,"segment":0,"confidence":429.3764434180493,"asi":{"hypothesis":"Deleting another memoization hook for cheap heuristic follow-up generation might simplify the component and reduce bundle size.","rollback_reason":"Primary metric regressed. Moving the logic to a helper increased gzip slightly despite similar raw size; the existing inline useMemo is better for both runtime and bundle here.","next_action_hint":"Keep useMemo for heavier derived data tied to messages. The direct-filter win does not generalize to multi-step message scanning."}}
{"run":27,"commit":"be0d89e","metric":140.079,"metrics":{"bundle_raw_kb":465.812,"js_files":9,"css_kb":0},"status":"keep","description":"Shorten localStorage keys for chat settings","timestamp":1777644655005,"segment":0,"confidence":366.0944881889898,"asi":{"hypothesis":"Local memory keys are part of the harness contract but do not need verbose prefixes in a tutorial app. Short keys should preserve future persistence behavior while shrinking client literals.","outcome":"Small primary improvement; build and typecheck pass.","tradeoff":"Existing browser preferences under old keys will not be migrated, so users may need to reselect model/settings once. A migration would add code and outweigh the bundle win."}}
{"run":28,"commit":"36b956e","metric":140.04,"metrics":{"bundle_raw_kb":465.643,"js_files":9,"css_kb":0},"status":"keep","description":"Shorten internal custom event names for follow-ups and statuses","timestamp":1777644683612,"segment":0,"confidence":284.9218989280282,"asi":{"hypothesis":"Custom event names are internal client/server harness contracts. Shortening them should preserve behavior while reducing repeated literals across chat route, tools, and UI event handling.","outcome":"Small primary improvement; build and typecheck pass. Event payload shape and UI behavior are unchanged.","risk_note":"External code listening for demo.status/tool.status/followups.generated would break. In this tutorial app those names are internal; document if they become public API."}}
