{"run":186,"commit":"ed72d7e","metric":136.085,"metrics":{"bundle_raw_kb":451.16,"js_files":9,"css_kb":0},"status":"keep","description":"Remove cancellation guard from one-time model catalog load effect","timestamp":1777649768751,"segment":0,"confidence":81.63468013467899,"asi":{"hypothesis":"Chat is the root page component and the model catalog load effect runs once after settings load. The unmount cancellation guard is defensive but unlikely to matter in this tutorial; removing it simplifies client model-loading middleware.","outcome":"Primary metric improved; build and enhanced checks pass.","risk_note":"If Chat can unmount while /api/models is in flight, state may be set after unmount. Current single-page app keeps Chat mounted."}}
{"run":187,"commit":"0859375","metric":136,"metrics":{"bundle_raw_kb":450.815,"js_files":9,"css_kb":0},"status":"keep","description":"Remove duplicate-request guard for model follow-up generation","timestamp":1777649802305,"segment":0,"confidence":81.67185527976409,"asi":{"hypothesis":"The model follow-up effect dependencies already prevent rerunning for unchanged messages during normal renders. The JSON.stringify request-key guard mainly prevents refetching when toggling modes back to model, which is acceptable for a simpler harness.","outcome":"Primary metric improved substantially; build and enhanced checks pass. Removed followUpRequestKeyRef and request-key serialization.","risk_note":"Toggling follow-up mode away and back to Model may refetch follow-ups for the same conversation. This is acceptable for optional follow-ups but could be restored if API-call minimization is prioritized."}}
{"run":188,"commit":"bd77dc3","metric":135.947,"metrics":{"bundle_raw_kb":450.659,"js_files":9,"css_kb":0},"status":"keep","description":"Remove cancellation guard from optional model follow-up request","timestamp":1777649834443,"segment":0,"confidence":81.6820857863756,"asi":{"hypothesis":"Model-generated follow-ups are optional UI hints. Removing cancellation bookkeeping from the follow-up fetch effect simplifies client async middleware, accepting that a stale response may briefly update optional suggestions.","outcome":"Primary metric improved; build and enhanced checks pass.","risk_note":"If the user changes conversation/mode while a follow-up request is in flight, stale follow-ups may be applied. Restore cancellation if follow-up consistency matters more than bundle size."}}
{"run":189,"commit":"bd77dc3","metric":135.954,"metrics":{"bundle_raw_kb":450.607,"js_files":9,"css_kb":0},"status":"discard","description":"Use last serializable message to detect assistant follow-up readiness","timestamp":1777649872543,"segment":0,"confidence":81.30598576810347,"asi":{"hypothesis":"Model follow-up generation only needs to run after the latest serializable message is from the assistant. Checking `.at(-1)` might be smaller than reverse/find for any assistant.","rollback_reason":"Primary metric regressed slightly and semantics narrow from 'any assistant exists' to 'last serializable message is assistant'. Not worth keeping.","next_action_hint":"Keep reverse/find assistant guard unless redesigning follow-up triggering semantics."}}
{"run":190,"commit":"7a05e4d","metric":135.921,"metrics":{"bundle_raw_kb":450.565,"js_files":9,"css_kb":0},"status":"keep","description":"Omit Content-Type header from internal follow-up fetch","timestamp":1777649907026,"segment":0,"confidence":80.88759367194051,"asi":{"hypothesis":"The /api/followups route calls request.json(), which parses the request body without needing the client to send an explicit Content-Type header. Removing the internal fetch header shrinks client code.","outcome":"Primary metric improved; build and enhanced checks pass.","risk_note":"Some server frameworks require Content-Type for JSON parsing, but the Fetch API Request.json() used here reads the body directly. Restore if runtime parsing fails."}}
{"run":191,"commit":"a6a23b6","metric":135.917,"metrics":{"bundle_raw_kb":450.537,"js_files":9,"css_kb":0},"status":"keep","description":"Simplify optional follow-up fetch failure path","timestamp":1777649946122,"segment":0,"confidence":80.55555555555536,"asi":{"hypothesis":"For optional model follow-ups, non-OK responses can pass undefined to the payload handler instead of allocating a `{followUps: []}` object, and the catch handler can be a concise setter call.","outcome":"Tiny primary improvement; build and enhanced checks pass.","risk_note":"Behavior remains fallback-to-empty for non-OK and network errors."}}
{"run":192,"commit":"b4d201c","metric":135.894,"metrics":{"bundle_raw_kb":450.479,"js_files":9,"css_kb":0},"status":"keep","description":"Trust internal follow-up API response array shape","timestamp":1777649973842,"segment":0,"confidence":80.2419488026416,"asi":{"hypothesis":"The /api/followups route always returns `{followUps: Array<string>}` for OK responses. Replacing Array.isArray validation with nullish fallback shrinks client code while preserving normal internal behavior.","outcome":"Primary metric improved; build and enhanced checks pass.","risk_note":"Malformed follow-up API responses could set a non-array value. Current route controls the response shape."}}
{"run":193,"commit":"e24a457","metric":135.894,"metrics":{"bundle_raw_kb":450.479,"js_files":9,"css_kb":0},"status":"keep","description":"Update autoresearch notes with dev-server fix and recent status/follow-up lessons","timestamp":1777650023782,"segment":0,"confidence":80.01070399341286,"asi":{"hypothesis":"Persisting recent AHE lessons in autoresearch.md improves future decision observability without changing bundle output.","outcome":"Benchmark and enhanced checks pass; metric unchanged as expected for documentation-only update.","memory_update":"Documented default.fetch runtime fix/check, AG-UI status simplification, and optional follow-up request tradeoffs."}}
{"run":194,"commit":"c45a3a0","metric":135.85,"metrics":{"bundle_raw_kb":450.024,"js_files":9,"css_kb":0},"status":"keep","description":"Remove redundant inherited font styles from controls","timestamp":1777650086895,"segment":0,"confidence":79.8169129720861,"asi":{"hypothesis":"The root main element already establishes the system font for the chat UI. Repeating fontFamily/font inherit on many native controls and buttons adds inline style bytes with little value.","outcome":"Primary metric improved; build and enhanced checks pass.","risk_note":"Some browsers may render form controls with their native default font instead of inherited font. If visual consistency matters, restore specific font styles."}}
{"run":195,"commit":"85339d4","metric":135.779,"metrics":{"bundle_raw_kb":449.929,"js_files":9,"css_kb":0},"status":"keep","description":"Shorten root system font stack","timestamp":1777650133538,"segment":0,"confidence":79.1602929210741,"asi":{"hypothesis":"`system-ui,sans-serif` preserves the intended native sans-serif look closely enough for this tutorial while removing verbose platform-specific font names from inline styles.","outcome":"Primary metric improved; build and enhanced checks pass.","risk_note":"Font selection may differ slightly on some platforms compared with the longer stack."}}
{"run":196,"commit":"85339d4","metric":135.787,"metrics":{"bundle_raw_kb":449.956,"js_files":9,"css_kb":0},"status":"discard","description":"Hoist OpenRouter thinking detection terms array","timestamp":1777650165661,"segment":0,"confidence":78.45806451612846,"asi":{"hypothesis":"Thinking detection terms are reused for every model in the catalog, so hoisting the array may improve runtime and potentially gzip.","rollback_reason":"Primary metric regressed; the hoisted binding costs more in compressed output. Runtime benefit is not the primary target.","next_action_hint":"Keep the terms array inline inside supportsOpenRouterThinking."}}
{"run":197,"commit":"34daf36","metric":135.777,"metrics":{"bundle_raw_kb":449.92,"js_files":9,"css_kb":0},"status":"keep","description":"Remove Boolean wrapper from thinking-support heuristic","timestamp":1777650213779,"segment":0,"confidence":76.96993670886103,"asi":{"hypothesis":"supportsOpenRouterThinking feeds an optional boolean field, so returning the OR expression directly is sufficient; undefined behaves like false at the later Boolean(...) use site.","outcome":"Tiny primary improvement; build and enhanced checks pass.","risk_note":"Function may return undefined when supported_parameters is absent and no name term matches. This is compatible with optional supportsThinking semantics."}}
{"run":198,"commit":"5dbaae3","metric":135.775,"metrics":{"bundle_raw_kb":449.913,"js_files":9,"css_kb":0},"status":"keep","description":"Use double-negation for free model id heuristic","timestamp":1777650255710,"segment":0,"confidence":75.07098765432144,"asi":{"hypothesis":"The free-model heuristic only needs a boolean coercion of an optional endsWith call. `!!` should minify/gzip slightly better than `Boolean(...)`.","outcome":"Tiny primary improvement; build and enhanced checks pass.","risk_note":"No semantic change: missing id still maps to false."}}
{"run":199,"commit":"4117b83","metric":135.754,"metrics":{"bundle_raw_kb":449.869,"js_files":9,"css_kb":0},"status":"keep","description":"Inline OpenRouter model cache TTL constant","timestamp":1777650272451,"segment":0,"confidence":74.45524100994633,"asi":{"hypothesis":"The model cache TTL is only used once. Inlining the numeric literal removes a single-use constant binding while preserving the 10-minute cache behavior.","outcome":"Primary metric improved; build and enhanced checks pass.","risk_note":"The TTL literal is less self-documenting than a named constant."}}
{"run":200,"commit":"b35a83c","metric":135.752,"metrics":{"bundle_raw_kb":449.862,"js_files":9,"css_kb":0},"status":"keep","description":"Use double-negation for OpenRouter model id filter","timestamp":1777650290258,"segment":0,"confidence":73.83535660091138,"asi":{"hypothesis":"The model id filter only needs boolean coercion. `!!model.id` should be marginally leaner than `Boolean(model.id)` with identical filtering behavior.","outcome":"Tiny primary improvement; build and enhanced checks pass.","risk_note":"No semantic change for truthy string ids."}}
{"run":201,"commit":"8cafd52","metric":135.748,"metrics":{"bundle_raw_kb":449.831,"js_files":9,"css_kb":0},"status":"keep","description":"Shorten OpenRouter model catalog fetch error text","timestamp":1777650305671,"segment":0,"confidence":73.75445244410814,"asi":{"hypothesis":"The model catalog failure only needs to communicate that OpenRouter model loading failed plus a status code. Dropping statusText and verbose wording preserves actionable diagnostics with fewer bytes.","outcome":"Tiny primary improvement; build and enhanced checks pass.","risk_note":"Error detail is less descriptive; statusText is no longer shown in UI/logs."}}
{"run":202,"commit":"4baee73","metric":135.744,"metrics":{"bundle_raw_kb":449.826,"js_files":9,"css_kb":0},"status":"keep","description":"Shorten fallback models API error text","timestamp":1777650319424,"segment":0,"confidence":73.45132075471761,"asi":{"hypothesis":"The fallback non-Error branch in /api/models is rare and only needs a concise diagnostic. Shortening it preserves user-visible failure indication with fewer bytes.","outcome":"Tiny primary improvement; build and enhanced checks pass.","risk_note":"Fallback error is less specific, but real Error messages still pass through."}}
{"run":203,"commit":"4baee73","metric":135.764,"metrics":{"bundle_raw_kb":449.866,"js_files":9,"css_kb":0},"status":"discard","description":"Inline request-search input schema into tool definition","timestamp":1777650340886,"segment":0,"confidence":73.25780955965345,"asi":{"hypothesis":"The request-search input schema is used once, so inlining it into the toolDefinition call may remove a single-use binding.","rollback_reason":"Primary metric regressed; the separate const gzips better or gives bundler/minifier a better shape.","next_action_hint":"Keep requestSearchInputSchema as a local constant."}}
{"run":204,"commit":"ca93464","metric":135.43,"metrics":{"bundle_raw_kb":449.329,"js_files":8,"css_kb":0},"status":"keep","description":"Use a minimal client-side request-search tool object","timestamp":1777650445051,"segment":0,"confidence":73.19115442278843,"asi":{"hypothesis":"The chat client only reads client tool name and execute. Creating the request_search_query client tool object locally avoids importing the server toolDefinition module into Chat while preserving the server tool schema in lib/tools.","outcome":"Primary metric improved significantly and JS chunk count dropped from 9 to 8; build and enhanced checks pass.","risk_note":"This relies on the current TanStack AI client accepting a structurally compatible client tool object. If the client starts using description/inputSchema/__toolSide semantically, revisit this manual object."}}
{"run":205,"commit":"6bad1d9","metric":135.377,"metrics":{"bundle_raw_kb":449.212,"js_files":8,"css_kb":0},"status":"keep","description":"Trim manual client request-search tool to name and execute","timestamp":1777650460640,"segment":0,"confidence":72.122554448135,"asi":{"hypothesis":"ChatClient's runtime only reads clientTool.name and clientTool.execute for automatic client tool execution. A local `as any` cast lets the client tool object omit unused metadata fields.","outcome":"Primary metric improved; build and enhanced checks pass.","risk_note":"This is a deliberate structural contract shortcut. Add metadata back if TanStack AI client begins using client tool schemas/descriptions at runtime."}}
{"run":206,"commit":"de350a0","metric":135.376,"metrics":{"bundle_raw_kb":449.205,"js_files":8,"css_kb":0},"status":"keep","description":"Use double-negation for selected model thinking availability","timestamp":1777650482110,"segment":0,"confidence":71.8316176470596,"asi":{"hypothesis":"The selected-model thinking flag only needs boolean coercion. `!!` should be marginally smaller than `Boolean(...)`, consistent with earlier heuristic wins.","outcome":"Tiny primary improvement; build and enhanced checks pass.","risk_note":"No semantic change for optional supportsThinking."}}
{"run":207,"commit":"8624cba","metric":135.373,"metrics":{"bundle_raw_kb":449.166,"js_files":8,"css_kb":0},"status":"keep","description":"Replace remaining simple Boolean coercions with double-negation","timestamp":1777650505169,"segment":0,"confidence":71.62316715542501,"asi":{"hypothesis":"Several remaining Boolean(...) calls only coerce optional/truthy values. Replacing them with `!!` should shrink emitted JS without changing truthiness semantics.","outcome":"Tiny primary improvement; build and enhanced checks pass.","risk_note":"No intended semantic change. Kept readLocalStorageBoolean function name because it is descriptive API text rather than a runtime coercion call."}}
{"run":208,"commit":"90bd93f","metric":135.315,"metrics":{"bundle_raw_kb":449.066,"js_files":8,"css_kb":0},"status":"keep","description":"Remove unused fallback branch from boolean localStorage reader","timestamp":1777650545952,"segment":0,"confidence":71.40394448502559,"asi":{"hypothesis":"The boolean localStorage reader is only called without a custom fallback, so missing keys should default to false. Removing the generic fallback path simplifies persisted settings bootstrap.","outcome":"Primary metric improved; build and enhanced checks pass.","risk_note":"Future callers needing true-by-default booleans must add explicit handling instead of relying on this helper."}}
{"run":209,"commit":"dba2ce6","metric":135.315,"metrics":{"bundle_raw_kb":449.066,"js_files":8,"css_kb":0},"status":"keep","description":"Add adr-tools records for subagent spawning routing policy","timestamp":1777663981624,"segment":0,"confidence":71.04069767441837,"asi":{"hypothesis":"Documenting the subagent-spawning decision with adr-tools improves decision observability without affecting the runtime bundle. The ADR should capture paper-backed routing criteria and guardrails for when to spawn agents.","outcome":"Initialized doc/adr with adr-tools and added ADR 0002 for structured subagent routing. Benchmark and enhanced checks pass; bundle metric unchanged as expected.","sources":"arXiv:2604.25850, 2604.06696, 2603.11011, 2408.02248, 2505.18286, 2503.13657, 2410.02189, 2511.01854, 2410.22457"}}
{"run":210,"commit":"dba2ce6","metric":135.316,"metrics":{"bundle_raw_kb":449.039,"js_files":8,"css_kb":0},"status":"discard","description":"Avoid duplicate free-model lookup during catalog load","timestamp":1777664027423,"segment":0,"confidence":70.42651296829945,"asi":{"hypothesis":"The model catalog load fallback finds the first free model twice. Storing it once should reduce client code while preserving the default preference for a free model.","rollback_reason":"Primary metric regressed by 0.001kb even though raw bytes fell; gzip favors the duplicated inline find expression here.","next_action_hint":"Keep the duplicated free-model lookup unless model selection semantics are redesigned."}}
{"run":211,"commit":"c91a68f","metric":135.313,"metrics":{"bundle_raw_kb":449.022,"js_files":8,"css_kb":0},"status":"keep","description":"Compute heuristic follow-ups directly instead of memoizing","timestamp":1777664056568,"segment":0,"confidence":70.04944464349633,"asi":{"hypothesis":"Heuristic follow-up generation is lightweight compared with rendering and only used for optional suggestion text. Removing the useMemo dependency array around it should simplify client code without meaningful runtime cost.","outcome":"Tiny primary improvement; build and enhanced checks pass.","risk_note":"Heuristic follow-ups are recomputed on every render instead of only when loading/messages change. The work is small string scanning over current messages."}}
{"run":212,"commit":"e70d229","metric":135.279,"metrics":{"bundle_raw_kb":448.922,"js_files":8,"css_kb":0},"status":"keep","description":"Remove memoization around manual client search tool object","timestamp":1777664077912,"segment":0,"confidence":69.6992159657866,"asi":{"hypothesis":"The manual request_search_query client tool is tiny and useChat already updates options each render. Removing useMemo dependency scaffolding should shrink client code while preserving client tool execution.","outcome":"Primary metric improved; build and enhanced checks pass.","risk_note":"The client tool object identity now changes on every render, which may cause ChatClient to refresh its tool map more often. Acceptable for one small interactive tool; restore memoization if runtime profiling shows churn."}}
{"run":213,"commit":"e70d229","metric":135.279,"metrics":{"bundle_raw_kb":448.922,"js_files":8,"css_kb":0},"status":"discard","description":"Remove now-unused useMemo import from Chat","timestamp":1777664103497,"segment":0,"confidence":67.74367855905717,"asi":{"hypothesis":"After removing the remaining useMemo call sites, dropping the named import should reduce source/emitted code.","rollback_reason":"Primary metric was unchanged and raw output was unchanged; import specifier was already eliminated by the build. No runtime benefit.","next_action_hint":"Do not spend experiments on unused type/import cleanup unless typecheck or lint requires it."}}
{"run":214,"commit":"200a4dc","metric":135.273,"metrics":{"bundle_raw_kb":448.904,"js_files":8,"css_kb":0},"status":"keep","description":"Let localStorage reader return null directly","timestamp":1777664122829,"segment":0,"confidence":66.1664411366708,"asi":{"hypothesis":"All readLocalStorage call sites already use nullish coalescing or direct equality. Returning localStorage.getItem's native string|null result avoids converting null to undefined without changing persisted settings behavior.","outcome":"Primary metric improved; build and enhanced checks pass.","risk_note":"Helper now returns null for missing keys instead of undefined. Current call sites handle both via ?? or equality checks."}}
{"run":215,"commit":"0a32105","metric":135.248,"metrics":{"bundle_raw_kb":448.812,"js_files":8,"css_kb":0},"status":"keep","description":"Inline boolean localStorage reads at their two call sites","timestamp":1777664140284,"segment":0,"confidence":66.16097396009421,"asi":{"hypothesis":"After simplifying the boolean localStorage helper to a single equality check with only two call sites, inlining it should remove a helper boundary while preserving missing-key=false behavior.","outcome":"Primary metric improved; build and enhanced checks pass.","risk_note":"Boolean read behavior is now duplicated at two settings bootstrap lines. Re-extract if more boolean settings are added."}}
{"run":216,"commit":"a81c407","metric":135.238,"metrics":{"bundle_raw_kb":448.787,"js_files":8,"css_kb":0},"status":"keep","description":"Inline localStorage getItem calls during settings bootstrap","timestamp":1777664166427,"segment":0,"confidence":65.70114170584266,"asi":{"hypothesis":"After boolean reads were inlined, readLocalStorage has only four simple bootstrap call sites. Direct localStorage.getItem calls may gzip better than the helper boundary.","outcome":"Primary metric improved; build and enhanced checks pass. Removed the readLocalStorage helper entirely.","risk_note":"Settings bootstrap is slightly more coupled to localStorage. Reintroduce helper if storage migrations, defaults, or SSR-safe access expand."}}
